11Na lau kama Mwenyezi Mungu angeli wafanyia watu haraka kuwaletea shari kama wanavyo jihimizia kuletewa kheri, bila ya shaka wangelisha timiziwa ajali yao.	10:11 And were Allah to hasten the evil for mankind (hasten mankind's punishment) just as they would hasten the good for themselves (from God), their term would have been fulfilled.
Inaonekana kama gridi 12 kwa 15 uchaguzi.	Choose between 2 to 12 cups.
Wewe ni nia ya kurejea kwa nchi yako kwa muda mdogo wa miaka miwili baada ya kukamilisha programu; na	Be committed to returning to your home country for a period of two (2) years after completion of the program; and
Na kwa ajili hii wakaanza kupeleka ulevi na sigara bure huko Hispania.	So they started sending alcohol and cigarettes to Spain free of cost.
Yeye ni wa Rosaceae ya familia na alikuja kwetu kutoka Amerika ya Kaskazini.	He is a family member who came with us from South Africa.
Na akiitumia vibaya kama anavyoitumia Jiwe basi twafaaaaa!	When used as a mouthwash it relieves toothache.
■ Mlimwengu ni mwanawe.	"""The world is yours Son."""
Prototypes ya kwanza ya roketi mpya tayari imejengwa.	The first prototype devices have already been developed.
next time mara nyingine	The next night Spet.
"mwili wa mwanadamu!"""	"the human soul!"""
kama za kwako maana hata mimi nilikuwa	for other people like me when I was
Matatizo yanapotokea katika utendaji zinahitajika jitihada za haraka kusaidia kutafuta ufumbuzi.	When issues arise, they work diligently to find a solution quickly.
Sio wanawake wengi wana mawazo kama yako...	Not many women like you...
Halafu mtoto wa miaka 17 akikuibia unashindwaje kujua mpaka manenoooo?	But how can you tell a seventeen-year-old boy that he must not get excited?
"""Ofisi ya CAG si 'clean' (safi) kama mnavyofikiria."	"Commercial soaps are not as ""clean"" as you might think."
"""Unataka kwenda wapi tena,"" nilimuuliza kwa mshangao."	"""Do you want to go again,"" I asked him."
vivyo hivyo adv. exactly the same.	EDD is exactly the same.
Kwanza kabisa, tutachukua ladha ya nyama.	First we will make the pastry crust.
Twende katika maeneo mengine.	We are going to go other places.
Enter Kizuna.	Dig into the Word.
kwa sasa ni ngumu atleast awe na form four	Currently, there are at least four well
Gharama ni kizuizi kikubwa.	cost is a major challenge.
maarufu kwa jina la Sugu alisema kuwa hali hiyo imetokana na hali ya kitu hiyo	sylvania. disclosed that the name of
Vipi hufahamu ewe mwanafalsafa?	What do you consider to be a philosopher of math?
"""Msiwe na Wasiwasi Juu ya Kesho"""	"""Don't worry about tomorrow.."""
Mumewe alipopata kile alichokifanya, alikasirika sana, lakini sasa alikuwa amekwisha kuchelewa sana kuokoa sufuria, kama kijana huyo alikuwa tayari yuko mbali sana katika msitu.	When her husband found what she had done, he was very angry, and beat her soundly; but it was now too late to recover the pot, as the young man was already far away in the forest.
sasa hawa watz wamekuwa kondoo.	So the Wachowski brothers are now sisters.
Na kama si neno lililotangulia kutoka kwa Rabb wako; bila shaka ingehukumiwa baina yao katika yale waliyokuwa kwayo wakikhitilafiana.	Were they not to do so, they assert, the first of their fears would surely become a reality, and they would thus be doubly damned.
Mimi Wewe Hoteli Sabuni Mzigo	I am a citizen of Zolfo
Inter Milan imemwambia mshambuliaji wa Argentina, Mauro Icardi, 26, kuwa hatacheza kwa miaka miwili ikiwa ataendelea kusisitiza kusalia katika klabu hiyo hadi mkataba wake utakapokamilika.	Inter Milan have told Argentina striker Mauro Icardi, 26, that he will not play for two years should he insist on running down his contract at the club.
Hii itakusaidia kuelewa mambo mbalimbali yanayohusiana na mchezo husika ili uweze kuweka mikeka ya ushindi.	This will help you to understand how many points you will be earning for playing the different games.
Which means, watu bado wamelala kuhusu hii ishu.	Seriously, people are still raving about them.
Biaashara ya Watum, ilikuwa mbaya sana katika karne ya 19.	Slave trade was rampant in the 19th century.
"Akamjibu, ""Naam, mimi ndiye mtumishi wako."""	"And she says ""I'm your female servant."""
uwiano wa 0 ina maana hakuna uhusiano kati ya sarafu jozi lipo.	A correlation of 0 means that there is no relationship between assets.
"Hivyo akasema Sahnuun: ""Kufa kama unataka."	"So Sammy Snail said, ""Do as you wish."""
Huenda usiweze kutatua tatizo lake, lakini unaweza kumwonyesha kwamba unajali.	You can't fix all problems, but you can show your support.
challenge za uchumi wakati huo.	economic problems of that time.
Real Madrid iko katika kiwango cha juu!	Real Madrid have been at a great level.
"""Kwa maana kwa ajili yetu mtoto amezaliwa, tumepewa mtoto mwanamume, nao utawala utakuwa mabegani mwake."	"""For unto us a Child is born; Unto us a Son is given; And the Government shall be upon His shoulder."
Ngoja niondoke zangu kabla suruali haijalowa na kupasuka.	I'll stop here before I start raving and drooling.
Mtoto Mwenye Umri wa Miaka 2 Amuua Mamake kwa Bastola, Babake Ashtakiwa	a two-year-old child dies, his father in police custody for homicide
Ukweli ni kuwa siamini kuwa	the truth is I don't believe
Jukata Yatafuta Suluhu	S. Julius is faced with the problem
Pengine siku ina masaa 48?	If only a day had 48 hours.
Pata 40% Toa kwenye Kituo cha Smith cha Psychic	30% to 70% Off at Uncle Pete's
aliongeza, kwamba Urusi orbital kundi kwa sasa inasimamia katika zaidi ya 130 uendeshaji spacecraft, ambapo zaidi ya 80% Wao ziko katika kituo cha udhibiti.	He added, the Russian orbital grouping today is more 130 existing spacecraft, of these, more than 80% are in the Management Center.
"""Ninaamini hilo, mkuu."	"""I know that, Gran."
Kwa bei, kuna chaguo bora huko nje.	For the price, there are better ones out there.
Kualitas ya honda thailand... Kuantitas ya ahm..	The Fall of Rome...again.
Wale ambao hawasafishwe hawawezi kupata pendeleo hilo milele.	In contrast, nondisabled people might not always have that privilege.
Kule nchini Uchina magari binafsi wakati ule yalikuwa machache kweli.	China cars, meanwhile, was virtually unheard of.
Inatazamiwa kuwa mapatano hayo yataimarisha biashara ya Iran katika uga wa kimataifa.	This project is supposed to significantly boost China's international trade ties.
saa moja na nusu mchana	one and one-half hours each day
2.0 - Hakuna Academy	Sep. 29 - No school
Naamini Kimaro hataenda huko nasikia walimfanyia kitu mbaya kwenye shamba lake	And I will dare to dream that I will hear it played at his wedding.
"(Mtume) akajibu: ""Ni Mama yako,"" akasema: kisha nani?"	"Dad said, ""who is the mother?"""
kitabu hiki ambacho hapo awali kilitangazwa kwa lugha ya Kifaransa.	The book was initially published in French.
Haitoki karatasi ya sahihi 70 hapa.	There is not an official seventy-one card.
Nisamehe mimi na ndugu yangu na utuingize katika rehema yako na wewe ni mwenye kurehemu kushinda wote wenye kurehemu.	He said: 'My Lord, forgive me and my brother, and let us enter Your mercy!
Je, wataweza kuridishiwa gharama ambazo wamekuwa wakizitumia kujinunulia uniform zao wenyewe?	Will there be any money left to pay for their own aspirations?
Yaani kwa ufupi ninaomba uelezee mpangilio mzima wa system ya web host.	I wish to make a particular appeal for the widening of the infrastructure system of payments.
Ukweli ni kwamba Mungu alimuumba mwanadamu akiwa na lengo zuli sana, yaani alitaka amuakilishe duniani.	When God created humans He had a purpose which he wants to achieve with the creation of man.
Don't Wake Me Up _ Ali's Kitchen	Don't Give Up _ Church of the Harvest
Kwahiyo hiyo nayo ni series....	It is also a new series...
453, ambapo masimulizi kama hayo hayo	45:3, where on that
kure kwetu ni raha sana.	The outside is very pleasant.
Mafuta yote ya Sudan Kusini yatapitia hapo.	The southern woods are all on fire.
Rehema Gumbo (kushoto) akimuhudumia mwanachama.	Blessed is he Whose Righteousness
Huko kweru ni moja tu mkuu	There is only one Supreme
"8 Watu wote wakajibu kwa pamoja, ""Tutafanya kila kitu BWANA alichokisema."""	"8 All the people answered together and said, ""All that the LORD has spoken we will do."""
Rafiki ya dada yangu	A friend of my sister
"Akikataa kitu usimuwekee tena, haya mtoe huyo mdoli wako."""	"If you are looking for a gun, look no more, this is your gun."""
Maana yake ni hiyo hiyo kwa lugha zote mbili.	meaning in both these languages.
"Mkwe wa Musa Yethro alikuwa ni kuhani, hivyo Musa aliishi na kuhani kwa miaka ""40'."	The teacher (Jan) said that Moses was a shepherd for 40 years.
Hii wizara hakuna wanoijua?	The Secretary of State does not know that?
Na katika tukio lingine dubu alivamia kondoo, lakini Daudi alimuua dubu huyo pia!	and, at another time, a mountain lion, and David killed them both.
Zaidi ya wageni 1,000,000 wamekaa huko Los Angeles.	Over 20 million citizens live in Los Angeles.
Sauti inayosifu yapasua mbingu.	A roaring sound shook the sky.
Utakuwa umeona uwepo wa ufunguo karibu na fimbo ya furaha: hii ni usanidi uliowekwa tayari.	You see signs of heat exhaustion: This is the early stage of heat stroke.
Amesema kwamba yeye anamtaka Mume yule ambaye ni Mdogo kuliko...	He wants her to look younger than him...
Kesi bado ipo Mahakamani na account zilikuwa freezed na Bank kuu.	invoices, and bank statements were kept.
Bila shaka wale waliokufuru miongoni mwa watu waliopewa Kitabu na washirikina wataingia katika moto wa Jahannam; wakae humo milele; hao ni waovu wa viumbe.	[098:006] But the unbelievers among the people of the Book, and among the Polytheists, shall go into the fire of Gehenna to abide therein for aye.
Hakuna hata tatu maoni juu ya habari hii.	There is no three ways about it.
Kesi 10 za unyanyasaji wa kijinsia zimepata mafanikio makubwa Mahakamani-Polisi	six high-profile corruption scandals affected the political community
Ghadhabu na huzuni zilitanda kwenye mtandao wa kijamii wa Weibo pale taarifa za kifo cha Dokta Li zilipotangazwa siku ya Alhamisi.	An outpouring of support and condolences for Shandling began appearing on social media immediately following news of the comedian's death yesterday.
Ms Lalitha User	The HMI allows the operator
Hatuendi kinyume na chochote katika waliokuwa wakiamini.	We are not against what others believe.
Hakuweza kutia kikomo katika ujumbe wake bali aliongeza na kusema kuwa	He was unable to raise his CO, but was able to talk
Kwa hivyo tunakualika kwa dhati wewe na kampuni yako kututembelea.	We encourage you and your family to come visit us.
"""Nitakuambia ukifika hapa'"" alijibu."	"""I will send you there,"" it responded."
Tunao fuga kitimoto hatutakiwi hapa...	Kimchi isn't going to be posted on here..
Hasarius Sim.	Silmarillion at all.
Kwanza hana adabu, ana nia mbaya ya kutaka kunidhalilisha mimi kwamba sijui kuvaa.	She doesn't know, he thought with sudden bitterness, that I had no power to change anything.
Hizi ndio website zetu za serikali.	These are government websites.
Ni nani au ni wapi naweza kusaidiwa hili?	What or who am I to do this?
Na ulicchomwomba hasa Mungu ni nini?	What do you really want in God?
Nasali kwa Mungu anipe ufunuo wa lipi niseme, niseme kwa nani na ili iweje.	I prayed to god to speak to me about what to do with my life and where to go.
Hizi ni miongoni mwa nick nazozikumbuka.	That's how we intend to remember Nick.
Nimejaribu kuifuatilia kila mahali lakini ninatupwa huku na kule.	I have tried to draw and I am all over the place.
Naomba APPS inayonirudishia deleted photos	A reliable tool for recovery of deleted photos
(b) Kuongea na waandishi wa habari (Press conference) kuwaeleza kuhusu kampeni	(k) dialogue with the public to convey the operator's
Antoine: Sawa, ninafurahi sana kuona unaniuliza.	ken: I am so happy that you asked me.
Ni lazima tuanze kwa kujiuliza kile tunachoamini kuhusu mafanikio, yaani kupata kile tukitakacho maishani.	We must be confident about what we desire to achieve in life.
Baadhi ya watu wetu wanaoishi katika mazingira ya hali ya hewa iliyosumishwa huko mijini wangeweza kunufaika kwa kujipatia ekari chache za ardhi hii.	Those who live in smaller homes in the city could use all the corner space available.
Mazungumzo hayo yalifanyika jana alhamisi.	In this report, Jana is interviewed.
Ndugu zangu, leo nilienda kumtembelea dada yangu mmoja (mtoto wa mama mkubwa) ameolewa eneo la Pugu huku Dar.	I have a brother who is currently staying with my grandparents and a sister with me in the Lingap Center.
Kuna namna ambavyo (more...)	There is something so (more...)
Fikia mfumo wako wa hydroponic kutoka popote	Control Your Water Heating From Anywhere In The World
Waambie kimenuka mambo fire	Tell a story by the fire
Ni tofauti na timu nyingine yoyote.	That's different than any other tools.
Unaweza kutumia simu za mkononi yako kufanya malipo pia.	You can also use your smartphone to earn money.
Nitakuambia ni kwa nini: ni vigumu kumshawishi asiye na kiu kunywa maji.	Someone needs to explain to me why tapping the tainted water doesn't make you a terrorist.
Ikiwa unataka kuomba kwa familia, hii ndiyo sala sahihi kwa wafu.	If you have been praying for the peace of Israel, this is a direct answer to your prayers.
oh.... i am gonna miss this awesome pair!!!!! best of luck to them for the rest of the life ilitumwa zaidi ya mwaka mmoja uliopita	oh.... i am gonna miss this awesome pair!!!!! best of luck to them for the rest of the life 게시됨 over a year ago
Buoni Fumogeni	Let's all receive
kuma la mamaake si angenipa mimi	And your mother wouldn't care for me
Msaada wadau kwa binti yangu	I helped my daughter's
Kuna wana yanga wenzangu eti hawaumii kwa kua ni mechi ya kilafiki... Inaingia akilini... Kwani mechi ni mechi tu....	There are drag parachutes in MEO pack though they don't serve any purpose, it's just a visual mesh....
"""Luka wewe na ulokole wapi na wapi ndugu yangu!!!"	Archos, where are you at my brother?!?
Hiyo imezusha mashaka miongoni mwa umma.	that created confusion among the population.
Mapishi haya yanajumuisha ladha ambayo ni asili ya Kihindi.	This is one of several towers that comprise a typical Hindu temple.
Hilo ndilo kosa kubwa Magufuli amefanya.	This was a big mistake done by Bengalis.
Vumbua nyaraka katika MDN.	signals on the MDI.
Download mchezo Yetisports katika milima ya	Fire on the Mountain Music Festivals
Wana wa Mungu huongozwa kwa Roho ya Mungu (Warumi 8:14).	The children of God are led by the Spirit of God (Romans 8:14).
Madhara madogo ya kawaida, ikiwa ni pamoja na dhiki ya utumbo na hisia za hofu au kuchanganyikiwa, kwa ujumla huhusishwa na kipimo kikubwa na kwa hiyo, inaweza kuepukwa kwa kupunguza kipimo.	Less common side effects, including gastrointestinal distress and feelings of nervousness or agitation, are generally associated with high dosage and can, therefore, be avoided by reducing dosage.
Ila Hakuna hata kwenye afadhali.	"""There's no one better than [Timberlake] at anything."
"""Niliwahi kusema lini?"""	"""When did I call?"""
Uchunguzi uliochapishwa katika gazeti The New England Journal of Medicine ulionyesha kwamba hata kutembea meta 800 kila siku, humsaidia mtu kuishi zaidi.	A study published in the British Journal of Sports Medicine found that even just 11 minutes of exercise a day contributed to higher life expectancy.
Hamza A. Juma Home	Sedona's first week home
ali zaidi supports Shia	It also supports more csh
Sasa wanaishi kwa furaha sana katika bustani yake.	Currently, they are extremely happy in their married life.
Hii ni kwa sababu yeye ni Roho.	This is why he is a spirit.
Duh, hii ni scandal kubwa!	Shadow, that's a great shot!
Cheza kama una pesa za kwako	Make sure you have money on you.
Imani yetu hairuhusu fujo, chuki na mauaji.	Our religion is not supposed to lead to anger, violence, or destruction.
Ni kimekufikirisha huko	He brought you there.
Kulingana na ripoti ya polisi, mshukiwa huyo atazuiliwa katika kituo cha Polisi cha Kileleshwa baada ya kutoka hospitalini.	Police say the driver will be arrested after being released from the hospital.
Si Tuu Test	No, it's not test
Watu barani Afrika wanastahili na wanahitaji msaada sawa na ulimwengu wote.	People in Africa deserve and need the same support as the rest of the world.
"24:32 Basi, wakaambiana, ""Je, mioyo yetu haikuwa inawaka ndani yetu wakati alipokuwa anatufafanulia Maandiko Matakatifu kule njiani?"""	"Lu 24:32 And they said to one another, ""Did not our heart burn within us while He talked with us on the road, and while He opened the Scriptures to us?"""
Haikuwa ajabu, katika muktadha huu, kusikia watoto wengi wakijifunza tabia zinazowazidi umri.	It should come as no surprise to learn that many abused children become abusers later in life.
"""Mimi na mume wangu tunajuana vizuri sana."	"""His mother and I are well acquainted."
Design ya ndani ya vyumba katika mtindo wa kisasa	Interior design in modern-day model
Kama hawezi kuachana nao mshauri wewe unshauri wako.	If you can't, keep your counsel to yourself.
Rais aliweka mbele kazi ya kutoa haki ya kufanya kazi kwa mbali na mfumo mdogo wa ajira kwa wazazi wasio na wenzi.	The author then made a special effort to single out single parents for corruption.
Unaweza kutaka kulipa angalau masaa 2.	You need to allow two hours at least.
"{{Na lau kama Tungaliifanya Qur-aan kwa lugha isiyo ya Kiarabu wangalisema: ""Kwa nini Aayah zake hazikupambanuliwa?"	"And if We had made it a non-Arabic Qur'an, they would have said, ""Why are its verses not"
The Onekama	The One-Arm
Matajiri huvaa simple Jamii Photos 1 Nov 10, 2017	Website allows home owners to view historical photos - February 10, 2017
Ishara ya thamani kubwa zaidi ya malipo kati ya alama za kawaida ni sheriff.	The most valuable symbol among the regular ones is represented by the monster.
Kila siku kwenda haja ndogo kutoka 4 kwa mara 6 ni lazima na hii ni kawaida kwa kupata hadi kwenda kwenye choo hadi 2 mara wakati wa usiku.	Daily urination from 4 to 6 times is a necessity and this is normal to get up to go to the toilet up to 2 times during the night.
Bobby, lazima nikiri kuwa ujumbe wangu wa kwanza nilimaanisha hayo juu.	Hi POP, Anything you have to say I want to be the first in line.
Hii ilikuwa ni vita ya kikabila.	That was a brutal war.
Mtu ambaye ana watoto - yeye	A man who has children - he is a
Huu ni mchezo wa hali tete ya kati.	This is an old CLI struggle.
Maajabu ya serikali ya tanzania.	Wonders of the Singaporean government.
Joseph Kuruwila	Joseph is recovering.
Mara nyingine mashua ndogo inaweza endeshwa kwa kupelekwa na wimbi la meli kubwa.	A large ship can be turned by a small rudder.
"Na baada ya kuhamia Madina, aliswali miezi saba, kisha Mwenyezi Mungu akamwelekeza Al Ka'aba."""	He conquered Mecca eight years after his migration, and he died when he was sixty-three, after having been revealed the entire Qur'an by Allah.
Wakati mwingine inabidi niwaombe radhi wasomaji, hasa wa makala zangu kutokana na kushupalia kwangu baadhi ya mambo.	There are times I feel sorry for tenured academics, particularly those with titles.
Lakini ... kulikuwa na mabadiliko.	And so they... There's a change.
Mashabiki bora wa Apple wangeweza kutarajia ilikuwa kadi ya zawadi ya $ 50 au $ 100 kutoka Apple wakati walifanya ununuzi karibu na likizo.	All plans come with a credit bonus of $50 to $100 if purchased online through the Optus store.
Mapenzi ni kikohozi; haywezi kufichika.	Love is a choice; it can't be compelled.
Spika wa Bunge la Iran: Nchi za Kiislamu zinapaswa kulipa kipaumbele...	White House: Migrant children will have to re...
Utapokea barua pepe kutoka kwa mamlaka ya Parimatch kuhusu uthibitisho.	You obtain a letter of authority from the probate court.
Shapu, ukiona wanavyoucheza utapenda,lol	> the conference if you'd like to see them, Barb.
Jambo la kushangaza na kusikitisha hapa nchini.	We were amazed and shocked at this country.
Hii ndio kazi ya maisha yangu.	That's my life work.
Hii ilifanyika katika mikutano yote ya Tume katika kila upande wa Jamhuri ya Muungano.	This is also the case at all the meetings held with world leaders at the UN.
Translator: Kuhusu wanyama wa watu.	Science: Animals including humans.
Huduma yetu huwanufaisha wengi katika jamii.	many public benefits to society.
Kichwa changu kina walakini.	Mine has been off and on.
Kofi ya glasi ya kioevu ya Willson Taiyoko.	Foguel's thesis advisor was Michio Suzuki.
i hope ni tarehe kumi	I hope that there is a 10
Mradi huu ni sehemu ndogo ya kuonyesha thamani ya kujitolea mashahidi hao kwa ajili ya taifa hili, na umuhimu wa familia ambazo zimejitolea wapenzi wao kwa ajili ya kulinda taifa la Iraq na maeneo matakatifu.	It is worth mentioning that this housing project is only a small recognition for the great sacrifices made by these heroes for this country, and to their families who sacrificed the dearest ones for the defense of Iraq, its people and its sanctuaries.
Katika jadi ya Essene, Enoch ni mtu wa kwanza ambaye alisafiri njia ya umoja na Mungu.	Enoch was the first man in the Bible who walked with God.
Mimi napendezwa na hao oldskul sana.	I'm very interested in ancestors.
Na je, kuna vigezo vyovyote vinavyoweza kutumika katika kuamua how much to spend on your sweet heart?	There are certainly clues that can be utilised in deciphering how old your jewelry is.
Mvua hunyesha masika, masika hukesha,	The rains came, the earth trembled,
Mara nyingi ilikuwa na bloating kali, ukelele ndani yake.	Every so often, it sneezed violently, sending itself up into the air.
Kumpa Yesu maisha yako na kumfanya awe ni kiongozi wa mapito yakoClick to expand...	Adopt the island rhythm of life and let it be your chaperon-guide...
"Kwa sababu yuko upande wa mkono wangu wa kuume, sitatikiswa."" - Zaburi 16:8."	"Because he is at my right hand, I will not be shaken."" ~ Psalm 16:8."
To Make & Use:	How to use and use:
Inakadiriwa kuwa eneo la maonyesho litafikia mita za mraba 10 000.	The fire was localized to 10 thousand square meters.
● Azimio la kufuata CE	(c) The final decision.
Kwanini hamkuwachagua kwenye udiwani na ubunge?	Does this not make you self-centered and self-righteous?
Kwa kukadiria ulitumia kama kiasi gani cha pesa?	How much money do you use.
'Wanampendea tu pesa...	He loves money...
Kama wewe principle yako	Just like your principle.
"Lūṭ akasema kuwaambia watu wake, ""Hawa ni watoto wangu wa kike, waoeni."	"And Enoch said to all his people: ""Hear, my children."
si angemtumia sms basi ?	Can't they use slings?
tupate pato la juu, na si kukuza mashuzi	Take the High Road, Not the Bait
Nitakusaidia kumaliza matatizo yako ya kifedha ...	We help you solve your financial problems...
Mbona alielewa show!	she understands the message of the show!
Nilimsukuma Suma kwa nguvu, akakimbia na kusimama mbele hatua kadhaa mbele, akanigeukia haraka huku akiwa ameinua mikono juu maana alikuwa anajua ni nini ninachotaka kukifanya.	I turned towards her a little and poked her cleavage, she quickly glanced down to see what I was doing.
2 Na hawauambii moyo+ wao kwamba mimi nitakumbuka ubaya wao wote.+ Sasa matendo yao yamewazunguka.+ Yamekuja mbele za uso wangu.+	2 They don't consider in their hearts that I remember all their wickedness.Now their own deeds have engulfed them.They are before my face.
bhacha una to kulithalai	"""Do you have a box to put"
Wanafuata hayo, na kumwacha Allaah ambaye Anasema:	So they say, and then the gods took revenge
Akumbusha kifo cha baba yake	He remembered his father's death.
"Na tunapo elekea nitaandika barua ya kuacha kazi"" ""What, uache kazi kwa ajili yangu?"""	"""When people call us up saying, 'I'm off work - do you have anything for me?'"""
Inayofuata:Umemtolea Mungu Nini?	So the next question is: what is God's?
Kuratibu huduma shirikishi za Kifua Kikuuna UKIMWI Wilayani kamamwongozo wa Taifaunavyoelekeza.	The Centers for Disease Control classifies lead poisoning as an environmental disease.
Hii ni moja katika thawabu ambazo zimeainishwa katika vitabu	It's one of the variables fed into the calculations.
Nishati safi ya umeme kwa kulinganisha.	to vary with ambient light.
Kulingana na ripoti hiyo ya wataalamu wa baraza la usalama la umoja wa mataifa na ambayo ilifichuliwa na shirika la habari la Reuters, waziri wa ulinzi wa Rwanda anaongoza kw akutoa amri kwa waasi wa M23 wanaoendeleza uasi Mashariki mwa DRC tangu mwezi Aprili.	According to a private report by the UN Security Council's Group of Experts, seen by Reuters news agency, Rwanda's defence minister was relaying military instructions to M23 rebellious leaders who have been fighting DRC's army since April.
Bonielly replied Nov 27, 2013 to Mambo ya kuepuka baada ya kuchumbiwa	Dennis Crowley replied Jul 9, 2011 to Don't look back
Alikuwa mmoja wa wale 12 ambao Yesu alichagua wawe mitume wake.	He was one of the Twelve Apostles who Jesus chose as his original disciples.
Hizi ni data tulizozipata kutoka MCM.	This is the data sent to MS.
Tangu wakati huo ameniheshimu.	Since then she has respected me.
Kusuka rasta ni gharama.	Travelling to Lusaka is a cost.
Chukua nambari hiyo na ufanye 2 ya machapisho hayo ya wageni.	Click on it and print out the 2 pages.
Ndugu zangu jibu la swali letu liko hapa, yaani kwa nini Mungu aruhusu mateso.	There are answers to the question of why God allows suffering.
Jibu Kulingana na maelezo ya mwalimu wa Hisabati yanaonekana sio sahihi.	The teaching assistant's answer seems to me to be wrong.
Unaweza kuungana na Roho baada ya Tea kubwa ya Arizona Iced, Coke Diet na [...]	You can connect with Spirit after a large Arizona Iced Tea, a Diet Coke and a [...]
Concrete Pumping Facebook inaonyesha maelezo ili kukusaidia kuelewa vizuri lengo la Ukurasa.	Facebook is exhibiting details that will help you better understand the objective of a Page.
Mie ni mpishi hapa Mirembe, nadhani hujapona...	I have War of the Worlds here, but I'm thinking it won't hold...
HOW TO PLAY - Shakira - Waka Waka (Piano Tutorial Lesson ...	Learn to play...: acoustic guitar, (DVD)
Nina's Best uigizaji In...	I have the absolute best job in...
