Hivi karibuni nimehama kutoka mji mmoja kwenda mwingine na mara nyingi nimekuwa sipati huduma ya Intaneti kwa miezi 3 iliyopita, na vilevile kutengana na mwenzi wangu wa kimaisha kwa zaidi ya mwaka.	I recently moved cities and have been largely without the internet for the past 3 months as well as splitting up with my partner of over a year.
Hatua nyingi zaidi hufanyika juu ya kichwa.	More progress has been made on the heads.
& # 8211; Mahusiano kwa vijana waliookoka.	It#8217;s about a mutually-beneficial relationship.
Tutakuhakikishia ulinzi milele.	We'll always protect you.
Serikali imelenga kukifufua kiwanda hicho ambapo imefanya utafiti ili kubaini namna bora ya kukifufua.	A Steering Group was set up to oversee the project, which has explored ways in which selection methods can be enhanced.
"""Kwa pamoja tunaiomba sana serikali"	"""Instead, we are calling on the government"
Wakati huo ilikuwa iko katika Huis kumi Bosch huko La Haye.	At the time, it was housed in Huis ten Bosch in The Hague.
36Akapatana naye kujenga meli za kwenda Tarshishi; Wakazijenga meli hizo huko Esion-geberi.	36 He joined him in building ships to go to Tarshish, and they built the ships in E'zion-ge'ber.
"Ndundame; ""Mmmh, Jamani Mimi naona niishie hapa, nimewasindikiza vyakutosha"""	"relation to Africa: ""I have been there, I have lived there and seen"
"a pop quiz question iliongezwa: What song lyric, ""for all those times wewe stood kwa me,"" come from zaidi ya mwaka mmoja uliopita by cherl12345"	"a pop quiz question যুক্ত হয়ে ছিল: What song lyric, ""if I could reach the stars, I'd give them all to you,"" come from বছরখানেক আগে by cherl12345"
Washukiwa ni;	they are stationed;
Je umeridhika na hali iliyopo?	Are you pleased with what happened?
"Alisema, "" Msimamo wetu ni rahisi, hakuna cha kuzungumza."	"She said: "" My position is very simple and it hasn't changed."
"Wakajibu wakasema,"""	"""But,"" they replied,"
MUcholl Wagon.	In Vaughn.
Kujifanya tunajua kila kitu	We get to know everything
Angali bado kijana na mchango wake kwa jamii yetu bado ni mkubwa.	He is still a miner and their family has grown to considerably.
Ninadhani kuna makubaliano ya chini kwa chini ambayo watu wengi hatuyajui.	I agree there are numerous laws that many of us are unaware of.
Miye nilichukua picha hizo saa 11.30 jioni.	I took this picture at 11:30pm.
Maeneo ya vijijini, ni 2% tu.	In rural locations, the figure stands at just 22%.
Watakuwa na mfano ya kitu!	They'll have a sample.
Je hii tume itakuwa ni ya Haki kweli?	Is this one going to be true?
Sara akipayuka shauri yake.	Sarah intended to follow her advice.
* Pulizia pareti: Si.	The Pitch: No.
Alikuwa ni mtu pekee aliyeruhusiwa kuingia mahali patakatifu sana katika hekalu ili kutoa sadaka maalumu mara moja kwa mwaka.	The physical high priest was only allowed to enter the Most Holy Place in the temple once a year, on the Day of Atonement.
"""Do ya want a nice lil' pony hug, ma'am?"""	"""Try to think him a good man, won't you, dear Liddy?"""
ila hao wote ni washamba na hawajui wananataka nini kwako	They simply don't know everything you are doing, and they don't know what you want them to do to help you.
Karibu sana mkuu,tena kwa mikono miwili.	near the shoulder with both hands.
Unaogopa au una wasiwasi wa kwenda kuona daktari wako wa meno?	DO you have a fear or phobia of coming to the dentist?
Wanapenda ngono angeweza kululipa wewe!	They live by the fact that they're able to outlast you!
US hapa unamkiss mke wapo popote.	Everywhere we see pictures of naked women.
Navyofahamu mimi kauli ya Waziri mkuu ni kauli ya serikali, kama aliahidi ni jukumu la serikali kutimiza.	I am trying to flush out from the Government the truth of the position, namely, that it is a scheme of nationalisation as the Prime Minister says.
na mambo yake ya ki-ilimu ambayo yalikuwa hayakuwa yakijuulikana ila katika	But besides that they were written in languages, known only to
Matokeo Darasa La Saba 1996	school division of the 1996
"aka ""Chicago Story"""	"The story of ""Chicago"""
Ni vizuri kuwa na kitu tofauti na fresh katika kabati lako.	It's good to have something different in your assortment.
dunia na wote waishio ndani yake.	Listen, O earth and all who are in it.
Katika Mafunzo Mafupi ya Kiinjili ya Westminster, swali la kwanza ni: Je, ni nini mwisho mkuu wa Binadamu?, yaani ni, ni nini lengo kuu la Binadamu?.	From the Westminster Catechism, the first question: What is the chief end of man?
Charama dhatu: - last dhatu.	Giant pandas: the last refuge.
Hiyo inaitwa 'unrelated event	"it's called ""accidental"""
Angalia tafsiri za '-員' katika Kipolandi.	Check 'HSS' translations into Spanish.
Kwani marekani hawana makampuni ya kutengeneza handset??	So... the US doesn't have immigration laws?
Chanzo: Nipashe Jumapili.	A: I will be starting Sunday's Supper.
"""Hakuna njia ambayo ningepoteza pesa kwenye upasuaji."	"""I have no other way of making money to survive."
Sijakuja hapa kucheka na wewe, nimekuja kukufunza adabu.	I'm not here to punish you; I'm here to teach.
Antonio Conte hasira za faini ya FA azipeleka kwa mkewe	Katherine, filled with anger at her sister's
Makuta: Huh?	See also: Ben?
"""Wakasema: Ewe baba yetu tuombee msamaha kwa dhambi zetu, hakika sisi tulikuwa ni wenye makosa.""Yusuf: 97."	"They said, ""O our father, ask for us forgiveness for our sins, for we are truly at fault."
Tunapendekeza utumie programu ya kutafsiri mashine ambayo inaweza kutafsiri maandishi kwa urahisi, kama programu ya Vocre, inapatikana kwenye Google Play ya Android au Duka la Apple kwa iOS.	We recommend using machine translation software that has a Spanish translation tool and can easily translate text to speech, such as the Vocre app, available on Google Play for Android or the Apple Store for iOS.
Kinachoendelea ndani ya chama chetu ni mapambano ya kukuza demokrasia.	What's happening in Mexico is a struggle to establish the rule of law.
Upande wa upinzani unataka mabadiliko ya kisiasa nchini Zimbabwe.	During the rally, they demanded democratic change in Iran.
Hebu fafanua hilo ili Doctor nifanye kazi yangu ipasavyo!	Leave it to the experts to do the job right!
Amewasihi waweke vipaumbele vyao na kuendelea kufuata malengo yao ya juu ya mambo ya maendeleo endelevu, kama vile mabadiliko ya tabia nchi, kuwawezesha wanawake, kuwawezesha vijana na mambo mengi mengineyo.	He asked them to set priorities and stay focused on issues such as sustainable development, climate change, women's empowerment, youth empowerment, and many other issues.
au kale kafella kengine huwa kwa The Trend.	But one age group is bucking the trend.
Maadili ni miongoni mwa vitu muhimu sana katika ujenzi wa jamii yoyote lile, bila uwepo wa nidhamu ya kutosha jamii yoyote ile haiwezi kuendelea.	ROSP strongly believes that education is the most crucial foundation stone of any society; without which the development and progress of any nation is not achievable.
Taarifa ile ilimshtua kila mtu na hofu kuu ikatanda kijiji kizima.	This home has been all over the news and it frightened many people.
Inaelezwa kuwa alikuwa akinywa pombe sana licha ya kuwa daktari alimkataza kufanya hivyo.	He continued to drink alcohol despite the fact that he was instructed to quit it by a doctor.
"""Siwatishi, lazima niwaambie ukweli."	"""I don't care, you must tell me the truth."
Kwa hiyo kama ameshinda sisi tufanyeje,	And he has sent us, to do it.
Hatua ya 2 - Chagua aina ya wavuti unayotaka na uchague kiolezo kilichojengwa hapo awali.	Step 2 - Select the type of website you want and choose a pre-built template.
Presagen sasa amepanga kuongeza mtaji mkubwa wa kukuza ukuaji katika miaka michache ijayo.	The FortNite team is still working on supporting a wider variety of devices in the next few days.
Karibuni zaidi	In the more recent
Haleiwa Hawaii.	It was founded in Hawaii.
Nakushauri ukacheki HIV.	He conquered HIV.
"sh. milioni 1.7 kwa siku,"" alisema."	"1,500 million a year,"" he said."
Kina baba wakiendelea kupata sadaka	There's Daddy's with the sacrifice
kasema labda wataona hizo movies kabla hajawaambia..	Check out movies before you see them.
"Kila mtu anahitaji eneo kama hili nadhani, nikiwa mmoja wao."""	Everyone needs a family member like that, I think.
Rais mkongwe wa Zimbabwe Robert Mugabe, mwenye umri wa miaka tisini, sasa ameteuliwa kuwa mwenyekiti wa muungano wa Afrika-AU.	90 year old Zimbabwean President, Robert Mugabe has been announced as the new Chairman of the African Union.
""" Mshukiwa alikamatwa na anazuiliwa katika kituo cha polisi cha Kapsokwony huku mwaathiriwa ambaye sehemu zake za siri ziliharibiwa sana anapokea matibabu katika hospitali ya wilaya ya Kapsokwony,"" Ndiwah alisema."	"""As we speak the suspect is in custody at Kapsokwony police station while the victim whose private parts were badly damaged is recuperating at Kapsokwony district hospital,"" he said."
Habari zaidi kutoka eneo hilo zinasema kuwa kumekua na mapigano usiku wote wa kuamkia hii leo.	Some of the community resisted the eviction and clashes continued throughout the day.
Unaweza kuagiza ugawaji wa mwezi mmoja wa Dianabol halali mtandaoni kutoka kwa Misa ya Crazy kwa gharama ya wastani ya $ 64.99, ambayo ni akiba ya kifedha ya angalau $ 20 ukilinganisha na gharama ya bidhaa hii kama ilivyoainishwa kwenye tovuti kadhaa za mauzo.	You can purchase a one-month supply of Legal Dianabol online from Crazy Mass for the small price of $64.99, which is a cost savings of at the very least $20 when compared to costs of this product as noted on several competing sales websites.
Badala yake watekeleze agizo hilo, kwasababu walikuwa na muda wa kutosha wa kufanya maandalizi.	It would no doubt reassemble itself, but they had enough time to escape.
Katika Uingereza usajili kama mwanasaikolojia wa kimatibabu na Baraza la Taaluma za Afya (HPC) ni muhimu.	In the UK, whiteness as a original interpretation with the Health Professions Council (HPC) is human.
kiburi kwa viongozi na watumishi wa umma.	Humbly To Officials and Leaders.
Ulizo la Kuacha: Wafu wataishiki tena?	The context is clear: the dead is restored to life.
Home Entertainment Chid Benz afungukia muonekano wake wa nywele	mr blandings dream house mr blandings builds his dream house cast
whilo Hia Majesty tho King waa on	The Siths The King is Dead
COL 2:3 Ndani yake zimefichika hazina zote za hekima na elimu.	Colossians 2:3 in which are hid all the treasures of wisdom and of knowledge.
mo music akitaja kitu asichoweza kukisahau kuhusu	30. a song that reminds me of something sad
KimChi Making Workshop	Kombucha making workshop.
Make Your Night Shine.	Do your night sky.
Eti anadai tusisikilize uongo wa wale!	We need to put pressure on the liars!
Naomba suala la uhamisho kwa wafanyakazi liangaliwe.	I want to address the workforce question.
Matokeo yatakuwa kwamba utaanza tena kuvuta sigara.	In other words, it makes you not want to start smoking cigarettes again.
Wale Tuliowapa Kitabu kabla yake, wao wanaiamini (Qur-aan).	Those to whom We gave the Scripture (i.e. the Tawrah and the Injeel, etc.) before it, - they believe in it (the Qur'an).
Itakuwa wazi katika kizuizi cha siku 3 cha kukomeshwa kwa saa ..?	Isn't it said that the Three Days of Darkness will descend ...
Nimemsikiliza kwa makini sana, nilichogundua ni kuwa kwa sasa Bunge letu linafanya kazi kama idara ya serikali na si mhimili unaojitegemea.	I took their education very seriously because I see it as a parental role, not a government role.
Waajiri wengi tu bado wako hivyo.	A lot of consumers still do.
"Tunataka kumjua kila mmoja wenu!' """	"I want everyone to know!"""
• China yasukuma mbele mageuzi mapya vijijini	• New York City has an advanced
"Kanem amesema, ""ni lazima tukabiliane na vikwazo vinavyoweza kuturudisha wakati ambapo wanawake walikuwa na sauti ndogo kuhusu maamuzi ya afya ya uzazi au kuhuzu maisha yao kwa ujumla,"" ameongeza kuwa, ""vita vya haki na maamuzi vinapaswa kuendelea hadi pale itakuwa ni hali halisi kwa wote."""	"Natalia Kanem said: ""We must push back against forces that would see us return to a time when women had little say in reproductive decisions or, for that matter, in any area of their lives,"" ""The fight for rights and choices must continue until they are a reality for all"""
Woods, Kisha	planks of wood, then
""" Ways To Make Your Engine Run A..."	How to Drift a Motor...
Alifikiria kaka yake wa miaka 12 ambaye yuko kwenye chumba chake.	A 12 year old girl stands in her bedroom.
Sibishani na kiongozi.	Speak to the leader.
Huwezi kubadili kaya ile na kuchagua kaya nyingine.	You can't replay or make a different choice.
Hiyo ilikuwa ni Mei 2013.	This was May of 2013.
Jaji Fremr alibaini kuwa hakuna kesi ya kujibu kwa watuhumiwa hao kutokana na tathmini yake katika ushahidi uliowasilishwa na upande wa mashtaka kwa mujibu wa mwongozo wa mahakama hiyo.	Imhanruor said the defendants were not given an opportunity to defend themselves during the hearings that led to Justice Oyinloye's judgment.
"""Siku moja nitakuwa na familia, lakini si kutokana na msukumo wa jamii."""	'We will have a family Christmas, but without Maria.'
Natafuta wauzaji wenye bei nzuri (ndogo).	I'm looking for inexpensive pets.
Ninaomba chupa moja ya ____.	I want a cent...
Akayafunga na akasema: ((Hakika roho inapotolewa, macho yanafuatia [kupoteza uoni)).	He closed them and said, 'When the soul of a person is taken away, the vision of the eye also follows it.'
Kweli huyu mzee ni green snake in green grass!	He is a black snake in green grass.
Polisi walinitesa kwa saa nne lakini bado hawakupata habari yoyote kutoka kwangu.	Madarine had been out for four weeks but had captured nothing.
Gharama ya usajili wa kampuni ni nini New Mexico?	What Taxes Are Owed on Business Income in New Mexico?
Uzoea tofauti.	Teaching is different.
Nasimama na hii comment	I'll leave this comment
sidhani kama kuna atakaepona kwenye hii tsunami ya M4C	I don't think he got any move changes in Sm4sh
Na ukitaka kumchokoza ilikuwa rahisi.	If you want to do so, it's easy.
Mkuu Tanira tatizo lilikuwa imani hairuhusu..	Manoah's biggest problem, however, was a lack of faith.
Akielezea uharibifu huo,	In describing the raid,
jiji kuendelea na maandalizi yake.	The company continues to pursue its plans.
Kimsingi sidhani kama naweza kulala naye kitanda kimoja tena.	I don't think I could ever sleep with anything on again.
Mkusanyiko wa nyimbo 8 za Fulstan Amani.	A list of 8 words by pacificlight.
Ila rafiki zangu wengine wanavalishiwa kwenye chupi na waume zao.	Two intimate friends got divorced from their husbands.
Kwa hiyo, unapaswa kuweka malengo kwa ajili ya mtoto wako.	Therefore, you have to prepare your child.
Kanuni hii imetengenezwa na vyama na kampuni za EU, kwa kuhusika kikamilifu na maoni kutoka kwa wadau wengine, pamoja na mashirika ya kimataifa, NGOs, vyama vya wafanyikazi na vyama vya wafanyikazi, na pamoja na huduma za Tume ya Ulaya.	The Code has been developed with EU associations and companies, with active involvement and input from other stakeholders, including international organisations, NGOs, trade unions and trade associations, and together with the European Commission services.
Afrika Kusini ina pointi moja.	South Africa has only 1 point.
"""Shukran ila kaka mie ni mke wa mtu."	Hansa is just one woman.
Zidi kumwamini na kumtegemea katika kila hali.	She places her trust in Him in all situations.
Watu ni mimi.	folks is me.
Bw Abramovich, mwenye umri wa miaka 51, atakua ndiye mtu tajiri zaidi nchini Israel sasa.	Mr Abramovich, 51, would be the wealthiest individual in Israel.
Sasa, kila mtu anapaswa kujua mwenyewe ndani ya moyo wake.	Each person knows what is in their own heart.
"Sasa, niko najifunza na tano kati yao."""	"""Now I have five of them."""
Baada ya hapo alitoweka kwenye macho ya watu na hakusikika tena.	Then he turned away from the mirror and did not look in it again.
Shein mjini Moroni na fasili ya kisheria	The Book of Mormon and Social Justice
From the recording Paka ya Mwezi	From the album Pink Moon
Usichukue dozi mara mbili.	Never take two doses.
Lesha Center	The new Center
kinyume na taratibu.	As opposed to the POTUS.
From the song Hakuna Matata:	in the song, nothing can be explained:
Tanzania were...	Tanzania is a...
Hapana mungu isipokuwa Allah na Muhammad (s.a.w.w)	no God but Allah, and Muhammad is the
mi nafikiri we unapitia mid life crisis.	I think you're having a mid-life crisis.
kutoka kilo 112 nilizokuwa nazo before diat.	I weighed 127 pounds before I got pregnant.
Hakika 2000 ulikuwa mwaka ...	There was a 2000 ...
"""Kwa nini unataka kuuchapisha muswada huu?"	Why do you want to write to Prezi?
Wewe ndiwe taa ya maisha, wewe Ndiwe mweza vyote.	You are the author of life; of every living thing.
Wote hawa wana maendeleo.	All of them made progress.
babu V.babu February 1, 2014	Sara B. on 1 February 2014
Kwanza, huenda Loti alitenda kwa imani.	We can see from this verse that Lot was a true believer.
Karibu uungane nasi kila Jumapili	in almost every Saturdays
Носки McKinley Asio kids р.	Cornell Macneil has no children.
Mambo Kumi 10 Usiyoyajua Kuhusu Adolf Hitler Kumi Muhimu	10 things you don't know: adolf hitler
kama alikuwa mlevi nafikiri aliacha na kuwa mcha mungu.	He was belligerent, and he lost his fear of God.
huduma nyingine za kibinadamu zimeboreshwa, ndivyo matokeo y a somo lake	additional phases have been introduced, resulting in the number of phases
Na mimi mnibakizie jamani,vitu kama hivyo sijawahi kuvila nina miaka kadhaa	"""When I went to New York I tried to remember things from years ago."
Tupo katika kipindi ambacho hatujawahi kuwepo tangu mfumo wa vyama vingi uanze.	None of us have ever lived in an era when the banking system has collapsed completely.
Feeling alive yet?!	"""How are you still alive?!"
Mini Warehouses.	The mini crawls.
Jovic, hata hivyo, haijulikani na wachache wa magari yenye kupendeza sana, mafuta, msungi na wasichana.	Jovic, however, isn't noticeable by a handful of pretty impressing cars, booze, the swagger and girls .
Ulimi mwema wamtoa nyoka pangoni.	The tongue of a bell strikes the shell.
"""Kikosi cha Zimamoto cha London pia kimeitwa katika eneo la tukio kusaidia kupona kwa mwili."	London's Business Design Centre has also been confirmed as a vaccination centre.
Alitumia gari hilo	He was driving the car
OCD wa eneo husika pia aliandika taarifa ya tukio hilo.	Kwang Soo's agency also released a statement regarding the incident.
Siku hizi kuna pre paid roaming.	What is available today are rubber hoses.
"Je, si Neno LANGU husema, ""Baraka kwa wale wanaotii."	"remember His words, that ""blessed are those who mourn."""
Mkoa kiwango cha chini kabisa ni Iringa kwa 8%.	Inbound penetration is a maximum of 8%.
Haraka sana mpeleke hospitali au kwenye kliniki ili aweze kufanyiwa upasuaji.	have quick access to transport to hospital or home for emergency treatment.
Ni nani anamwogopa nani na kwa nini?	"Who are you afraid of and why?"""
Mi ningeongeza	I'm going Thêm
Samahani sikupata muda kujibu hii on time.	Manchin did not respond in time for this report.
Enough to make ya break and shake ya $$#	In addition to buffing & shaping of the nails. ~$30
Unapowasili Uingereza, gari lako litafanyiwa majaribio kadhaa na marekebisho ili kuhakikisha kuwa inafikia viwango vya barabara kuu ya Uingereza.	When your car is MOT tested, the testing station is required to run through a series of standard checks to ensure that it meets with the safety and environmental legislative standards applicable in the UK.
56 Lakini wao walimjaribu Mungu	(3:15c) but they also have put God
Wauzaji wamizani aina zote digital& analogy	the ideas of Digital Electronics and all types of Analog and Digital Modulation
"Next Story → Saida Karoli ""Nilidhani nitakufa kabla ya Ruge, Dr. Mengi kanipigania kaondoka"" (+video)"	"Drew Rub answered, ""The fourth (a large snake), I'd drop dead of (a heart attack)."""
- Sema Ukweli (@SemaUkweliKenya) September 15, 2021	Learn the Truth (October 31, 2021)
Ni Nani Anaongoza Watu wa Mungu Leo?	Who are God's chosen people today?
Kwa wiki takribani nne hivi, sijaonekana katika safu hii.	Four failures in a week, I don't remember seeing this before.
Ndivyo ilivyokuwa hapo awali, ndivyo itakavyokuwa tena.	It has been this way before and it will be this way again.
Check Link pia kwenye bio au profile.	See also the Table of Contents or Maps.
Jaribu hiyo next time.	Try it for next time.
Kupitia unachokifanya kuna mtu anaguswa sehemu.	Things you do are driven by something.
Makadirio ya hali ya hewa duniani yanaonyesha kuwa chini ya mazingira yote, joto litaendelea joto - na miaka kama vile 2019 itakuwa kawaida ya muongo huu.	Research published in the journal Nature shows that as global temperatures rise, the Arctic will not be spared, and fires like these may
Itakuwa ni aibu kubwa kwa rais wa nchi kufumbia macho upigaji.	It is all very well for the Leader of the Opposition to shake his head.
Tea - ww tuna mayo 77, salad 40	Mo, 57 years - Canada.
Zaidi ya nusu ya watoto duniani wanakabiliwa na tishio la vita, umasikini na kutengwa kijinsia - china radio international	Over half of the world's children threatened by war, poverty, bias:
Concern yake hapo ni hou mwaka.	The factor here is that he is a one year rental.
Nishakuwa mwehu tayari!	I used to be prepared!
Huo mfano wa practical trainings ulioutoa ni sahihi kabisa.	The training provided by them is really effective.
40 yeye ambaye huwamwagia dharau wakuu,	The One who conquered the grave.
Mars aka mr.	Marge has passed on.
Na mwende mnapo amrishwa. ***	when you are hoeing).
Tumia zaidi nuru unayopata!	Make the most of the light you have.
Kwa wazi, hii itahitaji kuwa mtu unayemwamini kabisa.	This means that they must be a trustworthy person.
Daudi Nyaburi	David showed courage.
pamoja na uhuru wake.	upon his freedom.
Kesho hatunayo ahadi	We ain't promised no tomorrow
- Kristo kinachojulikana, Maitreya amesema zaidi ya miaka 30, bado inafanya kazi ulimwengu unrecognized, katika mwili hapa duniani.	- The so-called Christ, Maitreya has said more than 30 years, operates the world yet unrecognized, in a physical body here on Earth.
Ni nini ilitokea wakati Yohana alikuwa na umri wa siku munane?	What happened to John Newton when he was six years old?
Jitayarishe Kutoa Maelezo	Be prepared to give explanations.
Nina sababu nyingine: mtu huyu ana uwezo wa kuelewa vitu vyote, hata vitabu vya watoto.	The communicators: These people understand all the languages, even that of animals.
Yi, Jinyao (2)	Yes I Will (2)
kwa taarifa yako huyu ndio mwanamke mfupi kuliko d	A lady who had more money than c her
Ni muhimu kukaa hydrate, haswa ikiwa uko nje wakati wa mchana.	It is important to stay hydrated, especially if you are outside during the day.
Cheap MBT Womens Katika Outlet Sale	the free fatty acids in the extracted
Yote nakueleza, mengi umeyapitia	I've told you all a lot of
Amini usiamini mtoto wa kike alipatikana hai zaidi ya saa 14 baada ya garli alimokuwa kutumbukia ndani ya mto uliofurika huko Utah marekani.	A baby girl has been found alive in a car more than 14 hours after the vehicle plunged into a river in Utah.
Machapisho kuhusu programu za Facebook Facebook wasikilizaji wa muda mrefu zaidi kuliko wastani.	"""The demographic of Facebook users shows that they're much older than Instagram's."
Tabia za maafisa wa serikali ya Tanzania huathiri kwa njia taratibu mfumo.	The Omani Government's economic diversification plans are positively impacting the economy.
George Njogopa na maelezo Zaidi:	Roger becomes even more concerned about
Kwa hiyo, ina maana kwamba tunacho chanzo cha uhakika cha fedha, tunachokihitaji ni kuhakikisha kwamba chanzo hiki kinatumika kwa madhumuni yale.	Therefore, it would be safe to say that we have a right to see that base need fulfilled.
mimi nimipenda hiyo ya watumwa wa kiimani wanaoshindanisha mitume wao.	I would love to read stories of believers who challenge their mentors.
siku iliyokubalika kwa BWANA?	The day of the Lord?
Kwa kweli kikundi chenu ndio bora zaidi mwaka huu wa 2015!)	This is your BEST OF 2015!
Fuata hatua hizi inaweza kutatua ADAPTER vifaa wireless kukosa [...]	These defects may contribute to a loss of synaptic plasticity. ..
...ndo mana tunaendelea kuwa maskini.	Fine... but we are still poor.
Lakini ilinibidi niwe makindi katika muda wote wa mashindao.	Similarly, there was enough to keep me occupied throughout the flight.
Muda mfupi kabla, rais Temer aliuta amri inayoidhinisha kupelekwa kwa jeshi katika mji mkuu baada ya makabiliano makali wakati wa maandamano yalitoendeshwa nje jengo la Bunge.	Earlier, President Blaise Compaore had fled to neighbouring Ivory Coast after massive mass protest resulted in a military coup.
Nashukuru kaka kama mmojawapo wa wachangiaji na wasomaji mliokuwa na moyo wa kuachilia mapema.	I am compelled to thank you for being one of the few public scholars on Mandaean texts and origins.
Welcome nyumbani Elvis!	Welcome to the elephant house!
Mara kadhaa nawasikiliza viongozi wa	I've had the experience of hearing leaders
Kucheza katika mapanga giza.	Playing in the moonlight.
Wakaishia hapo kwenye nn?	They're going to be on OGN Live?
Wakati watu wengi wanaamua kukarabati nyumba zao, mara nyingi hufanya kuchimba kabisa.	When individuals decide to sell their home, they are often overwhelmed with the whole process.
Alichosema Rama Dee kuhusu sakata la madawa ya kulevya	MaryW commented on the word pharmacovigilance
Kama kuna mwingine anapenda picha yake iongezeke hapa kwenye hii list anakaribishwa	If a member would like their photographs to be displayed on this website,
Nilipokuwa na miaka 20 hivi	When I was about 20.
Ni Haishu bian.	He is my Bwana.
"""Awataka wanasiasa wasifanye makosa kulinganisha marais"	"""They don't want migrants to cross"
Mbunge wa Jimbo la Kilolo Venance Mwamoto amegawa vifaa mbalimbali vya michezo kama alivyowahidi ...	The Egg Harbor Township resident has been linked to a number of incidents, according...
