Tatu, tofauti na dini za Kiprotestanti, ambazo zimegawanyika katika mamia ya vikundi vya kidini, Mashahidi wa Yehova wameendelea kuwa na undugu wenye umoja duniani pote.	"""Third, unlike the Protestant movement, which has splintered into hundreds of denominations, Jehovah's Witnesses have maintained a united global brotherhood."""
Mheshimiwa Mwenyekiti, suala langu la mwisho ni suala la mikopo ya elimu ya juu.	My biggest problem is The new Director of Special Education.
"Kwani tangu lini umeanza utani na wao?"""	"""And when did you begin with him?"""
Tumesikia biblia inatueleza kuna Roho saba, pengine zaidi.	To familiarize ourselves with the sermon text, we read it dozens of times, maybe even more.
Pamoja na kubadili mbegu tofauti.	as well as rotating movements.
Hii ni kwa sababu haina kemikali yoyote ambayo inaweza kuleta muwasho au kuharibika kwa ngozi yako.	It doesn't contain harsh chemicals that could cause harm to your skin or irritation.
Furahiya kitengo cha ponografia cha Uturuki na video za moto zaidi kutoka Uturuki.	Thousands of migrants from war-torn Syria and other porn movies.
Ask why cant they do that kwa umeme na sekta nyingine?	And now, the youth are asking if they can do this for other streams and other communities.
Dhamira hiyo bado ipo na inafanyiwa kazi na niseme kuwa kikao hiki ni moja ya hatua za kimkakati katika kufikia azma hiyo.	That kind of hustle is always appreciated, and it turned into one of the standout moments for the defense.
Nashukuru kwa kutumia muda wenu kusoma hili.	Thanks For Your Time Reading This.
Who's got ya singin'?	"""Who's ready to sing?"""
Hakuna bei haswa ya tarakilishi.	There is no liquefaction cost.
Mie nakomea hapo basi kama kula lolote zaidi juu ya wazaramo karibu sana na ruksa kabisa kuniongezea hapo ili tujuzane mengi ndio maana ya mimi kuzungumza na wewe.	I know here in Florida, when I go to Total Wine & More there are so many breweries out there it is hard to know what to choose.
Fikiria mara mbili kabla ya kuchangia.	It makes you think twice before asking for help.
Popote alipokwenda, alipata faida kubwa.	Everywhere he went he made a positive impact.
Asili ya Ukristo nchini Misri	The Emergence of Christianity in Egypt
Pole sana jiamini kuwa wewe ni Mwanaume.	but believe that you are really a man.
Mwanamke aliyewahi kutambulika mwenye utajiri mkubwa zaidi Afrika.	She was once Africa's richest woman.
- Eko Dydda na mkewe wamejaliwa waroto wawili ambao pia ni wanamuziki	The author and his daughters, who are also both Eagles fans
Next: Z'bar: Wachanganya juisi na dawa nguvu za kiume, wakamtwa	TN v. Eric Boyd: Young Couple Kidnapped, Raped and Murdered
Je mfumo huu unaweza ku support shul zote kwa pamoja?	Is it possible to use these DLL together?
Ninahitaji televisheni kama hii.	I have a TV just like that.
Wagombea wanapaswa kuwa kutoka nchi wanaostahiki Usaidizi rasmi wa Maendeleo.	Participants must be from an Eligible Country.
Kifo chake kimesababishwa na kansa ya ini iliyomsumbua kwa muda mrefu.	His death followed a long illness due to cancer.
Vilevile tulikuwa tunategemea kuajiri wafanyakazi wengi sana katika Halmashauri yetu kupitia mradi ule.	We've also been recognized for our work by many organizations in the legal field.
But bado sijachange number ni ile ile tu bado.	However, the type is still number.
Ila huyu katika kitabu chako sijui alizaliwa na nani.	Nor do I know if Boyden has placed one (or several) in this book.
Mwanzoni, aligoma.	At first it was stifled.
huyo mwanaume very exceptional.	He was a very special little man.
Kwa nini siwezi kupakua Audio na Sikiliza Nje ya Nje?	Why can't I switch radio stations without taking my eyes off the road?
Aidha, mabadiliko hayo yanatoa haki kwa kila raia ya kupewa taarifa wakati wote kuhusu matukio muhimu mbalimbali kwa maisha na shughuli za wananchi na pia kuhusu masuala muhimu kwa jamii.	The two Constitutions provide for the right to be informed at all times of various events, which are of importance to the lives and activities of the people and also issues of importance to the society.
Ndiyo maana watu humwambia kwamba, 'hawali maneno hawajiili meno.'	"That is why people say that, ""the mouth does not speak evil things."""
wapo watakao kupinga kwa kigezo cha kabila.	opposing sides of the habenula.
Ulishawahi kugombana na mfanyakazi mwenzio ofisi moja ?	Ever got into an argument with a co-worker?
Kwa kweli ulikuwa wakati wa STRESS ya kutosha kwangu.	For me, it was a stressful time.
"Ninamshukuru sana na nitakuja tena. ..."" iliyoandikwa na bossy0taylor"	"Thank you so much and I will order again and again.""-Tiffany"
Sema mimi nachukulia uchaguzi huu tofauti kidogo na wengine.	I'm going to do this one a bit different than the other.
Sadao Watanabe - Pamoja (1975)	Parliament - Together (1975)
Tulipani na suncu.	We met the sunset.
Serikali ya Kenya yafunga hoteli iliyokwamisha kuhama kwa wanyama	Kenya's President led a tree-planting event to spark the increase of forest cover
Tim: Ni kupitia Yesu.	B: Through Jesus Christ.
"""Ehee, hamkupata tatizo lolote?."""	"""And you didn't have a problem?"""
mnasema: Hichi halali, na hichi haramu.	"Say, ""Here's the truth of it."
Jinsi ya kununua na kuuza dini, na roho za watu, kwa faida ya kibinafsi.	How to buy and sell religion, and the souls of people, for personal gain.
Baada ya kitambo kirefu cha safari yetu wale abiria wengine waliokuwa mle ndani wakawa wamepitiwa na usingizi tena na hivyo kupelekea watu watatu tu mle ndani tuwe macho.	After our random game, some of them slept early so there were only a few of us left at the Common Area.
jinsi gani naweza ku divert _ JamiiForums	how to make a discord.js anti-spam
kana kwamba Mungu yupo na ilhali ni ndoto ya mawazo.	God exists as an idea and reality.
Bwana Obama na familia yake pia waliondoka White House na kuelekea Hawaii na kile kwa kawaida huwa likizo ndefu wakati wa sikukuu.	Obama and his family had also left town for Hawaii and what would normally be an extended vacation.
'Unamwamini huyo mtu...?' akauliza	"""Do you trust that man?"" he asked."
Amenifanya niangalie zaidi ITV.	Makes me want to watch more TV.
"Ninapobadilisha mazingira ambamo wanaishi, mara moja wao humtupa ""mtoto mchanga"" upande mmoja na kukimbia na vichwa vyao mikononi mwao."	"When I get home from work, the boys do a ""happy dance"" then has them lifting their legs in a similar fashion."
"Kwa kweli, Latvia iko nafasi ya 19 katika rating ya Benki ya Dunia ya kila mwaka ""Doing Business"" ."	Latvia holds the 19th rank in the Ease of Doing Business Index (2019).
6 la mwongozo wa kununua na kuuza chuma chakavu.	Six input and output channel.
na utegemee ukweli ili kuwa shahidi.	regard to be a witness of truth.
Sehemu ambayo kuku wakubwa wanaweza kutagia.	There are also areas that older children can play.
"""Sijui ni nani?"""	"""I don't know who is it?"""
Nchi nyingi kote ulimwenguni zimeona kesi za COVID-19 na kadhaa zimeona milipuko.	Many countries all over the world have seen circumstances of COVID-19 and a number of other have seen outbreaks.
like the vitabu (yes theres books!)	"""Yeah, like (the comic books)!"
Biblia Hungarica	The Bible in Myanmar
The Origin of Day and Night - vitabu vingi	The Near and Far Future of Libraries - Blog of the Long Now
Kwani hizo zingine hazitungwi?	And the others are unscathed?
wewe Know wewe upendo One mti kilima When... - One mti kilima - fanpop	You know, if a tree falls in the woods- if a prime number-
Kimsingi mume anaamini kuwa anawajibika kumtunza mama yake katika hali hiyo mpaka hapo ama atakapopona au vinginevyo.	In the past, a husband was thought to have an obligation to take care of his ex-wife until she got remarried or died.
Mbingu, hata mbingu zilizo juu sana, haziwezi kukutosha wewe.	the heavens, the highest of the heavens, cannot contain you.
CCM kuanguka 2015 ni ndoto vijana.	The theme for 2015 is A Young Commonwealth.
Ah vyote asee!	it all out!
Zilikuwa habari mbaya sana kwa Kitengo chetu.	This was a great value for our price.
Hivyo basi, kwa hesabu hiyo, wajumbe halali wa uchaguzi walipaswa kuwa 31.	Thus the sample size included 31 respondents.
Huu ndio uliokuwa msimamo wake kuhusu muungano kama mjerumani kutoka eneo la mashariki.	This was part of his plan to unify the German states.
Kiyoki Miko no mimae ni!	I've been stung by bees!
Lakini hiyo haiwezi kuwa mbali na ukweli!	But that might be far from the truth!
Na hii ni alama ya tuzo kwa ustahimilivu wao.	This is an indication of their perseverence.
Ni muhimu kutambua kwamba Player Windows Media 11 inatambua na ina MPEG-4, lakini Kitayarisha Sinema ya Windows ni vifaa kufanya vivyo hivyo.	It is important to note that Windows Media Player 11 recognizes and plays MPEG-4, but Windows Movie Maker is not equipped to do the same
Sina haja ya kuficha kile nilichonacho.	I don't want to watch what I've already watched.
Waja Leo: Diwani ya Maisha Edited By Ken Walibora	Currently reading: The Mortal Instruments Series by Cassandra Clare
tena hiki ni kikundi tu cha wahuni na wala sio waislam wote	But it isn't just Muslims and it isn't all Muslims.
"Watasema: ""Bali nyinyi wenyewe hamkuwa wenye kuamini."	"They will say: ""No you were the ones who would not believe."
"Kiyotaka Ueno More at IMDbPro """	"Look forward to seeing more ofBamboo Forest."""
safari yake ya muziki ikaanza.	His musical journey had begun.
Mtoto wangu anafurahi katika shule hii.	My son is so happy in his school.
sasa nakushauri sawa una hasira, hebu tulia n think is he always that way au ni kweli kwamba	Even now, I am really dizzy, and I keep saying to myself, maybe it's normal, maybe everyone is like this...
6 BWANA akamwambia Kaini, Kwa nini una ghadhabu?	"6 So the Lord said to Cain, ""Why are you angry?"
Alikuwa * mzuri sana.	It was quite beautiful).
kusubiri waweze kutoa mapendekezo yao ili kuiingizwe katika kanuni ambazo	relationships might constitute threats to their adherence to the fundamental principles.
Mahitaji ya kufungua akaunti ya kampuni katika LeuPay	Reasons to open a company in Lithuania
Nafurahi kuwa mwanajukwaa wa JF Utambulisho (Member Intro Forum) 2 Nov 3, 2018	I'm glad to be one of Jehovah's servants(video) July 21, 2018
Kama ilivyotarajiwa, alifanya hivyo kwa kutoa wimbo - Hi.	Apparently, he did so with the creation of ETH.
Makosa kama haya huwadhalilisha zaidi kwa umoja wao na huwafanya rahisi kunulika.	bly enhances their unity and makes them easily remembered.
Mungu anasema katika mithali nawapenda wale wanipendao na o wanitafutao kwa bidii wataniona naamu na mali idumuyo ni yao.	God's Word -I love those who love me, and those who seek me find me.
"18 Kwa hiyo Hushai akamwambia Absalomu: ""Sivyo; lakini yeye ambaye Yehova amemchagua na pia watu hawa na wanaume wote wa Israeli, nitakuwa wake, nami nitakaa pamoja naye."	"v.18 Hushai said to Absalom, ""No, the one chosen by the LORD, by these people, and by all the men of Israel - his I will be, and I will remain with him."
Bali tumewaletea Haki, na kwa hakika wao ni waongo.	"""Nay, We have brought them the Truth, and verily they are liars."""
Angalau ni kipenzi changu kwa leo, au wiki hii hata hivyo.	Anyway, that's what I've got for today, or at least for this morning.
wake up, daddy!	I mean, step up, Dad.
Nambari moja ya simu inaweza kufungua akaunti moja yapekee.	A cell phone can set off an explosion.
yao vilikuwa vya kidunia, japokuwa maneno yao yalikiri imani.	The veracity of their words was another matter, but at least they believed them.
Mapenzi ya Kukabana Koo Huenda Yakabatilishwa Nchini Uingereza	Hemp can be grown in the UK
Ahmood alizungumza kwa sauti ya chini sana ambayo mtu wa chumba cha pili hawezi kukisikia.	Weed spoke in a low voice so that other people wouldn't hear.
"23 Lakini Yesu akatambua kwamba wanamtega, kwa hiyo akawaam bia, 24 ""Nionyesheni sarafu ya fedha."	"23 But He detected their trickery and said to them, 24 ""Show Me a denarius."
Maelezo yote yapo kule.	All the other locations are to far.
mbinu ya kuhawilisha maneno kama yalivyo kuyapeleka katika lugha lengwa au	the meaning of a word as given in a dictionary or dictionaries
Nina ndoto ya kutembelea Alaska.	I have a deep desire to visit Alaska.
Akanikubalia kwa shingo upande.	He hit me in the side.
Inapaswa kuwa na kubadilika kulingana na tarehe za mwisho.	will need to change with the times.
Masha Fisher:	New fighters:
Medical Center lakini uume wako umedaiwa kukatika kabisa.	Medical Center, but his plans were never carried out.
SS kilichofuata.	The SSPX does follow suit.
Ni wa juu sana hivi kwamba siwezi kuufikia.	He's so big I can't get around Him.
Katika ripoti ya siku iliyochapishwa na Shirika la Usaidizi wa Wafungwa wa Kisiasa, iliripotiwa kuwa majeruhi wengine 4 walithibitishwa ndani ya masaa 24 yaliyopita.	A Ukrainian military spokesman said that seven soldiers had been killed in the last 24 hours.
Makala kuu: Historia ya Wiki	Columns: The Story of the Week
"""Yaani nikiwa pale sikuwa naona future yangu."	"""But I had no vision of my future."
"Huyo mtu kasemaje"""	"To What The Man Said"""
John Bamwisho	the end of John
Mimi sishangai kwa hilo, kama mtu mmoja ana trillion 3 itashindikanaje kwa selikari kupata hizo hela.	The sad fact is that without such regulation it is difficult to see how that $4.3 billion figure will drop.
Aibu kwa serikali yetu.	I am disgusted with our government.
Kuwa na uzoefu wa miaka 20 ya ununuzi na mauzo.	20 years experience playing private parties and clubs.
"""Ndiyo sababu tarehe 26 Oktoba mgomo wa kitaifa utaanza."""	"""Therefore tomorrow, October 26, a national strike will begin."""
Kila mmoja alitamani kufika siku hiyo.	Everybody was waiting for this day.
Watakuja tu!	Oh, they'll be coming!
Alikamatwa na wapiganaji kusini mwa nchi.	He was killed by natives in the South Pacific.
"Kis Ferano Seksi - Behind The Scene Photoshoot"">"	Panoramio - Photo of after the season ..
"""sawa lakini kabla hujaniroga hapo kitandani nilikuwa nakupenda tu!"""	"""I know I should go to sleep but I just really like talking to you!"""
"""Huyo sasa atakuwa mtuhumiwa wetu wa tatu?"""	"So he'll be our future master?"""
Unafanya nini unapokutana na mwanao baada ya kazi?	What do you do with your child when ur at work?
Mnururisho asilivu.	The radiation is not stable.
hapo akavunja uhusiano kati yetu.	It ended up ruining our relationship.
Kwa njia hiyo, unaweza kuchukua filamu kwa kuzaliwa kwake.	That way, you can take your child to a film for the birthday.
Luzern ni jiji katikati mwa Uswisi, katika sehemu inayozungumza Kijerumani.	Lucerne is a city in the German-speaking part of Switzerland.
'Hamjambo leo nimepata ujumbe (DM) kutoka kwa binti anayeitwa Caro aliye na mchumba kwa jina Michael.	l (TEAK) Today's interview is with a young lady from Emerald who goes by the name of Teak.
Yaani wao bado hawajawa wakali katika idara hiyo kama wa Israel.	The Palestinians are not exactly innocent bystanders in the ongoing conflict, either.
Hii sura si ngeni ila jina sikumbuki.	but I do not check that just the name.
serikali kwa sasa wanatia huruma sana.	Today, they are highly respected by the public.
Roho waovu hawawezi tena kujivika miili ya kibinadamu, lakini bado wana nguvu na uvutano mwingi juu ya akili na maisha ya watu.	The demons can no longer materialize, but they still have great power and influence over minds and lives.
Hayo aliyasema jana, wakati akizungumza na waandishi wa habari nje ya ukumbi wa Baraza la Wawakilishi, Chukwani nje kidogo wa mji wa Zanzibar.	He stated this while addressing some newsmen in Nnewi, Anambra state.
Jina langu refu sana..	My surname is very long.
Kufuatia sifa zake za kutokuwa dalili maalum, hizi mara nyingi haziwezi kutambulika kama dalili za maambukizi ya VVU.	Due to their nonspecific character, these symptoms are not often recognized as signs of HIV infection.
Macho yao pia ni asilimia 75 ya macho yao ya ukubwani.	Their eyes are 75% their adult size at birth.
Melanie Smith anaishi katika mji mdogo wa Canada wa Rocky Mountain wa Valemount, uliowekwa katika kilele kati ya Alberta na Briteni ya Briteni.	Melanie Smith lives in the small Canadian Rocky Mountain town of Valemount, nestled in the peaks between Alberta and British Columbia.
Imani zetu ni:	that's our belief:
Wanayaua maisha ya kiroho ya wale wanaowahubiria.	affect the spiritual life of the bereaved.
(Wazo la uzalishaji wa jumla-sifuri linajaa ugumu wa kisayansi na uwezekano wa matokeo mabaya na sera zisizo halali za serikali - lakini hiyo ni nakala ya siku nyingine.)	[Sometimes bad blocks are the result of power loss, and not the hardware problem; this is fixable, but a different topic.]
Kwa upande wake Mbunge wa jimbo la Kwela Mh.	At least he's not actively against the right to marry.
By hii agent.	According to this agent.
Slaa akiwa rais	Khaleda As Prime Minister
The zaidi we have the zaidi we want	The More You Have The More You Want
Wakati wa ziara yake Charles, akiandamana na Duchess wa Cornwall, atatembelea kijiji cha Mullaghmore katika kaunti ya Sligo - ambako baba yake mkubwa, Earl Mountbatten, aliuawa kwa bomu la IRA mwaka1979.	During his own trip Charles, joined by the Duchess of Cornwall, will visit the village of Mullaghmore in County Sligo - where his great-uncle, Lord Louis Mountbatten, was killed by an IRA bomb in 1979.
Waislamu au kuwatia khofu katika nyoyo zao, au ili zifike khabari zao kwa	Extended to blankets, or huddled in their hearts.
Mwalimu Keneth aliniangalia kwa dakika nzima, ni kama vile alikuwa akisoma kitu fulani machoni mwangu.	Charlotte looked at me for a few moments, almost as if she knew that I was holding something back from her.
Mzingo attacks Tazama	The stormtroopers assaults
Walakini, unahitaji kuwa na toleo la hivi karibuni la faili ya apk ili kufurahiya huduma zake zote.	However, you must recover the latest version of the apk file to take advantage of all its features.
Hizo ndizo ahadi za huyu Mh Slaa.	That's the promise of HoloLens.
Mwenyeiz Mungu atufanikishie bado miezi michache tu.	God has been preparing us for months.
Wakazi wamekuwa wanakimbia makazi yao ambayo wamekaa kwa miongo kadhaa.	People have been searching for its whereabouts for decades.
Katika mwelekeo huu, kazi ilikaribia mwisho.	In this way, the work was completed.
Marafiki wengi wa gari watasema kuwa hawajali maji.	Many interviewers have actually said that they don't care about traffic tickets.
Mwaka huu ngoja tuwasikilizie.	This year we asked to hear.
Mketo alisema maandamano hayo yalikuwa na lengo la kudai mabadiliko ya katiba mpya.	He said that the Amendments are to institute a technical change.
Ndio kitu kinachoendelea sasahivi katika kanisa.	This is the strange thing that happens in church.
Kumbuka kuwa kuongezeka	be noticed that the increase
Tunapozungumzia utawala wa kibinafsi huwa hatumkusudii mtawala bali aina ya utawala wake.	In the case of the state, we are not speaking of just any kind of leader, but a ruler.
marufuku kwa wakimbizi wote wa Syria;	a ban on all Syrian refugees;
Kazi huko Dubai 2018 kwa Freshers	whatsapp in 2018 for blackberry 10
Katika uwanja wa Flander.	in Flanders field.
na wa chini chini tuliojaribu kuufanya	In the foregoing we have endeavored to
Anonymous imesikia dai la uhuru wa watu wa Tunisia.	Zero heard the voice of the aristocrat.
Habari zilizotufikia zinasema kuwa, katika baadhi ya nchi za Ulaya kumewekwa taratibu zinazowalazimisha raia kufanya ujasusi dhidi ya Waislamu.	I gather in some European countries regulations have been put in place which encourage citizens to spy on Muslims.
Hii ni madhubuti kwa hisa za picha za familia.	That is the beauty of family portraits.
Swali ni zinawezaje kubadilishwa kuwa za wanandoa.	Modifications can be made to various marital issues.
Tunapenda sana kufanya ufundi wa aina hii.	We love to do those kind of studies.
bila faida yoyote ya uwepo wa maliasili hiyo, hivyo kama nchi tumeamua kupiga	unrelated to national security as such, we've always pinned the blame
"Malkia alisema: ""Kipaumbele cha serikali yangu ni kupata mpango bora kama nchi inatoka Umoja wa Ulaya."""	"The Queen said: ""My government's priority is to secure the best possible deal as the country leaves the European Union."
Kama ulikuwa hujui, Duniani ni kwa zamu.	But as far as they know, Earth is a death planet.
Nisaidieni kwenye hili tafadhali.	Please help me up on this.
Kwa kuegemea na uchunguzi ambao nimeufanya.	With the research that I have done.
Ushauri wa bure wenye thamani ghali.	A good defense attorney is valuable.
Tunadesign posters nzuri kwa ajili ya biashara kujitangaza online and offline pia (if printed).	We neeed a new logo for our online store and for marketing and promotional materials (print and online).
"Biblia inasema kwamba baadhi ya wafu wako ""Gehena."""	"The Bible tells us that some human beings are actually ""children of the devil."""
FB ni kwa marafiki tu.	EB Only close friends.
Hii inaandikwa kama shauri la biashara.	This bill is referred to as business statement.
Matthayo: Hapana sikumbuki kuagizwa hilo mheshimiwa hakimu.	EDIT: I forgot about Committee's ruling.
Nawatakia sikukuu njema tena	I will return one fine day
haujamalizika au kabla ya uteuzi wake haujafutwa.	They are not pre-steamed or reheated before it is served.
Haki ya kuondoa idhini:Ambapo uchakataji unategemea idhini yako ya hapo awali, una haki ya kuondoa idhini ya namna hiyo wakati wowote kwa kutuarifu hapa.	The right of opposition to treatment: Where the treatment is based on legitimate interests, you have the right to oppose it at any time.
"""Ni ajabu sana kama hujasoma habari za vita hivyo shuleni."""	"""It's rare to see outbreaks in schools. """
inayopendelewa SciFi/Fantasy TV show!!!	Based on the Cartoon Network TV show!</p>
Usile chakula cha watu wawili	A lot of food for two people
Craig Groeschel anafafanua hatua sita ya kibiblia yeyote anaweza kuchukua ili kuwa kiongozi bora zaidi.	In this episode, Craig Groeschel will show you the first three of six steps anyone can take to become a better leader.
Waaambie nchi unayokwenda kama wanafanya roaming.	Put them back in when you want to roam.
Wamamuziki wetu hujifunzia wapi muziki?	Who's teaching music to our children?
Tanzania hupokea misaada mingi kutoka Marekani.	Pakistan gets a lot from the USA.
Asijaribu ku reseat hiyo kitu.	It's not trying to fix anything.
task manager waweza ipata kwa kushikilia alt+cntrl+delete vyote kwa wakati mmoja.	This can be tried by holding down the ctrl + alt + f1 keys all at the same time.
Hapo nyuma Yamoto Band walikuja na kitu cha tofauti.	The riots then took a turn into something different.
Maamuzi ya Dogo Janja baada [...]	Poor shooting decisions [...]
Mistake Kid	The child's mistake
Tulikumbushana tulipokutana mara ya kwanza, mwaka 2004 mwezi Julai.	We met for the first time in September of 2004.
Chaguzi 3 za Usafirishaji wa Biashara ambazo huendesha Tabia ya Ununuzi	three-person anti-smuggling unit, which develops information from highway
Ujerumani imesema kuwa itatumia njia zote za kidiplomasia ili kuhakikisha kuwa wamewachiliwa huru.	Iran said it would use legal channels to secure his release.
Pia unaweza kudownload na kuangalia movie hizo ndani ya app hii.	You can also take screenshots and edit them in this software.
"""Wananchi, nadhani wote mnakumbuka."	"""Good, I've remembered all of you."
Wanalala kwenye internet na wanaamkia huko pia.	They met on the internet and they are there for sex.
mnaweza waambia watu kuwa kesho mnafunga ndoa	You tell people you meet you're married.
"""tunaweza kucheza kriketi ya kimataifa salama"""	"""We can fly a flag of victory."""
Inferno kidogo ni rahisi.	The fire is easy.
Mama yake Timotheo alikuwa Myahudi naye alikuwa mwamini; baba yake alikuwa Mgiriki.	Timothy's mother was a Jewish believer, but his father was Greek.
515,000 kila mwezi kwa miaka 10 (miezi 120) kwa ujumla utakuwa umeweka Tshs.	5000 every month (SIP) for a period of ten years, on an average, you will have accumulated Rs.
huyu dada nafanya nae ofisini.	"""She works with me in the office."
Ili Roho Mtakatifu kufanya kazi kila mahali duniani.	The Holy Spirit is working everywhere.
All images fair use.	The pictures, are all fair use.
Polisi wanaweza kukufunga wiki mbili bila kesi?	Can't go two weeks with no internet?
Nyakati za Mwisho by Eve.	The final face of eve.
Tenzi za Rohoni Tenzi za rohoni app inakuletea nyimbo za tenzi popote ulipo na wakati wowote.	Music apps for the iPhone allow you to listen to new music wherever you are at.
Kwa upande wake, wakili wake amesisitiza kwamba mteja wake hajafanya chochote kibaya.	The petitioner explained to his father that he had done nothing wrong.
Kikubwa chako kilili, hapandi yule mtwana,	Your grandmother was also there and no one has in the birth of their son.
Wawili hao waliteuliwa kwenye mkutano wa kamati hiyo uliofanyika Jumatano, Machi 31 kwa njia ya video.	Twenty-three films were shown at the festival, held March 31.
Ni ndani ya dakika kumi tu, mlango wa ofisi hiyo ukaanza kugongwa, Dk.	Within 10 minutes of the start, DC was dominating.
Mamlaka ya masuala ya kale nchini Israel (IAA) imesema upanga huo utakaposafishwa na kufanyiwa uchunguzi wa kina utawekwa katika maonesho ya umma.	The Israel Antiques Authority (IAA) has been quoted in media reports as saying that the sword would be cleaned, analysed and will be put on public display.
malipo yote ya umeme ni Tanesco.	All of the electrics are stock.
"Ila Amavubi hii nadhani ni the second largest Cruise Ship ""Meli ya Abiria"" inaitwa Oasis of the Seas (2009), kubwa kuliko zote huitwa Allure of the Seas (2010), zimepishana kidogo sana kwenye urefu ila vipimo vingine ni karibu sawa."	In contrast, Royal Caribbean's 'Oasis of the Seas', the world's biggest class of ship (in 2009) is 225,000 gt, which is nearly five times bigger than Titanic.
"""Tulitoa muda mwingi kwa wasimamizi wa aplikesheni hiyo kujibu na kutii maagizo ya mamlaka."	"""We gave considerable time to the application managers to respond and comply with the authority's instructions."
