Papa akutana na Rais Donald Trump na Mkewe Melania	The Queen will host Donald Trump and his wife Melania
"""Tulikaribisha hatua nzuri zilizochukuliwa na Ukraine kufikia ahadi zake chini ya makubaliano ya Geneva ya 17 Aprili na Ukraine, Urusi, Umoja wa Ulaya, na Amerika."	Here are excerpts from G7's statement: We welcomed the positive steps taken by Ukraine to meet its commitments under the Geneva accord of April 17 by Ukraine, Russia, the European Union, and the United States.
Yooote kutokana na yaliyotendeka humo.	All in all here's what happened.
Like - kama Liked:: walipenda Likes:: anapenda	Chapter 21:She likes him, he likes her
Tunatarajia hadi kesho muda kama huu mambo yatakuwa...	Tomorrow I am hoping for it to be such a day...
Aina ya kukomaa.	Type of maturity.
Misha Nonoo Fall 2015	Manmade disasters in 2015
Hasa katika mgogoro wa sasa wa Coronavirus.	Especially now with the coronavirus.
Mende anaweza kuwa njiwa bongo hii	The goalies could be a key to this
Ni hakika yetu kuwa kila mtu atavuna anachopanda.	(We all have the propensity to be dishonest.)
tangu tulivyomit nilikwambia moyo wangu umekudondokea.	Since then it feels like my heart has stopped.
Anaweka video nyingine kwenye mtandao wa YouTube kuonyesha polisi akimkamata kwa kusimama tu kwenye upande wa kutembelea:	The attached photo shows the terrorist on his way home just after being released by the Navy:
Baadhi ya wanawake Tabora watumia Ugoro kuondoa hisia za tendo la ndoa	Many women find the consequences to get rid of the heartburn.
Anasema pamoja na hilo ni muhimu pia mwanamke kuwa makini katika kipindi cha wiki 12 ya kwanza ya ujauzito wake.	She said it's also a good idea to limit visitors during a baby's first week of life.
Wengine wakaHamia Syria wakaingia ISIS.	Some people went to Idlib.
Hata hivyo, baadhi yao wamekana na wengine wakidai kwamba saini zao zilighushiwa.	However, some people have also mentioned having their mouths swabbed.
"""Hiyo ni pande moja."	"""It's one step."
Labda unataka kujiunga nao?	Or you might want to join them.
Katika mapendekezo ya mpango uliowekwa, wahamiaji wanaoingia Ugiriki kutoka Uturuki watarudishwa huku Uturuki ikipewa msaada wa kifedha na wakati huo huo raia wake kuweza kuingia barani ulaya bila visa.	Under the proposed plan, migrants arriving in Greece from Turkey will be sent back in exchange for financial aid and visa free access to Europe for Turks.
Itakuwa dili sana	It will be extremely
Na kwa lugha yako.	"""By your language."
Nami naomba niushutumu Usalama wa Taifa	I asked the national security
Ichi Nikita haljina	That's where I picked my name
Mfano wa aina hii ya kazi ni Ginsberg et al. (2009) (Google Flu Mwelekeo).	An example of this kind of work is Ginsberg et al. (2009) (Google Flu Trends).
"Haniwa ""kokeshis."""	Signed 'Sythes'.
Kwa mujibu wa kalenda mpya, wanafunzi watafanya mitihani ya kupata cheti cha elimu cha Uganda (UCE) kuanzia Machi 1, mwakani, mitihani ya kumaliza elimu ya msingi (PLE) Machi 30 na cheti cha juu cha elimu Uganda (UACE) kuanzia Aprili 12, mwakani.	The candidates, according to the new calendar will sit for their Uganda Certificate of Education (UCE) starting March 1, 2021, Primary Leaving Examinations (PLE) on March 30 and the Uganda Advanced Certificate of Education (UACE) starting April 12, 2021.
fanya kitu kiende kwa kuzungukazunguka.	do one thing. go through the whole thread.
Mwengine sijapatia, na wala sitomtaka	I will not give you any and I will not take any
[97.4] Huteremka Malaika na Roho katika usiku huo kwaidhini ya Mola wao Mlezi kwa kila jambo.	"""On that night, the Angels and the Spirit (Rūh / Jibrīl) come down by the permission of their Lord with His decrees for all matters."""
Codename: Kids inayofuata Door picha See anyone familiar?	3) Members of visible minorities: Based on the definition below, are you a member of a visible minority?
Lazima uwe Mwanajumuiya tu..	You just need to be a companion.
Neno la Mungu hudumu milele.	The word of God will forever stand.
ACTS 17:26 Kutokana na mtu mmoja aliumba mataifa yote na kuyawezesha kuishi duniani kote.	Act 17:26 From one man he has made every nation of humanity to live all over the earth.
Ili kuwageuza wasomaji wa kawaida kwa wateja (na kujua kama wao ni watazamaji wako bora), jarida ni bora.	To the degree they help create the conditions for the revelation (assuming it is a good one), they are beneficial.
Wamepoteza mwelekeo wameanza kuchimbana wenyewe kwa wenyewe .	Naked they begin to grapple with each other.
Ofa hii haitaweza kuhamishwa, kutolewa nakala au kuuzwa, na haina thamani yoyote kifedha.	This certificate is non-transferable, non-negotiable and has no cash value.
Waliosema Pep hawezi kuchukua EPL back to back , vipi mnalipi tena?. - JamiiForums	What's to say the Gophers can do it again Well, what's to say they can't.Cheap Jerseys from china
Wanatumia baadhi ya barnamiji kama swalah za pamoja katika baadhi ya siku.	In some areas, they use snags as day roosts.
Angalia maudhui ambayo ulimwengu unatazama -- kuanzia video maarufu za muziki hadi yanayovuma katika michezo ya video, burudani, habari na zaidi.	See what the world is watching - from the popular music videos to whatâ  s trending in game, news, sports, and more.
Hii itakusaidia kujiamini.	This will help you build trust.
Ilianza kama suluhisho kwa udidimiaji mkubwa wa idadi ya samaki ndani ya Ziwa Victoria, hata hivyo, umaharufu wa ukuzaji samaki kizimbani sasa watisha kuleta mathara ya kimazingira.	It began as a solution to the plummeting fish populations in Lake Victoria, but the growing popularity of cage fish farming is now posing environmental problems of its own.
Kumbuka, mtindo rahisi, ni bora.	Keep in mind that simpler is better.
Siku nyingine tena niliingia katika moja ya ofisi ya mkurugenzi wa taasisi moja kufuatilia jambo muhimu ikiwa ni sehemu ya majukumu yangu.	I even went so far as to ask one of the planning company's speakers if he was a major stockholder in concrete companies.
School ya Arusha.	the scholes of falsehede.
Faida zake nimezitaja hapo juu (kupata chaneli nyingi toka satelaiti tofauti tofauti).	I organized them according to topic (but note that there is a lot of overlap between different topics).
Nahisi Asifiwe amekusikia kilio chako.	I think he was touched to hear your message.
Najua unasoma maoni haya.	I know that you have read these things.
Napenda kuuliza kuhusu double jeopardy ambayo ipo kwenye fifth amendment ya US constitution.	Your starting point is the double jeopardy rule which arises from the Fifth Amendment in the U.S. Constitution.
wananchi katika kila hatua.	local moves at each step.
Akiwa shule ya msingi walifundishwa somo la muziki na yeye alikuwa akifanya vizuri sana na kuwa mmoja kati ya wanafunzi bora wa somo hilo.	In elementary school Vjeko performed very well and was a good example to his classmates.
Sababu wanataka kuni murder	Why do you want me dead
Mwajuma Bamtoriki in Canada	Weekly newspapers published in Canada
Hili ndilo swali kubwa ambalo lilikuwa linapita kichwani mwangu.	These were the big question that ran on my mind.
Kitaro Mizu Ni Inori Te	The Bed Is Not a Tampon
Kurudi kwa Supermarkets	Return of the supermodels
Basi neema gani ya Mola wako Mlezi unayo ifanyia shaka?	"""Which of your Lord's blessings would you deny?"""
Na hakika hii (Qur-aan) bila shaka ni ukumbusho kwako na kwa watu wako na mtakuja ulizwa.	A nd most surely it (the Quran) is a Reminder for you and your people, and you shall soon be questioned.
Jeni Patience	Shireen Geduld
Kwanza msogelee karibu kisha hakikisha kama yupo hai ama laa.	First and foremost, check the condition of the victim and ensure if he is alive.
Kama kwa wakati wote, pumzika tu.	As is always the case in realignment, stay tuned.
HISTORIA: Kwa Wayahudi, Hekalu palikuwa ni mahali muhimu zaidi duniani, hata muhimu zaidi kuliko nyumba zao wenyewe.	This is important because to the Jews, the Temple was more important even than scripture.
Nibiru 2011 Photos images	In 2011 nude photographs
Je, unaamini kwamba kuna maisha baada ya kifo?	Do you believe that there is a life after death?
na lilifee,	by right-clicking,
Kwa maradhi sihitaji dawa, dawa	Love doesn't need drugs or medicines.
Azimio halikufa kama tunavyotakiwa tuamini; halikuzikwa kama tunavyohubiriwa; bali walijaribu kulizika likiwa bado lina pumzi; na sasa limeamua kuamka.	They were not experimenting with ideas, as we are now; they were forced to evolve carefully, and had the opportunity.
Kupenda kwa sababu tumeumbwa kupenda, na ndio wito wetu wa msingi.	We have been created by Love and Love is the core of our being.
Kuhusu changamoto ya vitendea kazi Mhe.	about the challenges of partnership working.
yao, lakini alijulikana kuwa ni milionea.	were affected, but it was certain to be several million.
Kiara Heart Shape Wall Mirror...	cropped view of fo...
Hata hivyo hakufafanua jinsi sheria hiyo itakavyotekelezwa.	He, however, did not spell out how this would be done.
Alisema kunapaswa kuwepo majadiliano zaidi kuhusu suala la adhabu ya kiboko kwa sababu wanafunzi huenda wakajihusisha na utovu wa nidhamu wakijua kwamba hawawezi kuadhibiwa.	He also said there should be more consultation on the issue of corporal punishment as pupils could engage in illicit behaviour, knowing that they would not be punished.
Naomba akutane na Lincoln kwenye anga zake	I wish to meet President Lincoln in the afterlife
Simulizi ya mwanamke aliyebakwa na Baba yake tangu akiwa na miaka mitano	From a Father to his Daughter: 5 Years
Jinsi ya kufundisha watoto kusali sala ya Bwana	How to Teach Children The Lord's Prayer
Waziri Mkuu wa Uholanzi Mh.	It was not the Dutch.
kimber1988 New Kid On the Block	February 14, 1999 New Kid On The Block
Hii ni tafsiri yako wewe.	This is your translation.
ae leo harder?	It's harder now?
Tutafurahika sana kwa kila kitu	I'll be happy with everything
Na stori haishii hapo: bado kuna makasha matatu hayajafunguliwa.	The island isn't totally deserted nevertheless; there are 3 coastline bars located below as well.
Utafiti unaonyesha karibu watu 72% hakimu kampuni na ubora ya kadi yao ya biashara.	Research shows that 78% of people judge a company by the quality of their logo design and business cards.
The P & O feri terminal unajumuisha Troon na Larne katika Ireland ya Kaskazini.	P&O Ferries Irish Sea operate both freight and passenger crossings to Larne in Northern Ireland.
Hatuna nguvu kuliko yeye, je!	We are stronger than him.
Alitawala hadi kifo chake.	He governed till his death.
"""Lakini wakati wa usiku aliamka na kuchukua wake wake wawili na watu wake wawili wahuduma na wanawe kumi na mmoja...."""	"""And he rose that night and took his two wives and his two maidservants and his eleven children."" (32:23)"
Ni nani anayeweza kuwajibika ikiwa hii itasababisha upendeleo katika upimaji bora wa virusi na utafiti wa chanjo?	How could this be possible in a country that prides itself on the widespread availability of HIV testing and treatment options?
mashabiki wanachagua: Yea they were	The wise men: who they were
Nimeona si vyema endapo nitakufa nikiwa na siri yangu hii.	But I would have died from seeing this sight.
Tunaipokea shule hii kama zawadi ya Mungu kwa watoto wetu: ni nyumba aliyo waandalia watoto wetu.	These children are God's gift to our family, a gift for which we are truly thankful.
Ikiwa nyumba ni jengo ambalo limekusudiwa kukaliwa na watu.	A house is a building made for people.
Ni nani aliye anzisha miisho yote ya dunia? jina lake ni nani, na jina la mwanawe ni nani, ikiwa unaweza kusema? ~ Mithali 30: 4	"What is His name, and what is His Son's name, if you know"" (30.4)?"
Watoto hupewa maziwa yalichanganywa na madini ya magnesim.	Babies are protected from Measles.
Hiyo ni namba ya simu!	That's a phone!
Mungu ni mwema hatokuacha ufe kifo kisicho chakwako.	God forbid that he dies unconfessed.
Huu mzigo muda si mrefu utashuka TZ	stormy weather will soon be here in KS.
sikilizeni kile ambacho kilitokea maishani mwangu.	Understand what happened in my life.
Bernadette alifikishwa mahakamani kwa kosa la kufanya shambulio la kudhuru mwili.	Burnette had been convicted of indecent exposure.
Hadithi yako dada ni kama ya kwangu.	Your story is quite similar to my sisters.
Akiwa na baba yake - Xmas Day	day with my dad...while
VirZoom: Maamuzi Zoezi Fun	JONATHAN: These are emotional decisions.
UsportsHub - Alianzo	E-Scooters - Not Permitted
"Unapoaswa kukaa ndani ya Mungu , ndani ya neno lake "" Ninyi mkikaa ndani yangu, na maneno yangu yakikaa ndani yenu, ombeni mtakalo lote nanyi mtatendewa."""	"Focus Verses: ""If you remain in me and my words remain in you, ask whatever you wish, and it will be given to you."
Anyway baada ya ARI MPYA....	just after some new...
Hiki ni kiwewe wala si mkakati wa kukirejesha chama katika misingi yake.	That is a choice, not the result of applying neutral principles to analyze the world.
Madee ameendelea kusema kwamba wawili hawa wote ni watu maarufu hivyo...	old-timers would indicate that both of these characters -
"""Kuna masuala mengi ambayo yanahitaji kukamilishwa kuhusiana na uchunguzi wa ufisadi ndani ya Kemsa."	There are still many gaps to be filled in the study of biomedical engineering history.
Soma Pia: Jinsi Ya Kuongeza Nafasi Zako Za Kujifungua Msichana Mrembo	Also Read: How to increase your chance of getting pregnant
hakuna anauemchuna mtu tunaenda na hela zetu na tunarudi na hela zetu	he'll think no one is home and go back to Asia.
gani kupata mtoto umri	What happens when a child?
"Jambo hili pia litajumuisha ubadilishaji wa mkataba."""	"It also includes changing the leadership."""
"Nafikiri anapaswa tu kukamatwa!"""	"It only appeared to be caught!"""
Chanjo kwa nchi zaidi ya 30	the country in more than 30
Wakristo Wanauliza Kwanini Wanaume Wanaruhusiwa Kuoa Wake Wengi Na Wanawake Hawaruhusiwi?	Paul Asks Are Christians allowed to marry non-Christians?
Siyo walemavu wote ni ombaomba.	But not all are praying.
Mganga huyo akaniuliza kwa sauti ya wasiwasi.	he asked the question with bated breath.
Nani aliyetujali	Who Cares for Us
Jitihada za kila mmoja zinahitajika kutolewa ili ziwafikie walengwa.	Their efforts are needed in order to get everyone to pay.
Hizi ni Trust Funds au vichaka vya pesa za wizi?	Credit Union or Money Lenders?
Anna alipoamka asubuhi, alihisi uchovu na homa.	From the moment I woke up in the morning, she was demeaning and belittling.
Ukitaka namba zangu za simu nitakutumia.	If you want to call me, I'll have my cell phone.
Kwa kweli itakua ngumu ndugu yangu.	That's gonna be tougher to find brother.
Msikie Moze Iyobo kwa mtoto wake	Imam's Advice to his son
Tunaweza pia kupata somo kutokana na maisha ya familia ya Yosefu.	We can also learn from Joseph's life story.
Na watu wanaoonewa wewe utawaokoa; Ila macho yako ni juu ya wenye kiburi, uwadhili.	"You will save the humble people; But Your eyes are on the haughty, that You may bring them down."""
Alidai kuwa sehemu ya pesa hizo zilitoka kwenye biashara ya mumewe.	He claimed that the money was of his business collection.
wa IPYF ni wa inspiring	The iFit program is awe-inspiring
Kama hii ni kweli, basi bila shaka inahusisha ukweli wa jambo nyeti mno kuhusu maana na uelewa sahihi wa INJILI!	If this is true, then it certainly applies to the truth of a matter so crucial as the meaning and correct understanding of the gospel.
katika matumaini kwamba itakuwa ni nafasi nzuri zaidi ya	In the hope of better
Wote hao ni wajasiriasiasa.	They all are brave.
Jione daima uko duni kuliko wengine wote	Let's all be more like The Greatest
34' Margit M. Kwao 1-1	Spanish Lady 1:44 a. m.
Kwa watu wote walio na nia ya kuwa watumishi waaminifu wa Bwana, Injili hii itakuwa msaada kabisa.	For people who want to be good stewards of God's gifts, this is valuable information.
"Sisi siku zote ...Soma zaidi """	"Every day I... Read more """
JAS 4:11 Ndugu, msilaumiane ninyi kwa ninyi.	James 4:11-12 Don't criticize one another, brothers and sisters.
wavunjaji wa haki hizi wanashtakiwa kisheria.	The people who violate these laws are criminals.
Wenzetu hao walitukaribisha na mmoja kati yao, alitwita kwa majina yetu.	The two boys came over to us asked our names.
Wabunge wanaume waliungana kupitisha mageuzi hayo ambayo yataathiri pakubwa familia kwa ujumla	These ordinary children grew up to make discoveries that had an impact on all of humanity.
Prickly pears cactus katika theluji karibu na barabara ya kati ya Jiji White na Carlsbad Caverns.	Cholla cactus in snow near a road between White s City and Carlsbad Caverns.
"Kuwa angalau 36 ""pana."	"to ""at least 36."""
hawajabadilika bali ni wale tu watatu.	Of course they didn't cooperate, they're only three.
Kuweka Free Money - Cash katika Simu Slots No Amana Bonus!	How to use the bonus - cash in on a no-deposit offer!
watoza - hatua katika uwanja wa kisheria wa Ukraine.	Partisans in the steppes of the Ukraine.
Ina maana ya kuwa mkweli na hisia zako .	It's important to be honest with your feelings and concerns.
Kuna ambaye kakutana na tatizo kama hili tusaidiane	Some of the Ladies have similar problems & we already help each other.
Paulo aliandika barua ya Kwanza kwa Timoteo ili kuonyesha utaratibu wa tengenezo katika kutaniko na kuonya juu ya mafundisho ya uongo na kupenda feza.	The apostle paul wrote 1 timothy to set out organizational procedures in the congregation and to warn against false teachings and the love of money.
Taba Chake - Walk With Me 2 Years ago	fly with me - 4 years ago
Je, ungependa kujua wakati wako ujao?	Do You Want to Know Your Future?
"""Na jueni kwamba mali zenu na watoto wenu ni mtihani."" (8:28)."	"""And know that your possessions and your children are a test..."" (Quran 8:28)"
"""Ewe Rasuli wa Allaah, mimi nina ila tatu."	"""Oh, my gosh, I'm number three."
Najaribu kuwalinganisha hawa viongozi watatu kwa kuangalia safari zao za maisha.	I want to try to live with those three words at the forefront of my life.
"Wale wa kondoo wengine wanahitaji kujua majina ya wale wote watiwa mafuta leo?"""	"Assertion 4: ""Do those of the other sheep need to know the names of all those who are anointed today?"""
"""Nigeuze nimechoka kulala hivi?"""	"""Have I been asleep all this time?"""
Majira contractions yako inaweza kukusaidia kuamua jinsi ya karibu wewe ni kazi.	Timing your contractions can help you determine how close you are to labor.
Mara zote alikuwa akisisitiza kuwa, kuna Mtume atakuja baada yake, na jina lake ni Ahmad.	""" giving Glad Tidings of a Messenger to come after me, whose name shall be Ahmad."
Kyoto - kokosaika	The Kyoto Protocol - An Unmitigated Disaster
Wiki hii, hata hivyo, mbali zaidi wasiwasi ni juu ya akili ya wageni uwezo wa Istanbul.	This week, however, Woods' undivided attention belongs to North Texas.
"Makala katika jamii ""Biolojia"""	"The case of ""biotechnology"""
"You are at:Home""Habari360""Kauli ya kwanza ya Mbowe toka uchaguzi wa marudio"	Ecce Homo: The first 386 memory manager has been rediscovered
Wanachowaza ni kuangamiza chama fulani.......	They are willing to sabotage other members...
CZ: (wakes up) Who cares zako zako?!	Oooooooo...who is taking care of you??
Kid's Abaya (7)	Ashish's wedding (7)
Jeshi la Polisi ni muhimu mno kwa usalama wetu.	The well-being of our military personnel is crucial to our security.
And I've been thinking about Sawyer lately... zaidi ya mwaka mmoja uliopita	And I've been thinking about Sawyer lately... over a year ago
"Ah, neno la ""E"" lililoogopa."	"The word ""lift"" is frightening."
Lakini moyo wangu unaniambia kuna zaidi ya urafiki kati yao.	I let them know that I am interested in them more than friend.
na kuchangia uendelevu na uthabiti wa mifumo ya huduma za afya - Mwandishi wa EU	Modernising and securing the EU's health systems
"Hata kwa kuziangalia tu, mbegu zenye rangi aidha kijivu au nyeupe si salama."""	"In addition to being small, pups are also blind, deaf and almost hairless."""
Twenda Sasa	We're gonna walk now
Ndio yanaweza...	It's what they can...
Kumbuka kwamba mengi ya mawazo ya usimamizi yameshambuliwa na makundi ya [ [ maadili ya biashara], masomo ya utafiti wa usimamizi na uanaharakati wa kupambana na ushirika.	To be noted that many of the assumptions made by management have come under attack from business ethics viewpoints, critical management studies, and anti-corporate activism.
Katika majukwaa ya blogi kama Blogger au WordPress, na vile vile kwenye tovuti kubwa ambazo hukuuruhusu kuunda blogi yako mwenyewe, nguvu tunayohitaji kupima sio nguvu ya kikoa bali nguvu ya blogi yetu.	In blog platforms such as Blogger or WordPress, as well as in the large portals that allow you to create your own blog, the strength we need to measure is not the strength of the domain but the strength of our blog.
Kazi inaonekana.	The work has shown.
Hizi taasisi za utafiti, ni nani ambaye ni regulator wa hizi taasisi?	What are the principal regulatory bodies that administer those laws?
"""Unajua sisi mashabiki zetu wapo katika nafasi nzuri ya kusema kama ..."	We have lots of places where we, say, open a So...
Kwa kuunga mkono na programu ya Amref Health Africa.	Advocate for the expansion of Florida's Medicaid Program.
Watu wakasema, 'Ewe Abu Hurairah!	"The people cried ""Hurrah!"
maalumu ili kupata muda wa kutosha kuendeleza vipaji vyao, lakini pia kuwa na	efficient with allocating enough time to develop both of them but want to take it to a
#Huawei anaahidi simu bora zaidi ya 5G, lakini ni nani atakayekuwa na ujasiri wa kununua?	06:10p Huawei promises smartest 5G phone, but who will be brave enough to buy?
Apple mti wa aina hii inayojulikana kwa ukubwa mkubwa.	a pharmaceutically-acceptable salt of such a compound.
Urasimu kwenye hii nchi ni janga	spills in the region are blamed
Kilichobakia ni mshangao, maana hakuna kilichobaki, kila kitu kilikuwa kinaliwa bila wasiwasi.	We were very pleasantly surprised, nothing was missing, everything was perfect.
Nilifurahi na majina ya matokeo.	I enjoyed the achievement names, as well.
hawajui kuogolea kwanini walioga baharini?	Do sea urchins die if they are not in the water?
Tunaweza tu nadhani juu ya vidole	I can only imagine the heights
Uchumi wa Uchina unatarajiwa kukua kwa asilimia 7 na robo tatu kwa mwaka huu , ikiwa ni sawa na kiwango cha mwaka jana lakini hatari kidogo imejitokeza wamesema wachumi wa shirika la fedha duniani IMF.	China's economy is expected to expand at 73⁄4 percent this year - broadly the same pace as last year - but the risk of moderation has grown, according to International Monetary Fund (IMF) economists.
"""Kuna hadithi mbili: hadithi rasmi, uwongo, kisha hadithi ya siri, ziko wapi sababu halisi za hafla hizo""Honoré de Balzac"	"""There are two histories: official history, lying, and then secret history, where you find the real causes of events"" (Honoré de Balzac)"
"Kama maneno yanavyosema, ""huwezi kumpendeza kila mtu."""	"As the saying goes, ""Can't make everyone happy."""
lugha moja hadi nyingine.	one language to the other.
Na kufikia mahitaji ya chini ya umri wa 21.	Meet minimum age requirement of 21 years of age.
Sura ya Nne: Utatuzi wa suala la Palestina	The 4th Dimension - Israel's Underground War
"""Ni mmoja wa washambuliaji ninawaona wana kiwango cha kuitumikia United sina mashaka katika azma yangu hii na ndio maana ninapambana kwa ajili ya kupata saini yake."""	"It's an overreach which is an enemy of the core values of our society, which is why I stand to speak on it tonight."""
Alifariki akiwa Hospitali ya Kenyatta Agosti 9.	He died at Southampton General Hospital on 9 August.
Wakati Waja By Alpha Jackson	It's Time by Alison McCallum
k tu mama'y toda tu familia	only a portion of the mother's family
Vipi huko kawe hakuna msimamizi wa uchaguzi?	But what if there is no one decision maker?
Sisi ni maalumu Wingi Ni Zaidi Ya Kale wazalishaji na wasambazaji / kiwanda kutoka China.	Much more than the well-nurtured athletes of US and China.
Nimekuwa nikifuatilia kwa karibu sana...	I have followed pretty close....
Kijk hier: The Yes Men	activist group, The Yes Men.
"""Naam"" alijibu na kumgeukia."	"""Yeah"" She answered and then left."
Watoto wa arian wanafahamika.	Amir's parents are encouraged.
Namwomba mora ampumzishe kwa amani kwani ni miaka 47 sasa ametutoka.	"Tell him to look after his daughter because he abandoned us for more than 4 years now."""
Serikali yaahidi kuwapandisha vyeo wafanyakazi wake _ JESTINA GEORGE	Man threatens to kill his neighbors - WCYB
Darlan hata hivyo alitaka kuendelea kuwa mvulana.	But Litwin still yearned to be a doctor.
"""Rais ana mamlaka chini ya katiba ikiwamo kubadili serikali."	"""The president has a right to change the Cabinet."
Mfano huu umechukua mabadiliko makubwa ya marehemu; Mwenendo mpya umeibuka.	This pattern has taken a radical turn of late; a new trend has emerged.
Unastahili haya maisha.	You're worth life.
Kutembea kama Henoko na kutumika kama Nuhu.	Served with Nachos as standard.
Pia ilisema watu wanashauriwa kukaa nje ya nyumba katika sehemu za uwazi.	It also urged that they be banned from indoor public spaces.
Njia ni hatari sana na ndio maana inashauriwa mama mjamzito kuwa makini na mwangalifu sana katika siku kumi na nne za mwanzo baada ya kujifungua mtoto wa kiume.	Indian tradition believes that a new mother and the new born have to be taken care of in the first 40 days after the baby is born.
"Kibantu ni ""Nsia"" na sio ""Sia."""	"You mean ""humans,"" not ""human."""
huyu mbona suruali imeshushwa...hajatendwa kweli?	Why Bitcoin is Doomed......to Boom!
WATOTO wana lazima yako, sasa hivi.	"""Children need you right now."
Hakika habari ambayo itakuwa rasilimali kubwa chini ya barabara!	It's really affordable for the long run!
Harani naye akamzaa Gazezi.	Leehan also scored a run.
Nikirudi nyumbani jioni ndiyo nafanya mazoezi ya muziki.	But when I go home at night, it's music.
Extra chaguzi vivyo hivyo kuwa na manufaa katika kuongeza asilimia ya ushawishi.	Additional choices will also be useful in increasing conversion rates.
