I recently moved cities and have been largely without the internet for the past 3 months as well as splitting up with my partner of over a year.	Hivi karibuni nimehama kutoka mji mmoja kwenda mwingine na mara nyingi nimekuwa sipati huduma ya Intaneti kwa miezi 3 iliyopita, na vilevile kutengana na mwenzi wangu wa kimaisha kwa zaidi ya mwaka.
More progress has been made on the heads.	Hatua nyingi zaidi hufanyika juu ya kichwa.
It#8217;s about a mutually-beneficial relationship.	& # 8211; Mahusiano kwa vijana waliookoka.
We'll always protect you.	Tutakuhakikishia ulinzi milele.
A Steering Group was set up to oversee the project, which has explored ways in which selection methods can be enhanced.	Serikali imelenga kukifufua kiwanda hicho ambapo imefanya utafiti ili kubaini namna bora ya kukifufua.
"""Instead, we are calling on the government"	"""Kwa pamoja tunaiomba sana serikali"
At the time, it was housed in Huis ten Bosch in The Hague.	Wakati huo ilikuwa iko katika Huis kumi Bosch huko La Haye.
36 He joined him in building ships to go to Tarshish, and they built the ships in E'zion-ge'ber.	36Akapatana naye kujenga meli za kwenda Tarshishi; Wakazijenga meli hizo huko Esion-geberi.
"relation to Africa: ""I have been there, I have lived there and seen"	"Ndundame; ""Mmmh, Jamani Mimi naona niishie hapa, nimewasindikiza vyakutosha"""
"a pop quiz question যুক্ত হয়ে ছিল: What song lyric, ""if I could reach the stars, I'd give them all to you,"" come from বছরখানেক আগে by cherl12345"	"a pop quiz question iliongezwa: What song lyric, ""for all those times wewe stood kwa me,"" come from zaidi ya mwaka mmoja uliopita by cherl12345"
they are stationed;	Washukiwa ni;
Are you pleased with what happened?	Je umeridhika na hali iliyopo?
"She said: "" My position is very simple and it hasn't changed."	"Alisema, "" Msimamo wetu ni rahisi, hakuna cha kuzungumza."
"""But,"" they replied,"	"Wakajibu wakasema,"""
In Vaughn.	MUcholl Wagon.
We get to know everything	Kujifanya tunajua kila kitu
He is still a miner and their family has grown to considerably.	Angali bado kijana na mchango wake kwa jamii yetu bado ni mkubwa.
I agree there are numerous laws that many of us are unaware of.	Ninadhani kuna makubaliano ya chini kwa chini ambayo watu wengi hatuyajui.
I took this picture at 11:30pm.	Miye nilichukua picha hizo saa 11.30 jioni.
In rural locations, the figure stands at just 22%.	Maeneo ya vijijini, ni 2% tu.
They'll have a sample.	Watakuwa na mfano ya kitu!
Is this one going to be true?	Je hii tume itakuwa ni ya Haki kweli?
Sarah intended to follow her advice.	Sara akipayuka shauri yake.
The Pitch: No.	* Pulizia pareti: Si.
The physical high priest was only allowed to enter the Most Holy Place in the temple once a year, on the Day of Atonement.	Alikuwa ni mtu pekee aliyeruhusiwa kuingia mahali patakatifu sana katika hekalu ili kutoa sadaka maalumu mara moja kwa mwaka.
"""Try to think him a good man, won't you, dear Liddy?"""	"""Do ya want a nice lil' pony hug, ma'am?"""
They simply don't know everything you are doing, and they don't know what you want them to do to help you.	ila hao wote ni washamba na hawajui wananataka nini kwako
near the shoulder with both hands.	Karibu sana mkuu,tena kwa mikono miwili.
DO you have a fear or phobia of coming to the dentist?	Unaogopa au una wasiwasi wa kwenda kuona daktari wako wa meno?
They live by the fact that they're able to outlast you!	Wanapenda ngono angeweza kululipa wewe!
Everywhere we see pictures of naked women.	US hapa unamkiss mke wapo popote.
I am trying to flush out from the Government the truth of the position, namely, that it is a scheme of nationalisation as the Prime Minister says.	Navyofahamu mimi kauli ya Waziri mkuu ni kauli ya serikali, kama aliahidi ni jukumu la serikali kutimiza.
But besides that they were written in languages, known only to	na mambo yake ya ki-ilimu ambayo yalikuwa hayakuwa yakijuulikana ila katika
school division of the 1996	Matokeo Darasa La Saba 1996
"The story of ""Chicago"""	"aka ""Chicago Story"""
It's good to have something different in your assortment.	Ni vizuri kuwa na kitu tofauti na fresh katika kabati lako.
Listen, O earth and all who are in it.	dunia na wote waishio ndani yake.
From the Westminster Catechism, the first question: What is the chief end of man?	Katika Mafunzo Mafupi ya Kiinjili ya Westminster, swali la kwanza ni: Je, ni nini mwisho mkuu wa Binadamu?, yaani ni, ni nini lengo kuu la Binadamu?.
Giant pandas: the last refuge.	Charama dhatu: - last dhatu.
"it's called ""accidental"""	Hiyo inaitwa 'unrelated event
Check 'HSS' translations into Spanish.	Angalia tafsiri za '-員' katika Kipolandi.
So... the US doesn't have immigration laws?	Kwani marekani hawana makampuni ya kutengeneza handset??
A: I will be starting Sunday's Supper.	Chanzo: Nipashe Jumapili.
"""I have no other way of making money to survive."	"""Hakuna njia ambayo ningepoteza pesa kwenye upasuaji."
I'm not here to punish you; I'm here to teach.	Sijakuja hapa kucheka na wewe, nimekuja kukufunza adabu.
Katherine, filled with anger at her sister's	Antonio Conte hasira za faini ya FA azipeleka kwa mkewe
See also: Ben?	Makuta: Huh?
"They said, ""O our father, ask for us forgiveness for our sins, for we are truly at fault."	"""Wakasema: Ewe baba yetu tuombee msamaha kwa dhambi zetu, hakika sisi tulikuwa ni wenye makosa.""Yusuf: 97."
We recommend using machine translation software that has a Spanish translation tool and can easily translate text to speech, such as the Vocre app, available on Google Play for Android or the Apple Store for iOS.	Tunapendekeza utumie programu ya kutafsiri mashine ambayo inaweza kutafsiri maandishi kwa urahisi, kama programu ya Vocre, inapatikana kwenye Google Play ya Android au Duka la Apple kwa iOS.
What's happening in Mexico is a struggle to establish the rule of law.	Kinachoendelea ndani ya chama chetu ni mapambano ya kukuza demokrasia.
During the rally, they demanded democratic change in Iran.	Upande wa upinzani unataka mabadiliko ya kisiasa nchini Zimbabwe.
Leave it to the experts to do the job right!	Hebu fafanua hilo ili Doctor nifanye kazi yangu ipasavyo!
He asked them to set priorities and stay focused on issues such as sustainable development, climate change, women's empowerment, youth empowerment, and many other issues.	Amewasihi waweke vipaumbele vyao na kuendelea kufuata malengo yao ya juu ya mambo ya maendeleo endelevu, kama vile mabadiliko ya tabia nchi, kuwawezesha wanawake, kuwawezesha vijana na mambo mengi mengineyo.
But one age group is bucking the trend.	au kale kafella kengine huwa kwa The Trend.
ROSP strongly believes that education is the most crucial foundation stone of any society; without which the development and progress of any nation is not achievable.	Maadili ni miongoni mwa vitu muhimu sana katika ujenzi wa jamii yoyote lile, bila uwepo wa nidhamu ya kutosha jamii yoyote ile haiwezi kuendelea.
This home has been all over the news and it frightened many people.	Taarifa ile ilimshtua kila mtu na hofu kuu ikatanda kijiji kizima.
He continued to drink alcohol despite the fact that he was instructed to quit it by a doctor.	Inaelezwa kuwa alikuwa akinywa pombe sana licha ya kuwa daktari alimkataza kufanya hivyo.
"""I don't care, you must tell me the truth."	"""Siwatishi, lazima niwaambie ukweli."
And he has sent us, to do it.	Kwa hiyo kama ameshinda sisi tufanyeje,
Step 2 - Select the type of website you want and choose a pre-built template.	Hatua ya 2 - Chagua aina ya wavuti unayotaka na uchague kiolezo kilichojengwa hapo awali.
The FortNite team is still working on supporting a wider variety of devices in the next few days.	Presagen sasa amepanga kuongeza mtaji mkubwa wa kukuza ukuaji katika miaka michache ijayo.
In the more recent	Karibuni zaidi
It was founded in Hawaii.	Haleiwa Hawaii.
He conquered HIV.	Nakushauri ukacheki HIV.
"1,500 million a year,"" he said."	"sh. milioni 1.7 kwa siku,"" alisema."
There's Daddy's with the sacrifice	Kina baba wakiendelea kupata sadaka
Check out movies before you see them.	kasema labda wataona hizo movies kabla hajawaambia..
Everyone needs a family member like that, I think.	"Kila mtu anahitaji eneo kama hili nadhani, nikiwa mmoja wao."""
90 year old Zimbabwean President, Robert Mugabe has been announced as the new Chairman of the African Union.	Rais mkongwe wa Zimbabwe Robert Mugabe, mwenye umri wa miaka tisini, sasa ameteuliwa kuwa mwenyekiti wa muungano wa Afrika-AU.
"""As we speak the suspect is in custody at Kapsokwony police station while the victim whose private parts were badly damaged is recuperating at Kapsokwony district hospital,"" he said."	""" Mshukiwa alikamatwa na anazuiliwa katika kituo cha polisi cha Kapsokwony huku mwaathiriwa ambaye sehemu zake za siri ziliharibiwa sana anapokea matibabu katika hospitali ya wilaya ya Kapsokwony,"" Ndiwah alisema."
Some of the community resisted the eviction and clashes continued throughout the day.	Habari zaidi kutoka eneo hilo zinasema kuwa kumekua na mapigano usiku wote wa kuamkia hii leo.
You can purchase a one-month supply of Legal Dianabol online from Crazy Mass for the small price of $64.99, which is a cost savings of at the very least $20 when compared to costs of this product as noted on several competing sales websites.	Unaweza kuagiza ugawaji wa mwezi mmoja wa Dianabol halali mtandaoni kutoka kwa Misa ya Crazy kwa gharama ya wastani ya $ 64.99, ambayo ni akiba ya kifedha ya angalau $ 20 ukilinganisha na gharama ya bidhaa hii kama ilivyoainishwa kwenye tovuti kadhaa za mauzo.
It would no doubt reassemble itself, but they had enough time to escape.	Badala yake watekeleze agizo hilo, kwasababu walikuwa na muda wa kutosha wa kufanya maandalizi.
In the UK, whiteness as a original interpretation with the Health Professions Council (HPC) is human.	Katika Uingereza usajili kama mwanasaikolojia wa kimatibabu na Baraza la Taaluma za Afya (HPC) ni muhimu.
Humbly To Officials and Leaders.	kiburi kwa viongozi na watumishi wa umma.
The context is clear: the dead is restored to life.	Ulizo la Kuacha: Wafu wataishiki tena?
mr blandings dream house mr blandings builds his dream house cast	Home Entertainment Chid Benz afungukia muonekano wake wa nywele
The Siths The King is Dead	whilo Hia Majesty tho King waa on
Colossians 2:3 in which are hid all the treasures of wisdom and of knowledge.	COL 2:3 Ndani yake zimefichika hazina zote za hekima na elimu.
30. a song that reminds me of something sad	mo music akitaja kitu asichoweza kukisahau kuhusu
Kombucha making workshop.	KimChi Making Workshop
Do your night sky.	Make Your Night Shine.
We need to put pressure on the liars!	Eti anadai tusisikilize uongo wa wale!
I want to address the workforce question.	Naomba suala la uhamisho kwa wafanyakazi liangaliwe.
In other words, it makes you not want to start smoking cigarettes again.	Matokeo yatakuwa kwamba utaanza tena kuvuta sigara.
Those to whom We gave the Scripture (i.e. the Tawrah and the Injeel, etc.) before it, - they believe in it (the Qur'an).	Wale Tuliowapa Kitabu kabla yake, wao wanaiamini (Qur-aan).
Isn't it said that the Three Days of Darkness will descend ...	Itakuwa wazi katika kizuizi cha siku 3 cha kukomeshwa kwa saa ..?
I took their education very seriously because I see it as a parental role, not a government role.	Nimemsikiliza kwa makini sana, nilichogundua ni kuwa kwa sasa Bunge letu linafanya kazi kama idara ya serikali na si mhimili unaojitegemea.
A lot of consumers still do.	Waajiri wengi tu bado wako hivyo.
"I want everyone to know!"""	"Tunataka kumjua kila mmoja wenu!' """
• New York City has an advanced	• China yasukuma mbele mageuzi mapya vijijini
"Natalia Kanem said: ""We must push back against forces that would see us return to a time when women had little say in reproductive decisions or, for that matter, in any area of their lives,"" ""The fight for rights and choices must continue until they are a reality for all"""	"Kanem amesema, ""ni lazima tukabiliane na vikwazo vinavyoweza kuturudisha wakati ambapo wanawake walikuwa na sauti ndogo kuhusu maamuzi ya afya ya uzazi au kuhuzu maisha yao kwa ujumla,"" ameongeza kuwa, ""vita vya haki na maamuzi vinapaswa kuendelea hadi pale itakuwa ni hali halisi kwa wote."""
planks of wood, then	Woods, Kisha
How to Drift a Motor...	""" Ways To Make Your Engine Run A..."
A 12 year old girl stands in her bedroom.	Alifikiria kaka yake wa miaka 12 ambaye yuko kwenye chumba chake.
Speak to the leader.	Sibishani na kiongozi.
You can't replay or make a different choice.	Huwezi kubadili kaya ile na kuchagua kaya nyingine.
This was May of 2013.	Hiyo ilikuwa ni Mei 2013.
Imhanruor said the defendants were not given an opportunity to defend themselves during the hearings that led to Justice Oyinloye's judgment.	Jaji Fremr alibaini kuwa hakuna kesi ya kujibu kwa watuhumiwa hao kutokana na tathmini yake katika ushahidi uliowasilishwa na upande wa mashtaka kwa mujibu wa mwongozo wa mahakama hiyo.
'We will have a family Christmas, but without Maria.'	"""Siku moja nitakuwa na familia, lakini si kutokana na msukumo wa jamii."""
I'm looking for inexpensive pets.	Natafuta wauzaji wenye bei nzuri (ndogo).
I want a cent...	Ninaomba chupa moja ya ____.
He closed them and said, 'When the soul of a person is taken away, the vision of the eye also follows it.'	Akayafunga na akasema: ((Hakika roho inapotolewa, macho yanafuatia [kupoteza uoni)).
He is a black snake in green grass.	Kweli huyu mzee ni green snake in green grass!
Madarine had been out for four weeks but had captured nothing.	Polisi walinitesa kwa saa nne lakini bado hawakupata habari yoyote kutoka kwangu.
What Taxes Are Owed on Business Income in New Mexico?	Gharama ya usajili wa kampuni ni nini New Mexico?
Teaching is different.	Uzoea tofauti.
I'll leave this comment	Nasimama na hii comment
I don't think he got any move changes in Sm4sh	sidhani kama kuna atakaepona kwenye hii tsunami ya M4C
If you want to do so, it's easy.	Na ukitaka kumchokoza ilikuwa rahisi.
Manoah's biggest problem, however, was a lack of faith.	Mkuu Tanira tatizo lilikuwa imani hairuhusu..
In describing the raid,	Akielezea uharibifu huo,
The company continues to pursue its plans.	jiji kuendelea na maandalizi yake.
I don't think I could ever sleep with anything on again.	Kimsingi sidhani kama naweza kulala naye kitanda kimoja tena.
A list of 8 words by pacificlight.	Mkusanyiko wa nyimbo 8 za Fulstan Amani.
Two intimate friends got divorced from their husbands.	Ila rafiki zangu wengine wanavalishiwa kwenye chupi na waume zao.
Therefore, you have to prepare your child.	Kwa hiyo, unapaswa kuweka malengo kwa ajili ya mtoto wako.
The Code has been developed with EU associations and companies, with active involvement and input from other stakeholders, including international organisations, NGOs, trade unions and trade associations, and together with the European Commission services.	Kanuni hii imetengenezwa na vyama na kampuni za EU, kwa kuhusika kikamilifu na maoni kutoka kwa wadau wengine, pamoja na mashirika ya kimataifa, NGOs, vyama vya wafanyikazi na vyama vya wafanyikazi, na pamoja na huduma za Tume ya Ulaya.
South Africa has only 1 point.	Afrika Kusini ina pointi moja.
Hansa is just one woman.	"""Shukran ila kaka mie ni mke wa mtu."
She places her trust in Him in all situations.	Zidi kumwamini na kumtegemea katika kila hali.
folks is me.	Watu ni mimi.
Mr Abramovich, 51, would be the wealthiest individual in Israel.	Bw Abramovich, mwenye umri wa miaka 51, atakua ndiye mtu tajiri zaidi nchini Israel sasa.
Each person knows what is in their own heart.	Sasa, kila mtu anapaswa kujua mwenyewe ndani ya moyo wake.
"""Now I have five of them."""	"Sasa, niko najifunza na tano kati yao."""
Then he turned away from the mirror and did not look in it again.	Baada ya hapo alitoweka kwenye macho ya watu na hakusikika tena.
The Book of Mormon and Social Justice	Shein mjini Moroni na fasili ya kisheria
From the album Pink Moon	From the recording Paka ya Mwezi
Never take two doses.	Usichukue dozi mara mbili.
The new Center	Lesha Center
As opposed to the POTUS.	kinyume na taratibu.
in the song, nothing can be explained:	From the song Hakuna Matata:
Tanzania is a...	Tanzania were...
no God but Allah, and Muhammad is the	Hapana mungu isipokuwa Allah na Muhammad (s.a.w.w)
I think you're having a mid-life crisis.	mi nafikiri we unapitia mid life crisis.
I weighed 127 pounds before I got pregnant.	kutoka kilo 112 nilizokuwa nazo before diat.
There was a 2000 ...	Hakika 2000 ulikuwa mwaka ...
Why do you want to write to Prezi?	"""Kwa nini unataka kuuchapisha muswada huu?"
You are the author of life; of every living thing.	Wewe ndiwe taa ya maisha, wewe Ndiwe mweza vyote.
All of them made progress.	Wote hawa wana maendeleo.
Sara B. on 1 February 2014	babu V.babu February 1, 2014
We can see from this verse that Lot was a true believer.	Kwanza, huenda Loti alitenda kwa imani.
in almost every Saturdays	Karibu uungane nasi kila Jumapili
Cornell Macneil has no children.	Носки McKinley Asio kids р.
10 things you don't know: adolf hitler	Mambo Kumi 10 Usiyoyajua Kuhusu Adolf Hitler Kumi Muhimu
He was belligerent, and he lost his fear of God.	kama alikuwa mlevi nafikiri aliacha na kuwa mcha mungu.
additional phases have been introduced, resulting in the number of phases	huduma nyingine za kibinadamu zimeboreshwa, ndivyo matokeo y a somo lake
"""When I went to New York I tried to remember things from years ago."	Na mimi mnibakizie jamani,vitu kama hivyo sijawahi kuvila nina miaka kadhaa
None of us have ever lived in an era when the banking system has collapsed completely.	Tupo katika kipindi ambacho hatujawahi kuwepo tangu mfumo wa vyama vingi uanze.
"""How are you still alive?!"	Feeling alive yet?!
The mini crawls.	Mini Warehouses.
Jovic, however, isn't noticeable by a handful of pretty impressing cars, booze, the swagger and girls .	Jovic, hata hivyo, haijulikani na wachache wa magari yenye kupendeza sana, mafuta, msungi na wasichana.
The tongue of a bell strikes the shell.	Ulimi mwema wamtoa nyoka pangoni.
London's Business Design Centre has also been confirmed as a vaccination centre.	"""Kikosi cha Zimamoto cha London pia kimeitwa katika eneo la tukio kusaidia kupona kwa mwili."
He was driving the car	Alitumia gari hilo
Kwang Soo's agency also released a statement regarding the incident.	OCD wa eneo husika pia aliandika taarifa ya tukio hilo.
What is available today are rubber hoses.	Siku hizi kuna pre paid roaming.
"remember His words, that ""blessed are those who mourn."""	"Je, si Neno LANGU husema, ""Baraka kwa wale wanaotii."
Inbound penetration is a maximum of 8%.	Mkoa kiwango cha chini kabisa ni Iringa kwa 8%.
have quick access to transport to hospital or home for emergency treatment.	Haraka sana mpeleke hospitali au kwenye kliniki ili aweze kufanyiwa upasuaji.
"Who are you afraid of and why?"""	Ni nani anamwogopa nani na kwa nini?
I'm going Thêm	Mi ningeongeza
Manchin did not respond in time for this report.	Samahani sikupata muda kujibu hii on time.
In addition to buffing & shaping of the nails. ~$30	Enough to make ya break and shake ya $$#
When your car is MOT tested, the testing station is required to run through a series of standard checks to ensure that it meets with the safety and environmental legislative standards applicable in the UK.	Unapowasili Uingereza, gari lako litafanyiwa majaribio kadhaa na marekebisho ili kuhakikisha kuwa inafikia viwango vya barabara kuu ya Uingereza.
(3:15c) but they also have put God	56 Lakini wao walimjaribu Mungu
the ideas of Digital Electronics and all types of Analog and Digital Modulation	Wauzaji wamizani aina zote digital& analogy
"Drew Rub answered, ""The fourth (a large snake), I'd drop dead of (a heart attack)."""	"Next Story → Saida Karoli ""Nilidhani nitakufa kabla ya Ruge, Dr. Mengi kanipigania kaondoka"" (+video)"
Learn the Truth (October 31, 2021)	- Sema Ukweli (@SemaUkweliKenya) September 15, 2021
Who are God's chosen people today?	Ni Nani Anaongoza Watu wa Mungu Leo?
Four failures in a week, I don't remember seeing this before.	Kwa wiki takribani nne hivi, sijaonekana katika safu hii.
It has been this way before and it will be this way again.	Ndivyo ilivyokuwa hapo awali, ndivyo itakavyokuwa tena.
See also the Table of Contents or Maps.	Check Link pia kwenye bio au profile.
Try it for next time.	Jaribu hiyo next time.
Things you do are driven by something.	Kupitia unachokifanya kuna mtu anaguswa sehemu.
Research published in the journal Nature shows that as global temperatures rise, the Arctic will not be spared, and fires like these may	Makadirio ya hali ya hewa duniani yanaonyesha kuwa chini ya mazingira yote, joto litaendelea joto - na miaka kama vile 2019 itakuwa kawaida ya muongo huu.
It is all very well for the Leader of the Opposition to shake his head.	Itakuwa ni aibu kubwa kwa rais wa nchi kufumbia macho upigaji.
Mo, 57 years - Canada.	Tea - ww tuna mayo 77, salad 40
Over half of the world's children threatened by war, poverty, bias:	Zaidi ya nusu ya watoto duniani wanakabiliwa na tishio la vita, umasikini na kutengwa kijinsia - china radio international
The factor here is that he is a one year rental.	Concern yake hapo ni hou mwaka.
I used to be prepared!	Nishakuwa mwehu tayari!
The training provided by them is really effective.	Huo mfano wa practical trainings ulioutoa ni sahihi kabisa.
The One who conquered the grave.	40 yeye ambaye huwamwagia dharau wakuu,
Marge has passed on.	Mars aka mr.
when you are hoeing).	Na mwende mnapo amrishwa. ***
Make the most of the light you have.	Tumia zaidi nuru unayopata!
This means that they must be a trustworthy person.	Kwa wazi, hii itahitaji kuwa mtu unayemwamini kabisa.
David showed courage.	Daudi Nyaburi
upon his freedom.	pamoja na uhuru wake.
We ain't promised no tomorrow	Kesho hatunayo ahadi
- The so-called Christ, Maitreya has said more than 30 years, operates the world yet unrecognized, in a physical body here on Earth.	- Kristo kinachojulikana, Maitreya amesema zaidi ya miaka 30, bado inafanya kazi ulimwengu unrecognized, katika mwili hapa duniani.
What happened to John Newton when he was six years old?	Ni nini ilitokea wakati Yohana alikuwa na umri wa siku munane?
Be prepared to give explanations.	Jitayarishe Kutoa Maelezo
The communicators: These people understand all the languages, even that of animals.	Nina sababu nyingine: mtu huyu ana uwezo wa kuelewa vitu vyote, hata vitabu vya watoto.
Yes I Will (2)	Yi, Jinyao (2)
A lady who had more money than c her	kwa taarifa yako huyu ndio mwanamke mfupi kuliko d
It is important to stay hydrated, especially if you are outside during the day.	Ni muhimu kukaa hydrate, haswa ikiwa uko nje wakati wa mchana.
the free fatty acids in the extracted	Cheap MBT Womens Katika Outlet Sale
I've told you all a lot of	Yote nakueleza, mengi umeyapitia
A baby girl has been found alive in a car more than 14 hours after the vehicle plunged into a river in Utah.	Amini usiamini mtoto wa kike alipatikana hai zaidi ya saa 14 baada ya garli alimokuwa kutumbukia ndani ya mto uliofurika huko Utah marekani.
"""The demographic of Facebook users shows that they're much older than Instagram's."	Machapisho kuhusu programu za Facebook Facebook wasikilizaji wa muda mrefu zaidi kuliko wastani.
The Omani Government's economic diversification plans are positively impacting the economy.	Tabia za maafisa wa serikali ya Tanzania huathiri kwa njia taratibu mfumo.
Roger becomes even more concerned about	George Njogopa na maelezo Zaidi:
Therefore, it would be safe to say that we have a right to see that base need fulfilled.	Kwa hiyo, ina maana kwamba tunacho chanzo cha uhakika cha fedha, tunachokihitaji ni kuhakikisha kwamba chanzo hiki kinatumika kwa madhumuni yale.
I would love to read stories of believers who challenge their mentors.	mimi nimipenda hiyo ya watumwa wa kiimani wanaoshindanisha mitume wao.
The day of the Lord?	siku iliyokubalika kwa BWANA?
This is your BEST OF 2015!	Kwa kweli kikundi chenu ndio bora zaidi mwaka huu wa 2015!)
These defects may contribute to a loss of synaptic plasticity. ..	Fuata hatua hizi inaweza kutatua ADAPTER vifaa wireless kukosa [...]
Fine... but we are still poor.	...ndo mana tunaendelea kuwa maskini.
Similarly, there was enough to keep me occupied throughout the flight.	Lakini ilinibidi niwe makindi katika muda wote wa mashindao.
Earlier, President Blaise Compaore had fled to neighbouring Ivory Coast after massive mass protest resulted in a military coup.	Muda mfupi kabla, rais Temer aliuta amri inayoidhinisha kupelekwa kwa jeshi katika mji mkuu baada ya makabiliano makali wakati wa maandamano yalitoendeshwa nje jengo la Bunge.
I am compelled to thank you for being one of the few public scholars on Mandaean texts and origins.	Nashukuru kaka kama mmojawapo wa wachangiaji na wasomaji mliokuwa na moyo wa kuachilia mapema.
Welcome to the elephant house!	Welcome nyumbani Elvis!
I've had the experience of hearing leaders	Mara kadhaa nawasikiliza viongozi wa
Playing in the moonlight.	Kucheza katika mapanga giza.
They're going to be on OGN Live?	Wakaishia hapo kwenye nn?
When individuals decide to sell their home, they are often overwhelmed with the whole process.	Wakati watu wengi wanaamua kukarabati nyumba zao, mara nyingi hufanya kuchimba kabisa.
MaryW commented on the word pharmacovigilance	Alichosema Rama Dee kuhusu sakata la madawa ya kulevya
If a member would like their photographs to be displayed on this website,	Kama kuna mwingine anapenda picha yake iongezeke hapa kwenye hii list anakaribishwa
When I was about 20.	Nilipokuwa na miaka 20 hivi
He is my Bwana.	Ni Haishu bian.
