come down from the cross, and we will believe in him.	Ashuke kutoka msalabani nasi tutamwamini.
Thats the first and most important step.	Hii ni hatua ya kwanza kabisa na muhimu sana.
3:26 When Joab had come out from David, he sent messengers after Abner, and they brought him back from the well of Sirah; but David didn't know it.	26Yoabu alipoondoka kwa Daudi, alituma wajumbe kumfuatia Abneri, nao wakamrudisha kutoka katika kisima cha Sirah, lakini Daudi hakulijua hili.
For best results with monitoring AD, read and understand the following:	Kwa manufaa zaidi,jitahidi usome kwa makini na uelewa haya:-
Kelloggs have created a new strategy to engage with the customers via text.	Whatsapp wameanzisha njia mpya ya kukaribisha watu kwenye group kwa kutumia link.
"""It directly ties to absolutely everything that happens in your community."""	"""Vizuri sana na pole kwa yote yaliyotokea hapa nchini kwenu."""
But the message needs to be sent.	Lakini ujumbe ni lazima upelekwe.
Then you can view the results in your browser.	Kisha unaweza kuona matokeo ya mwisho ndani ya akaunti yako ya Akaunti ya chombo.
"""It was an experiment that didn't catch on but we do think there's a fun game there."	"""Huenda ulikuwa si mchezo mzuri , lakini tumeona kwamba kulikuwa na hali bora kiasi katika mchezo wetu."
The centre aims to bring together people	Nia ni kugawanya watu
we are confident we will be able to help you.	Tunaamini tuna uwezo wa kukusaidia.
Therefore, you increase your chance to find employment.	Kwa kufanya hivyo unajiongezea nafasi ya kupata kazi ya kuajiriwa.
I'm now on the third stage of the 2016 Tour de Fleece.	Nasema hivi NITAKUWEPO kwenye robo fainali ya Sprite BBall Kings 2018.
However, he continued to promote the art without rest.	Hata hivyo, aliendelea kuhudumia mtaani pasipo kuwa na kibali.
Jesus will come one day to fulfill His promise to us.	Tunamsubiri Yesu ili siku moja aje atupeleke kwenye hiyo haki.
An acronym derived from American Standard Code for Information Interchange (pronounced as-kee).	ASCII - (American Standard Code for Information Interchange) ASCII (Msimbo Sanifu wa Marekani wa Mabadilishano ya Habari)
HOw is it possible to be born again?	Hata hivyo, mtu anawezaje kuzaliwa tena?
11to bring Queen Vashti before him with the royal diadem on her head, to show her beauty to the people and the officials, for she was very beautiful.	11 wamlete Vashti, malkia, mbele ya mfalme, amevaa taji ya kifalme; ili kuwaonyesha watu na maakida uzuri wake, maana alikuwa mzuri wa uso.
With the advance of science and technology, ...	Pamoja na maendeleo ya sayansi na teknolojia, ...
I'm looking for spiritual friends.	Natafuta marafiki wa kiroho.
The weeds are growing as fast as the plants.	Madume yanasifa yakukua haraka kuliko majike.
"23 And someone said to him, ""Lord, will those who are saved be few?"""	"23 Mtu mmoja akamwuliza, ""Bwana, ni watu wachache tu watakaookolewa?"""
Now more than ever as companies and organisations look to the future, they are going to look to analytics to help them charter their way.	Huduma kwa wateja - Sasa, zaidi ya hapo awali, watumiaji na wafanyabiashara sawa wanatarajia mashirika kujibu maombi yao ya huduma kwa wateja kupitia njia za kijamii.
and war being you know, just people going to war...	Na ikifikia hapo basi ujue tu kwamba wanawake huwa wanaadhibu kimyakimya...!
What our users have to say.	Nini wateja wetu wanapaswa kusema
In 2001, in a landmark case, nearly 40 pharmaceutical companies ended their challenge to a law that allowed cheaper versions of AIDS drugs to be sold.	Mnamo 2001, katika kesi kubwa ya kihistoria, takribani kampuni arobaini za dawa ziliacha kupinga sheria iliyoruhusu dawa za bei nafuu za Ukimwi kuuzwa.
This is a contrast between	Hilo y contrahilo
Some have had the code beginning with 2111.	A ndogo mizabibu kwamba ulianza 1121.
Is being used to de-block content from Youtube.	Inatumika kufungia yaliyomo kwenye YouTube.
Another one is wall-hanging stick.	Mwingine katika Picha ni Kingunge Ngombale Mwiru.
Cervical cancer is an important health problem in women living in developing countries.	Lishe duni ndio tatizo kuu linalokwaza afya za wanawake katika nchi maskini.
Please Forgive Me (S)	Kika Nicolela (BR)
Just how are we going to do Thanksgiving this year?	Vipi basi tutajiandaa kwa mwezi huu uliobarikiwa?
Studies have shown that yoga offers a variety of benefits to those that live with cardiac disease.	Uchunguzi wa matibabu umethibitisha kuwa Pregabalin hutoa matokeo bora kwa watumiaji wake wote wanaofuata maagizo ya kipimo.
Baby Michiko: (he hiccups and stills as if he was in shock himself).	Mwanawima: (Kimya anaona aibu hata kuinua kichwa chake.)
It stands to reason that the number of merchants selling products online is also growing.	Hivyo ni kawaida sana kushuhudia biashara ya vyakula mtandaoni ikikua pia.
The Scriptures are replete with admonishments for believers to persevere.	Na wala wasiyatilie shaka hayo walio pewa Kitabu na Waumini.
Here's your mule - Wikipedia	Naoki Wako - Wikipedia
my wife, Janette.	Nikiwa na mke wangu, Janette
I will go back . . .	Mimi nitarudi baadae. . . . . .
"Two men in white (angels in disguise!) ask them, ""Why are you men from Galilee standing here looking up into the sky?"""	"Wanaume hao wawili ni malaika wenye kuvaa miili ya kibinadamu, wanauliza hivi: ""Wanaume wa Galilaya, sababu gani munasimama na kuangalia katika anga?"
Men and women with mild to moderate	ni wanawake na wana mioyo myepesi sana kusamehe
And don't let out water after weeding.	Usije mtapisha baada ya kumpa maziwa.
There is a news feed at the bottom of the page that's automatically populated by news from Google, but I won't be manually adding anything.	Post yoyote itakayo ongezwa yenye link ambayo inatoka nje ya tovuti hiyo itakuwa na matangazo automatically bila mimi kufanya kitu kingine chochote.
Behind the Scenes: The Music of Films	Behind the scenes: muziki ubunifu
How Are You Doing, After School	Nini iwapo, baada ya shule
Now they've added three more deadly bats.	Sasa wanatakiwa kupiga 3 goals more vinginevyo wameula wa chuya!
Financial institutions need to find a way to access this new technology and incorporate quickly.	Teknolojia mpya zinahitajika kujaza pengo hili, na haraka.
"""We have a lot of work ahead to rebuild trust,"" Ms Marin told reporters."	"""Tuna kazi nyingi za kufanya ili kujenga upya uaminifu"" aliwaambia waandishi wa habari."
reminding her family that she is proud of her grandfather.	Ikumbukwe mama huyu anasema alikuwa na hamu sana na mume wake.
Love at first sight (hopelessly)	upendo At First Sight (One-Shot)
don't have a diploma in social engineering	Usikimbie nafasi ya Diploma na Elimu ya Umbali
That means there is a lot of work.	Yaani kuna kazi kubwa sana.
1st-day collection of Thugs of Hindostan: 52.25 crores	Baahubali 2 4th Day Hindi Collection: 35 Crore
Sex Thief, The (1)	Mfaume Mlawa, Hasa (1)
What kind of battle was fought here?	Amepigana vita ipi hapa nchini?
"Indeed, we felt that we had received the sentence of death"" (2 Corinthians 1:8-9, ESV)."	"Kwa kweli, tulihisi ndani yetu wenyewe kwamba tulikuwa tumeipokea hukumu ya kifo."" - 2 Wakorintho 1:8, 9."
the Mighty One of Israel, says:	Mwenye Nguvu wa Israeli, asema hivi:
That is what our government promised, and that is what we are going to do.	Hiyo ndiyo Serikali na hivyo ndivyo tulivyoahidi.
I do not ask you to take them out of the world, but to guard them from the evil one.	Mimi siombi kwamba uwatoe katika ulimwengu; bali uwalinde na yule mwovu.
She formerly led four ministries in the Norwegian government.	Hata hivyo bado hajafanya uteuzi wa mawaziri katika wizara nne ikiwemo wizara ya fedha.
I is more.	mimi zaidi.
"The Bible says ""The end of all things is near."""	"UTAJIRI WA NENO LA MUNGU ""Mwisho wa Mambo Yote Umekaribia"""
What comics are listed in the database?	Ni data gani inapatikana katika dashibodi yangu ya mshirika?
carry out this priority by collaborating with one another and with	kwa pamoja katika kutekeleza jukumu hilo kwa pamoja, pamoja na mashirikiano
Déby came to power through a rebellion in 1990.	Rais Deby alitwaa madaraka kupitia mapinduzi ya kijeshi mwaka wa 1990.
Running water is a good choice.	Kuuweka kwenye mafuta, ni uamuzi mzuri.
We try to keep the heat out as best as we can.	Tutajaribu kumaliza msimu vizuri kadri tutakavyoweza.
"""should the enemy declare samad is dead! i will put my hand..."	Ikiwa Faatwimah mtoto wa Muhammad ameiba basi nitamkata mkono wake)) [Al-Bukhaariy]
I have travelled all over the globe, often to exotic places.	Nilisafiri kotekote nchini, mara nyingi nikitembelea makutaniko yaliyo mashambani.
hhhhhhhhhhhhhh:)))) mesh tsadgy	My Shisha (@myshishastwendel)
He wants to help the Filipinos.	anataka iwasaidie watanzania.
I'm not talking about living like a monk.	Hapa sijasema ni kama boflo msije mkanitupia marungu.
all that is in the world, the lust of the flesh, the lust of the eyes, and the	kila kilichomo duniani, yaani tamaa ya mwili, na tamaa ya macho, na kiburi cha
Do you want to get news?	Unataka Kupata Habari Mpya?
What they are looking for on the Web?	Nini anatafuta katika hiyo internet?
We saw them set fire to it.	Tuliwaona wakiliteketeza moto gari.
See all homes in St. Joseph, WI	Angalia migahawa yote ya San Jose, CR
And even those who believe in Evil must do so for a reason.	Lakini waumini wengine hata nauli hawana, wamechoka ile mbaya!
These are local parties in the Libertarian Party of Arkansas.	Hawa ni wanasiasa katika Landtag kwenye jimbo shirikishi.
But Joseph wasn't through.	Lakini Yusufu hakufa.
Why don't they just call it something other than Cartoon Network?	Kwa nini kwa mfano TV isiitwe tu TV na badala yake wanaitwa eti Luninga?
were for Eastern Europe and not against the Soviet Union.	Kuhusu Magharibi na sio dhidi ya Magharibi.
It can be both and be beyond.	Inaweza kuwa chini ya hapo na si vinginevyo.
I have good access to community resources or activities (2019)	Ninatafuta nafasi ya kazi ihusianayo na sheria au huduma za kisheria (kuanzia mwezi August 2011)
Drink of it, all of you in remembrance of me.	"Fanyeni hivi, kila mnapokunywa, kwa kunikumbuka."""
"Who told you about that, or were you there?"""	Ndio unavyoongea hivyo au unamlegezea nani hapa?
Every damn thing amounts to them.	Yaani Madhambi yoyote ni Mali kwao
God has given you the spiritual gifts you need.	Ewe Roho Mungu ndiwe uliyewapa waumini vipawa vyako kwa kadiri unavyotaka.
The National Violence Against Women survey found that the user level.	Uchunguzi wa kitaifa kuhusu visa vya ukatili dhidi ya wanawake umeanzishwa kama alivyoamuru rais.
#366 is a true story	365# Ni Kutamu Sana Kwangu
Deep down we all know we were not born to suffer.	Sote tunapaswa kukumbuka kwamba hatukuzaliwa na ujuzi.
They see their mind and soul as superior to everyone else.	Atajaa moyoni na mwazoni mwako kuliko kawaida na wengine.
Just walk in and we will get you taken care of.	waende tu. wakimbie. we dont care.
Ronaldo has also received a proposal from former club United and the 35-year-old wants to restore the glory days at Old Trafford, though it depends on UEFA Champions League qualification.	Nyota huyo wa Ureno pia amepokea ombi kutoka kwa klabu yake ya zamani ya Man United na mchezaji huyo mwenye umri wa miaka 35 anataka kurejesha ufalme wake pale Old Trafford, ingawa inategemea kama United itafuzu ligi ya mabingwa - Diario Gol.
Each gives a lot of support to each step.	Wengi wanalaumu kila hatua.
Yes, 5 HTP ship anywhere in the world.	Ndiyo, Phen375 meli mahali popote duniani.
What you need to create a good information	Unachotakiwa kufanya kupata akaunti inayokufaa
Below are the San Marino Village public school districts:	Sehemu nyingi za kukaa San Bartolo District:
My prayer stopped there - as if I don't even deserve God's help.	Mungu amenipigania... Kama si mkono wa Mungu nisingefika hata hapa nilipo.
"your life will be exchanged for his life, and your people for his people.'"" 43 Sullen and angry, the king of Israel went home to Samaria."	"Kwa hiyo ni uhai wako kwa uhai wake, watu wako kwa watu wake.' "" 43 Kwa uchungu na hasira, mfalme wa Israeli akaenda kwenye jumba lake la kifalme huko Samaria."
"him, ""Lord, if you had been here, my brother would not have died."""	"Akamwambia, ""Bwana, kama ungalikuwapo, ndugu yangu hangalikufa."""
Not one of them was bought.	Hakuna anayenunuliwa hata mmoja.
If you want to get jacked, how do you do it?	Kwa hivyo ikiwa unataka kuvuruga kitengo, unafanyaje?
You ask them to stop fighting.	Waambie waache kugombana.
Al-Saadi Qaddafi fled to the neighboring country of Niger in September and the government there has given him refugee status.	Mnamo 11 Septemba 2011, al-Saadi alikimbilia nchi hiyo jirani ya Niger, ambapo serikali imeamua kumpeleka kwenye mji mkuu wa Niamey na kumshikilia.
Join the legions of players who turn to the AS-50 shuttlecock to maximize their level of play on the court.	Hakikisha kuangalia kwa Michezo ya Michezo ya Kubahatisha kwa Viongozi wetu bora wa Mods kwa wahusika wa 150 + kwenye Galaxy ya Star Wars ya Majeshi ili kuhakikisha kuwa orodha yako imara iwezekanavyo.
View from the top of Lisbon	Go Juu Lisboa View
Judges as well.	Mahakamani pia.
He placed his right foot on the sea, and the left on the earth, and cried out with a great voice, as a lion roars; and when he cried out, seven thunders uttered voices of their own.	Kwa hivyo yeye kwa nguvu zote juu ya bahari na dunia analia kama kishindo cha simba: akisababisha ngurumo saba kusema.
It is advisable to deal with ending music.	Hivyo, ni vizuri kuacha mara moja kusikiliza wimbo usiofaa.
Bryzgalov was willing to retire, but he's happy in Anaheim	Wojciech Szeczesny amepoa jeraha kama hilo na sasa anatarajiwa kurudi katika goli
I don't think anyone is anti-love	Siamini kama kuna mtu anapenda ubaya
Rich and poor were all in the fold.	Wote mbwa na maskini walikuwa nje ya lango.
On the evening, slipped 10.68KM.	Jioni, imeshuka 10.68KM.
The most successful..	Bora zaidi ya mafanikio ..
St. Paul gives us the	Skye Alitupa
Not to wander around aimlessly.	kama si kwa Drift aimlessly.
"They were simply called ""Christians."""	"Anasema tu kwamba waliitwa ""Wakristo. """
The attack by Fateh al-Sham had threatened to wipe out the FSA groups which have also received backing from countries opposed to Syrian President Bashar Assad such as Gulf Arab states, Turkey and the United States.	Mashambulizi ya Fateh al-Sham yametishia kuyaondoa makundi ya FSA, ambayo yamekuwa yakiungwa mkono na nchi zinazoipinga serikali ya Assad kama vile Uturuki, Marekani na Ghuba ya Kiarabu.
What is the contribution of the developed nations to the climate catastrophe, including the burning of the Amazon?	Taifa lilipoteza fedha kiasi gani kuagiza mafuta including capacity charges za wamiliki mitambo ya kuzalisha umeme?
Before purchase a machine, maybe you have a lot of questions and confusion.	Kabla ya kufunga kamera, unaweza kushangaa maswali kadhaa ya kiadili na ya kisheria.
Organisations often need to procure goods or services to support their business.	Vikundi na watu hawa mara nyingi huhitaji mikopo ili kuendeleza mitaji ya biashara na shughuli zao.
A professor at King's College explains why the terrorism of Nusrah is not that bad	Shule ya Starehe yadhihirisha kwa nini utundu shuleni ni nadra
I saw him when he toured	Nimemwona wakati anaingia gesti
After enlightenment of God's Essence, I do not know anything better than The Prayer.	"""Baada ya kuelimika kuhusu kuwepo kwa Mwenyezi Mungu, sikijui kitu kingine bora zaidi kuliko Swala."
Te amo in english	mimi nakupenda wewe English
A story about life, a story about death.	Simulizi kuhusu watu, simulizi kuhusu maisha.
"""Why are you talking like that to me?"""	"""kwanini unaongea hivyo sesi?"""
95 percent of the cases are pertaining to complaints/appeals.	90% ya malalamiko haya yanahusiana na ziada au yanahusiana na malipoingen.
"Doctor says he met the Santas ""last Christmas"")."	Daktari wao aliwaambia watapata 'ujauzito na Krismasi'
You know that the Northern Mariana Islands are part of the United States?	Kwani hamjui hapo Korea Kusini kuna ngome za kijeshi za Marekani?
The call centre rep was empowered to make decisions.	SERIKALI ya Chama Cha Mapinduzi imebobea katika kufanya maamuzi tata.
I believe the promise.	Naamini katika ahadi.
He might have been a big help.	Huenda angeweza kuwa msaada mkubwa kwangu.
Try to remember the unstressed e	Guess ya feel kinda inadequate????
protests against the persecution of the Jews in Russia.	Jitihada za kupambana na kirusi cha corona nchini Iran.
You can't break a promise to a dead friend.	huwezi kufanya ahadi anayependwa unfulfilled.
My mother had often declared that she would go	Mara nyingi mama alisikika akisema kwamba alingoja
Playing two nights: November 26th and 27th.	Sajenti Arobogast: Siku mbili, tarehe 26 na 27 Machi 2015.
When you're married and you're happy you just ... you gain some weight.	Kweli ukioa au kuolewa mnakua kitu kimoja...hii kali
"""Question: Did he ask you a number of questions concerning the application?"	Wakili Kibatala: Alikuuliza chochote kuhusiana na watu kutekwa?
For example, two of Denmark's political parties are represented in the ALDE group.	Kwa mfano, hapa Tanzania kuna mambo yaliyodaiwa na Dk.
An ultimate goal that the discharge of pollutants into Puerto Rico's waters	MRADI mkubwa wa maji Madaba utakavyomaliza kero ya maji kwa wananchi
What may account for these differences?	Nini kinaweza kueleza tofauti hizi?
What Is God's Spirit?	Je, huyu Roho wa Mungu ni nani?.
It may also cause cramps.	inaweza kusababisha impasses vilevile.
Stoke-on-Trent City Council news Feed	Tanzania Hy-Vee Food Stores News
This is before I've even committed to an order!	hii kabla hata sijaingia ndani ishakuwa ndoano!
have a Birth Certificate that is not less than a year old;	wawe na uzoefu huo kwa kipindi kisichopungua miaka kumi na tano;
A practice which takes full advantage of modern technology will facilitate prompt service.	Teknolojia ya kisasa itafanya iwe rahisi kuunda haraka ofisi inayofanya kazi kikamilifu.
I think we went to about 8 countries.	Nadhani tulikuwa tunafika watu wanane.
Christmas wishes for little sister	Mambo ya Furaha Kuhusu Dada
Other people perceive them as someone who can take control over the situations.	Wafanye wengine wakuone kuwa mtu wanayeweza kumfikia katika hali walizonazo.
the lion king i just can't wait to be king lyrics youtube take	Hakuna Matata Lion King Ukulele Tutorial Youtube
lips were greeted with enthusiasm	Walengwa wakimsikiliza Naibu Waziri kwa furaha
Or you are longing for God.	Au yatakayo kufanya usisimame imara kwa Mungu.
Would you like to know how to translate jack up to German?	How would wewe tell Jacob wewe upendo Edward?
Law Enforcement Among Top 15 Most Dangerous Jobs in the U.S.	Makala inayofuataSekta ya ujenzi Hesabu za Nusu ya kazi hatari zaidi huko Merika
When looking at this map, this is something to consider.	Ukitazama picha hii, inabidi ufikirie.
Take a look at Krishna Kaul's social media posts!	Angalia ukurasa wa shabiki wa Facebook wa YATS!
So that's a fairly big thing to learn, I hope you'll agree!	Then am sorry kwa uzi Mrefu i hope mtajifunza kitu!
Concern has been expressed about the weight gain among youth.	Kumekuwepo na wasiwasi kuhusu athari ya uraibu huo kwa vijana.
In his victory speech, hon.	Aidha katika hotuba yake ya ufunguzi, Mhe.
They saw and learned much more than one might have expected.	Lakini hata hivyo waliipata na watakuwa wamejifunza na wamepata somo kubwa sana kuliko walivyokuwa wakidhani.
And what is going to be his fate?	Na avatar yake itakuwaje?
Hold the Shift key and define a region in one of the images.	Bi Verdiana Mizengo,akitoa ufafanuzi katika moja ya majukumu ya jinama vijijini.
The alsa driver does.	Alisha Driver
Matthew 9:33 When the demon was cast out, the mute man spoke.	MT 9:33 Mara tu huyo pepo alipotolewa, mtu huyo aliyekuwa bubu akaanza kuongea tena.
What if you want a good marriage, but your spouse is not cooperating?	Nini kama unataka kufanya kazi na kampuni inayofaa niche yako lakini haitoi fursa kupitia ushirikiano wako uliopo?
How do we make a foster child feel at home?	Jinsi ya kulisha msichana mdogo kupatikana nyumbani?
At around 4:00 pm the National	9:00 PM Habari za Kitaifa
So they began moving out to the suburbs.	Na walianzisha kujitandaza, kutoka katika jimbo hilo.
rights movement; they were people who wanted social change.	Wananchi; huo ndiyo ukweli kwamba ilifanywa makusudi kubadilisha mambo.
Or at least stinky.	Angalaka anao Shyn
identity theft are frequently the result of single-factor	thawabu za kuzidia mara nyingi, ni kama hali ya mwenye kuatika punje moja
20 looked at.	20 Na tazama!
A number of fishing vessels, along with Russian and the United States coast guard helicopters are assisting with rescue operations.	Helikopta za jeshi la Marekani na jeshi la Singapore pamoja na walinzi wa pwani, wanafanya shughuli za uokoaji.
It is suitable for the party.	Ni jambo jema kwa chama.
You might have failed at some point or another in your life.	Labda umeshindwa wakati fulani au mwingine katika maisha yako.
But now I feel the pressure.	Lakini leo nitatilia mkazo maombi.
I Will Tell of All Your Wonderful Deeds.	Nitayasimulia matendo yako yote ya ajabu;
After the flood, the then Congress-National Conference government sought a financial assistance of Rs.	Kufuatia upungufu huo, Serikali kupitia Wizara ya Fedha na Uchumi ililazimika kuomba msaada wa dharura kwa nchi wahisani.
We are a family who believe in God.	Sisi kama familia, tunaamini Mungu yuko
thank you very much , you saved me	Asante kaka ,umenifungua sana
Use an appropriate planting method for each type of food you're trying to grow.	Tumia kila aina ya trafiki unayotaka kukuza.
"""Have I not obeyed you?"""	"""si nilikwambia ukabisha??"
We are not brothers and we are not one.	"""Sisi ni ndugu na hapana tofauti baina yetu."
Remember, you need to set up your phone for email.	Kumbuka kutuma namba yako ya simu kwa ajili ya mawasiliano.
Say, you are only a warner and for every generation there is a guide.	Hakika wewe ni muonyaji tu, na kila kaumu ina Kiongozi.
"""You want me to go get a doctor?"""	"""Je, ungependa nimwite daktari?"""
"""I want everyone who is here now to stay... but anything can happen right up until Aug. 31. """	"Nataka kila mmoja aliye hapa abaki, lakini chochote kinaweza kutokea hadi Agosti 31,."""
The population has hit more than seven million over the past one decade.	Ripoti hiyo inaonyesha idadi ya watu imeongezeka kwa watu milioni saba katika mwongo mmoja uliopita.
We're told by law enforcement authorities that he was arrested at JFK Airport trying to get out of the country.	Polisi waligundua kuwa mkuu huyo wa IMF alikuwa katika ndege uwanja wa JFK ikiwa tayari kutoka nje ya nchi.
Are you going to be able to keep that promise?	Je waweza kuidai ahadi hiyo?
The fans pick: Indiana Jones and The Temple Of Doom	mashabiki wanachagua: Indiana Jones Temple of Doom
"""At this time, the only confirmed positive cases are staff members and they have been in isolation since September 20, 2020,"" Burt said."	"""Punguzo hili litakuwa chachu ya kuwavutia wakuliwa na wadau mbalimbali na litaanza kutumika kuanzia Februari 20, 2020"" amesema Hasunga."
Many global companies operate in our nation.	Kampuni nyingi za kimataifa hufanya uzalishaji katika mji wetu.
This film is a hope for those who feel demotivated and dejected.	Ni methali ambayo inatia matumaini kwa watafutaji na waliokata tamaa.
I do think there are pros and cons to the simulator.	Naamini kuna figisu na msigano fulani katika halmashauri ya Bukoka.
The fishing is notable here, too.	Jambo hilo la Kiislamu linaonekana zuri huko, pia.
It would have been a lot of work for no good reason.	Ingekuwa safari ndefu isiyo na sababu yoyote.
time to build a county jail.	Ni wakati wa kuleta ili nyumba ya wafungwa wa kifalme.
Don't forget first and second step of this article.	Usikose sehemu ya pili na ya mwisho ya makala hii.
I trust you and your word.	Ninakuamini na neno lako.
"Walt Disney Screencapture of Flounder from ""The Little Mermaid"" (1989)"	"Walt Disney karatasi la kupamba ukuta from ""The Little Mermaid"" (1989)"
Young men in group portrait.	Watoto wa kiume wa marehemu katika picha ya pamoja.
But if God tells them that He will rescue them, and they believe that, they have chosen what cannot be known over what is certain.	Waumini hao walipoulizwa kuhusu sehemu wanapolalala, walijibu kuwa Mungu ndiye anajua wanapolala hata wao hawaelewi.
Ecocoast was founded precisely to prevent damage and pollution to our coastlines and waterways, and over the last decade, we, as well as our subsidiary Bolina, have developed a range of innovative and industry-leading technologies that have been demonstrated to reduce water pollution from construction-related activities.	Ecocoast ilianzishwa kwa usahihi kuzuia uharibifu na uchafuzi wa mazingira katika ukanda wa pwani na njia za maji, na kwa miaka kumi iliyopita, sisi, pamoja na tanzu yetu Bolina, tumetengeneza teknolojia anuwai na zinazoongoza kwa tasnia ambazo zimeonyeshwa kupunguza uchafuzi wa maji kutoka shughuli zinazohusiana na ujenzi.
When removing people, change the passphrases	Binadamu hupotoka, huonesha udhaifu,
Carrot is well known for their health benefits.	Vitunguu vinajulikana kwa mali zao za faida.
Here we become aware of what we don't know.	Tupo hapa kujuzana yale tusio yajua..
I would like to think that I can make a change so my sons don't grow up to be whiny bitch excuses for men.	Ninataka kuamini kuwa watoto wangu wanaweza kukua bila ya kuomba msamaha kwa kuwa weupe.
Or is it that she's only charming when she wants to be?	lakini huyu dada ataka nn wakati ana kwake?
