"In the picture, he was looking at his daddy saying ""cheese."""	"Katika video hiyo, Princess huyo anaonekana akimshitaki baba yake kwa ""kumteka"""
"v.24 So Joab went to the king and said, ""What have you done?"	"24 Kwa hiyo Yoabu akaingia kwa mfalme na kusema: ""Umefanya nini?+ Tazama!"
It is a complicated journey.. but it is God's will.	Ni ngumu kuikubali hali hiyo lakini ni mapenzi ya mungu.
This is a powerful video converter that has a wide range of file compatible.	Hii ni nguvu video converter ambayo ina mbalimbali ya faili compatibilities.
He's your Provider.	ni mwokozi wenu.
(c) provision about the interpretation of this Chapter (see section 598).	c) Fafanua umuhimu wa msemaji wa kauli hii katika riwaya hii. (alama 8)
Many people love to talk about their childhood.	Watu wangapi wanaopenda kutaja umri wao waziwazi?
Let's keep the free for all going until we really have a winner	kutosha wachezaji wetu hivi sasa ije timu yeyote tuu sisi sawa
12So Hiram came out from Tyre to see the cities that Solomon had given him, but he was not pleased with them.	12 Basi Hiramu akatoka Tiro kwenda kuyaona majiji ambayo Sulemani alikuwa amempa, nayo hayakuwa sawa machoni pake.+
I have no problem with benchmarking against comparable jobs in the private sector if it involves resultant pay reductions.	Ninavyofahamu sekretarieti ya utumishi wa umma hawahusiki na ajira za private sector so sidhani kama wanafanya kazi hiyohiyo ya TAESA.
He has overcome many challenges and has become one of the best batsmen of his time.	Ameshinda tuzo nyingi, na amekuwa mmoja wa wasanii wa kulipwa maarufu zaidi.
Fourth military coup in Nigeria.	Mapigano yaingia siku ya nne nchini Nigeria
'What do you want, kid?'	"""What ya want, kid?"""
morning's successful agreement.	Habari ya asubuhi Mwanamafanikio.
There were also a lot of mosquitos and keeping the windows closes was not an option because of the heat in summer.	Kuweka nafasi tena ilikuwa ndogo, na kwa sababu ya maumbile ya bidhaa, upepo haukuwa shida kutunza blanketi kwenye kaa.
It was a journey of 7 hours.	Ilikuwa safari ya masaa kama saba.
Then, he moved around to the adjacent side.	Kisha iache pembeni ipoe.
3 It was he who built the upper gate of the house of Jehovah, and on the wall of Ophel he built much.	3 Yeye alijenga lango la juu+ la nyumba ya Yehova, naye akafanya ujenzi mkubwa katika ukuta wa Ofeli.+
It's actually the first photo.	kweli hasa hiyo picha ya kwanza.
They do it because they care about me.	Nafanya hivi kwa sababu nawajali.
Without money you're in prison.	Na wewe huna pesa ju utaenda jela
There has been no hostile action in Korea in 54 years.	hakuna kilichofanyika katika miaka 54 ya Uhuru.
Their arrogance isn't even thinly veiled anymore.	Tena bado nguvu yao haijaonekana hasa subiri tu.
night when the policeman said to use it.	Mkuu usikurupuke hao kinadada walijiita wenyewe hilo jina.
The whole thing has been so obnoxious and devaluing of women.	Yote haya yamejikita katika hali nzima ya mwanamke kutojiamini na kutojithamini.
"""In the past seven years, I can count on one hand, and still have leftover fingers, how many instances I've seen of this"" kind of issue, he says."	"""Sitaki kuwa kahaba tena, nimefanya biashara hizi kwa miaka saba sasa na siwezi kumbuka ni wanaume wangapi nimeshiriki ngono nao "" Mwanamke huyo alisema."
• It's non-caustic	News _ Hakuna Casting
"""You look like a bum, why are you with my daddy?"	"""Unaonekana kuwa na pilikapilika nyingi, kwa nini hujionei huruma mpenzi wangu?"
I think the unborn baby does have some rights but a born living child.....Not sure you can say they are equal.	Sioni hata pointi yako hapo...huyo ni Mtoto wa kizungu na analiliwa na Wazungu wenzake kwa matatizo ambayo hajajitakia, nadhani wana haki ya kufanya hivyo.
Time ticked by and still I had not found the religion that seemed to speak to my heart.	Muda ulisonga mbele na bado sikuwa nimepata dini inayo onekana kuzungumza na moyo wangu.
The Prophet replied, 'I did not give	"Mtume (s.a.w.w.) aliwaambia: ""Sikuja kupigana."
God wants to heal you and help you.	Mungu azdi kukutumia na kukuinua.
I hardly live when I am away from you.	Mimi si kushoto wewe wakati mimi kuvuta mbali.
Hester is ungrateful.	Hester Udani
I would love to purchase your app, but I don't have a smart phone that can use it.	Ningependa kukujiunga Lakini laptop Sina je sitoweza kukuiga?
It's only when I blow	Ni kitunguu tu nikatapo
A lot of you tell me that:	"""Baadhi yenu mnatuambia kuwa,"
Whereas we do not sin.	kama hatutendi dhambi.
Health insurance: OeAD scholarship holders need to have health insurance that is accepted by the Austrian authorities for the duration of their stay in Austria.	2) Bima ya afya: Wamiliki wa elimu ya OAD wanahitaji kuwa na bima ya afya ambayo inakubaliwa na mamlaka ya Austria kwa muda wa kukaa yao huko Austria.
The educational program encourages ...	Programu ya elimu inalenga watu ...
synced in 14 days	Kama inajulikana, ndani ya siku 14
In fact, reading is the first step.	Kusoma ni hatua ya kwanza.
Do not seek to save your lives, for he that is afraid to die for the truth, will lose eternal life....	"Msikiogope kifo, kwani yeyote yule aogopaye kufa, hupoteza heshima."""
Freedom from worrying about food all the time.	Neema ya kuwa na njaa kila wakati ya vitu vyako.
Get home and trying to get this recipe	Uje huku wewe kibendera Njoo ujibu hii
Let's go back to your original question.	Tukirudi kwenye swali lako la msingi.
We are not told what they did.	Hatujaambiwa zimefanya nini.
No can be dumped from a 3DS	Hatumi Kudo 3some fuck
I love to read the JW publications.	Nami hufurahia kusoma vichapo vya Watch Tower Society.
-Full House is currently airing on Nick at Nite	hahaha saje je boring la nick tu
"Many times he told me, ""This is the best country in the world."""	"alfajiri: ""Hizo ni bora zaidi kwangu kuliko dunia yote."""
She's been working as an aide for the past 20 years, I'm in year 4, but it doesn't matter, I am the teacher.	Rais alikuwa Waziri kwa miaka 20, mimi ndiyo kwanza mwaka wa nne...bado najifunza!
We wanted to do it for Michigan.	Lakini tulitaka kuijua Michigan.
It's a matter of going there and working	huo, ni bora kuingia kazini na
and encircle the republic of San Marino.	hizi linaunda Jamhuri ya San Marino.
In ________ number of weeks we will be celebrating the Lord's Supper again.	Karibuni...sana..tusherehekee Pasaka ya Bwana...
through the sheep.	na mazizi ya kondoo.
How do you sell what you don't have?	Tunarudishaje ambacho hamjakinunua?
She was one of the invited speakers at a All-Women Forum held in Penang recently.	Ni miongoni mwa walioshiriki kwa namna moja au nyingine katika mkutano wa kidunia wa haki za mwanamke, maarufu mkutano wa Beijing mwaka 1995.
Likewise, we would like to thank	Aidha, tunapenda kuwashukuru
The trip was hugely successful for me.	Hii ziara ilikuwa ya MAFANIKIO saana kwangu.
Consultants have been working on this for 30 years.	Watu wamekuwa wakifanya kazi hapa kwa miaka 30 kwa suluhisho.
Not worth trying to figure out.	Hakuna maana katika kujaribu kuificha.
He's lost his dead-end job, ...	Ameacha kazi kubwa sana ya kumalizia, h ...
Bush didn't have a good relationship with Iran.	China hawakuwa na yoyote kubwa ya mahusiano na dunia mpaka.
Voice cast for the main characters	Sikiliza Kwa Wahenga Main Title
arresting and prosecuting them	Kubainisha na kuvitumia katika sentensi
Goodness and Peace in Your life forevermore!!!	Upendo na amani vitawale mioyoni mwetu daima!!
"Jesus told this parable in Luke 13:6-9: ""Then he told them a story: ""A man had an apple tree planted in his front yard."	"LK 13:6 Kisha, Yesu akawaambia mfano huu: ""Mtu mmoja alikuwa na mtini katika shamba lake."
The suffering that comes through poverty is not God's plan.	Umaskini sio mpango wa Mungu.
This is not the first time that McGregor has announced his retirement.	Hii sio mara ya kwanza kwamba McGregor ametangaza kustaafu kutoka katika mchezo huo.
I have pondered the days of old, The years of ancient times.	Nimezingatia siku za zamani, Miaka ya nyakati za zamani.
He had no money, and little backing.	Alikuwa hana fedha za kutosha, na alikuwa hana ujasiri wa kutosha.
I am travelling from Amsterdam.	Mimi ninatoka Amsterdam.
"""Maple Leaf doesn't need the money."	"""Daktari WST si mjinga kiasi hicho."
I know about public domain.	Mi najua kuhusu notary public.
Their little ones will be dragged off.	Menyu ndogo itafunguliwa.
Can you imagine on the above.	Unaweza kufikiria jinsi ilivyo chini?
Thank you for the recipe, I have been craving Pudin for a very long time!	Nashukuru mkuu majimoto, nimetoka Brela muda si mrefu!
It's immutable once the JVM starts.	Haiwezi kujitenga wakati YHT itaanza
It is a great opportunity to have people like you in the BlogoSphere.	Ni bahati kuwa tunao watu wa aina yake katika blogu.
Often groups were formed to practice.	Ilikuwa mara nyingi shule zinajengwa ovyo ovyo.
It was not to learn.	si ndio amekuja kujifunza.
The fact that men want someone with whom they can be free emotionally isn't a surprise.	Huyo rafiki yako anayeomba kuzaa na mumeo si ajabu wana uhusiano wa kisirisiri.
He demanded the owners to lower the prices.	Mugabe awataka wafanyabiashara kupunguza bei za bidhaa.
Evaluate the short- and long-term implications of every decision	Faida za muda mfupi na muda mrefu wa kila maamuzi atakalofanya
Here is a gracious promise for the season of conflict and trial - a promise, oh! how often realized by the children of God.	Jawabu: Hukumu ya kutoa Zaka ya nafaka na matunda ni wajibu, kwa kauli ya Mwenyezi Mungu Mtukufu:
On the other hand, if you earned less than expected, you may have been	ukipata wastani kuliko ulivyotarajia, pengine umekuwa ukipata kidogo kuliko
Prophet Muhammad (Pbuh) commanded knowledge upon all Muslims, and urged them to seek knowledge as far they could reach, and also to seek it at all times.	Muhammad (amani iwe juu yao wote) Hawa wote walitumwa kwa jamii zao wakiwa na muongozo wakiwafundisha watu yote anayoyataka yeye (Muumba) pia asiyoyataka.
What you've fed to me?	Umekuwa chakula changu nikupe nini?
A girl who's for real all the time	Muungwana yeye ni mtu wa matumaini siku zote
azealia banks is back	Bahia Hotels Bathinda
Phone numbers must be 10 numbers.	Nambari ya simu inatakiwa iwe na 10 tarakimu.
I'll kill my darling	fubuki my waifu
So we are a non-profit specialist clinic - and act accordingly.	Kwa hivyo tunataka kuwa kliniki ya wataalamu isiyo ya faida - na kutenda ipasavyo.
The one everybody watches on tv or other media.	Watu wengi wanakesha usiku kwenye TV au katika mambo mengine.
Me and Keith and a couple of other people	Marley and Me Kura Za Maoni
156 Teaching What You Don't Know	Somo 15 - Usiyeonekana na uliyo mjuvi
it's only pain	Ni huzuni tu
Tom Dugan... you know it.	Dah Mwanang unajua.....Nimekuelewa.
It is enough to say that you aren't yet quite ready to make a decision on such a big step.	Tatizo ni kwamba watajua kwamba umechukua hatua kama hiyo ambayo sio nzuri sana.
Abridged Version - Wish it wasn't	Make a Wish _ uNgatawwa
The majority of them only wish a better life with no political involvement.	Asilimia kubwa wanafikiria zaidi kuhusu maisha mazuri yasiyo na mikwaruzano.
My device is 64-bit but it's not!	dah wangu mie ni 1st n last lakini hayuko hivyo!
And this is going to create all sorts of problems for our state.	Tutafanyaje tufanikishe hilo ni changamoto yetu sote Serikalini.
Houses at Beacon Hill in Boston.	Nyumba katika Beacon Hill katika Boston.
How to Find The Courage to Move On	lile ,atapata wapi tena ujasiri wa kusimama
The Engine Comes to Life	Engine Comes Alive
It's not a homerun... that will be when we're production ready but the bases are definitely loaded.	Sio homerun... hiyo itakuwa wakati tunapokuwa tayari kwa uzalishaji lakini besi hakika zimebeba.
We can not see that this passage from Isaiah ever before have been fulfilled.	V katika hawezi kuona kuwa sura hii ya Isaya hapo awali utakamilika.
Then she gave up trying to maintain the facade, and she leaned into him.	Kisha akajilaza kwa kujiegemeza kwenye tumbo la Mwasha huku bado amemkumbatia.
"""Bring your own soda"""	"""Kunywa sumu yako mwenyewe yaliyotolewa na"""
When the trial drugs stopped, she was sent home.	Mara tu kupona katika kliniki kumalizika, mwanamke huyo hupelekwa nyumbani.
OEM/ODM are welcomed, we can produce products according to your requirements.	tunakubali OEM & ODM, Kampuni yetu inaweza kukuza na kutoa bidhaa kama wateja mahitaji maalum.
Close-up view of a beautiful butterfly	Beautiful Images of Anarkali Dress
this year's Mt.	Mbio za mwaka huu za Mt.
I've read their story.	Nimekubali kusoma hadithi yako.
Your problem is that he didn't come out an apologize for having bad information?	Si ameomba msamaha kwa picha kushindwa kuupload?
who wants to be a millionaire online game says:	Embed mchezo Ambaye anataka Millionaire dunk katika tovuti yako:
"""They fight against those who combat corruption."	"""Wasjifanye wao ndio wanapigana na vita dhidi ya ufisadi."
And you are, indeed, good people.	Na baada ya haya mtakuwa ni watu wema.
The technology allows you to enter a virtual world where everything is possible.	Sisi kuwapa nafasi ya kutimiza yako kinks katika dunia virtual ambapo kila kitu ni iwezekanavyo.
"""Modern education cannot be imagined without the fast and reliable Internet."	"""Siasa za kisasa za Uropa haziwezi kuwepo bila vyombo vya habari huru na vya uaminifu."
How did you learn to use these?	wewe umejuaje katumia hizo hela?
Do not mix religion with politics.	Mwiba acha dini twende kwenye Siasa.
It was through these kids that I found my sense of purpose.	Kwa kupitia hadithi hizi nilipata hisia ya urithi wangu.
His vice president was John Breckinridge.	Kaimu Rais wake alikuwa John Breckinridge.
Another type of in-vivo dosimeters are diodes.	Aina nyingine mbili za hibiscus ni bustani.
The criminal justice system must be strengthened.	Kuimarisha mfumo wa utoaji haki ni jambo la lazima.
And the best one is what you have pointed out here.	Moja ya maarufu zaidi ni ile ambayo tutakuambia hapa chini.
It's important to always maintain your property.	Ni muhimu sana muda wote kulipa mikopo yako.
"""It""s the [ ði: ] best book I've ever read."""	Hii ndio (ya kupendeza) .......... kitabu ambacho nimewahi kusoma.
Percents Greater Than 100% or Less than 1%	cha asilimia 0 badala ya asilimia 100 au
So, what's your favorite Region of Pokémon?	What Is Your inayopendelewa Pokemon Region.
America is going...	Marekani itajuta kui...
O prophet ! rouse the believers to fight, if there are twenty patient ones of you, they shall overcome two hundred and if there are a hundred of you, they shall overcome a thousand of those who do not believe because they are a people who do not understand.	Wahimze waumini wende vitani; wakiwepo miongoni mwenu ishirini wanaosubiri, watashinda mia mbili; na kama wakiwa mia moja miongoni mwenu watawashinda elfu moja katika waliokufuru, maana hao ni watu wasiofahamu.
Ultimately, the water comes down to the surface in the form of rain or snow.	Hatimaye, mvuke huo hurudi duniani ukiwa theluji au mvua.
It appears from the verses of the Qur'an that change of qiblah was not due only to the objection of the Jews, but there was also another reason for it.	Kutokana na aya hii ya Qur'ani inaonekana kwamba kubadilika kwa Qiblah hakukufanyika tu kwa sababu za upinzani wa Mayahudi, bali kuna sababu nyingine za mabadiliko haya.
People seemed surprised that we found them, but we knew we found something special.	Watu waliokuwa eneo hilo walishangazwa na tukio hilo, lakini sisi tulijua hiyo ni mojawapo ya kazi za majasusi.
This often leads to conversations about faith and opportunities to pray for people.	Mara nyingi inafuata hotuba, halafu ungamo la imani na maombezi kwa ajili ya watu wote.
Should we eat them raw or cooked?	Au ndio tutakula nyasi au kupiga mbizi?
Sir, sporyshev and then urged them to know.	Mheshimiwa Naibu Spika, baada ya kuyasema hayo naomba niwasilishe.
3) You need to let everyone know a minimum of 10 times per day that you are on a diet.	Tafadhali kumbuka kwa kila mtu ataweza kupiga kura mara 10 kwa siku kwa kila akaunti aliyoisajili.
Father, in the name of Jesus, enthrone the reign of justice and equity in Mauritius so as to secure her glorious destiny. - Daniel.	Baba, kwa jina la Yesu, enesha enzi kuu ya haki na usawa huko Gambia ili kupata hatima yake tukufu. - Daniel.
It still energizes, and it is still explosive.	Bado ina joto, na inatoa gesi.
Paradise was lost and there was no way back.	Paradiso ikapotea, na hakuna mtu ambaye amefanikiwa kuirudisha.
I think there are 2 possible reasons:	Nadhani kuna mambo mawili yanayoweza kuwa sababu:
Poverty is an enormous social problem.	Social phobia ni tatizo kubwa sana.
We've heard the Force called:	Hakika sisi tumemsikia mwenye kuita akiitia Imani kwamba:
Daner told the investigator that he had borrowed it.	Padre Edward akamweleza yaliyomsibu.
32 If he can't, then while the other king is still far away, he will send some people to speak to him and ask for peace.	"Ikiwa kwa kweli hawezi kupata ushindi juu yake, basi wakati ule mufalme mwingine angali mbali, yeye anatuma baraza la mabalozi na kuomba amani."""
19th Days of Croatian Film	11 Septemba Waongozaji wa filamu wa Uhispania
In the Kingdom one enjoys the presence of God and His heavenly beings, and past sins are forgiven.	Kwa hiyo Mbinguni ni nchi iliyopo katika ulimwengu wa roho na utawala wake ni wa kifalme ndiyo maana Mungu ni mfalme wala siyo Raisi.
it's the Virus	Vitakuwa ni virus hivyo
He said: (then) I'm the most miserable one, O Messenger of Allah.	Akasema: Nikasema: Ewe Mtume wa Allah, mimi hakika naweza kufanya vizuri zaidi ya hivyo.
Do you remember the new guy who just moved into the family of ladies?	Unakumbuka Wakati Wale Waombolezaji Wanampeleka Kumzika Mwana Wa Pekee Wa Yule Mjane?
Art with the South Shore Art Center - Pen & Ink	Mtengano ndani ya Dayosisi ya Kilutheri ya Kaskazini mwa Tanzania - Inventaires et archives en ligne
The United States is looking at intelligence reports that suggest North Korean dictator Kim Jong Un is in serious danger after undergoing a surgery.	Serikali ya Korea Kusini inaangalia undani kwa taarifa zilizoripotiwa na Vyombo vya Habari vya Marekani kuwa Kiongozi wa Korea Kaskazini, Kim Jong Un ana hali mbaya baada ya kufanyiwa upasuaji.
Put a picture, it will be better	Ila ungetupia na picha ingependeza zaidi
a link was added: BB to be inducted into the Rock and Roll Hall of Fame! over a year ago by ediebutt	a link iliongezwa: BB to be inducted into the Rock and Roll Hall of Fame! zaidi ya mwaka mmoja uliopita by ediebutt
The way of untruth and lies and falsehood is the way down into it.	sababu lilikhiari njia ya baat'ili, nayo ni ukafiri na uasi!
It is very hands free.	Kuna mikono mingi kila mahala.
A mother of Methodism	Mama Mia Methodologia
The Shoshones won't hurt	Beers won't hurt ya
Since the additional cost of a Party Pass is so small, why not go for it?	Na kwa kuwa bei ya poda ya Lycopene sio juu sana, kwa nini usitumie?
Will they be able to know?	Watakuelewa basi?
This isn't just another case for Adam.	Na ndoa hiyo si nyingine Zaidi ya ile ya ADAMU.
They were not the major targets of the Stingers.	Hata hivyo, hayakuwa haya ni malengo makuu yaliyokuwa yakiaminika kuwa na athari kwa wenye kuonewa.
Share your ideas and suggestions about the game here.	Nitumie maoni au mapendekezo yako kuhusu kampeni hii hapa
Are you a true God?	Je, Wewe Ni Muumini wa Kweli wa Mungu?
Atlético Madrid have the best defense in the championship with 16 goals conceded (including 7 conceded at home) since the start of the season.	Atlético Madrid ina ulinzi bora katika michuano hiyo ikiwa na mabao 16 yaliyofungwa (pamoja na 7 yaliyofungwa nyumbani) tangu kuanza kwa msimu.
located where there is the main road.	Je eneo liko upande gani wa main road.
Defenders of the doctrine of the Trinity often claim that it is a mystery which cannot be properly understood.	Watu wengi wanaoamini Utatu wanasema kama fundisho hilo ni fumbo, yaani, haliwezi kufasiriwa.
Smith and Thorson were very close.	Jolie na Thornton walikuwa mkali pamoja.
You will be able to get answers and even ideas.	Tyta hata ww waweza kuwa na majibu au idea!
solely on the impact	Minimiza tu impacto
The door was open, but everything was gone.	mlango, lakini yote ilikuwa imefungwa.
Our development team has put a lot...	Timu yetu ya uhandisi ilifanya mengi kushinda ...
A good representation of rock genres.	Good Riddance watu wa Nyamagana.
Camembert - Living in the Fields	Garaj Mahal - Live at Kuumbwa
KW - spin dephasing	KW - wake detection
We made use of the Provençal BBQ on a couple of the nights.	Tulitumia kwa kutumia betri ya WPA2 ya CMOS kwenye bajeti ndogo.
"""My health is really well."	"""Huyu wa kwangu kwa kweli yuko vizuri."
"11 So I swore in My anger, ""They will not enter My rest."" a"	"11 Kwa hiyo niliapa kwa hasira yangu, 'Hawataingia+ katika pumziko langu.' ""+"
Also, given the different opinions of fans, it is very difficult to have a perfect list.	Lakini pia kupungua kwa idadi ya wanaopimwa, kuna maanisha kwamba vigumu kupata picha kamili ya jinsi ilivyo.
favored a society under the control of sociologists!	Msaada kwa anayefahamu sociology!
The Migratory Route	Ndutu Migration Safari
This is the same with maintaining our appliances.	Inakuwa sawa na kuramba matapishi yetu.
This story describes everything.	This time mtaeleza kila kitu.
Title page from An Apology for the Life of Mrs.	Barua ya Mark Kuomba Msamaha Kwenye Kurasa nzima ya Gazeti
If you're outdoors in bright light, you can use the sun as your key light.	Ikiwa uko nje kwa mwangaza mkali, unaweza kutumia jua kama nuru yako muhimu.
Comptoirs: the political geography of small-scale gold mining labour in Burkina Faso	AJIRA: Nafasi za kazi Geita Gold Mining Jobs in Tanzania
So it depends on what you want	So inategemea wewe unahitaji kipi hapo
1 The Apostles and the brothers who were in Judea heard that the Gentiles too had accepted the word of God.	Siku zile, mitume na ndugu waliokuwako katika Uyahudi wakapata habari ya kwamba watu wa Mataifa nao wamelipokea neno la Mungu.
In effect, Satan claimed that his rule would be better than that of the Creator.	Hivyo, Shetani alidai kwamba utawala wake ungekuwa bora kuliko utawala wa Mungu.
stand in judgment of God.	Na mt'iini Mwenyezi Mungu katika hukumu
This must always be arranged according to the mandate of the victim.	Hii inapaswa kusambazwa kila wakati pamoja na dhana ya waendeshaji.
He's even trying to feed himself with a spoonful!	Anadiriki hata kuapa uongo kwa jina la Swaumu!
In the meantime, you tell falsehoods.	Hapo mnadanganyana.
By the time I got old enough to do it myself, I knew what I was doing.	Basi mtu mzima nilijiona mwepesi mwenyewe utadhani nilikuwa najua hata nilichokuwa nakifanya.
The withered towns are empty, but not uninhabited.	Mji ulio neemeshwa lakini hauna fadhila,
As someone who has classes, I am grateful for the weekly challenges.	Mzee ES na choveki, nashukuru kwa challenging questions.
"As an example, the Noble Prophet Muhammad (p.b.u.h.) said: ""Nothing will weigh more heavily in the balance of the believing servant on the Day of Resurrection than a good attitude (towards others)."	"Kutoka kwa Mtume Muhammad Mustafa (s.a.w.w.) amesema: ""Hakuna Muumini (yeyote) isipokuwa mimi ni bora kwake zaidi kuliko watu (wote) katika dunia na akhera."""
put your name on the list and win prizes!!	Kuwa Bet On hila yako ya Mkono And Win Tele Cash!!
"He hadn't passed away yesterday but two years ago in September 2017."""	"Halikujitokeza wiki chache zilizopita bali lipo tangu mwaka 2000"""
But they're just happy.	Wao ni furaha tu.
when we stop to die...	tusipoziba ufa...
One of the ducks was banded in Maryland.	Vipeperushi laki moja vilitawanywa jijini London.
Prescription drug abuse and misuse is a national and local problem.	Tatizo la vijana kutumia na kuathirika kwa dawa za kulevya ni njanga la kijamii katika ngazi ya kitaifa na kimataifa.
He had left behind his luggage and a note saying he wanted to stay in Japan and work.	Aliacha kijikaratasi chenye ujumbe pamoja na mizigo yake akisema anataka kubaki Japan na kufanya kazi.
I've met his two sisters, and I know of him.	Alinitambulisha kwa wadogo zake wawili wa kiume, na ndio nilikuwa nawaona.
American English: self-inflicted	English: Kujitha
Some people want food.	Kuna mtu yeyote anayetaka chakula.
How magical it is to come back to a world I love and to visit characters I've come to know and enjoy seeing them again.	Nilisisimuka kama nini kurudi tena Betheli tulipohudhuria shule na kukutana na watu wengi ambao nilikuwa nimewapenda na kuwaheshimu!
"I'm coming along and I suggest that there's no time to lose."""	"""Tutaangalia, naona muda hauniruhusu"""
"""It's very difficult to get supplies from farmers."	"""Ni vigumu kuwafungia wauzaji chakula biashara zao."
Stringing the blues.	jinging the blues
Also If someone does take his place, or if he does come back...	Hata kama mtoto wako atarudiarudia, au
and ask for help or money.	Omba Msaada Na Fedha
"God this is so long"""	"""Mungu wangu mpaka saa hizi?"
Just two hours for a little sleep.	Hata kama ni kulala kwa sekunde chache.
Today, we're witnessing history.	Leo tunashuhudia historia.
Don't forget the wild animal lover	umesahau kipenzi cha wengi kiroba
The top four teams from each group will move on to the next round.	Timu zitakazoshika nafasi nne za mwanzo katika kila kundi zitaingia katika hatua inayofuata ya mtoano.
The McDonald's website also	Pia Mia's Website
Here's immediate help!	Upatikanaji wa Papo hapo!
18:36-38 When he heard the crowd going by, he asked what was happening.	"18:36 Aliposikia umati wa watu ukipita aliuliza, ""Kuna nini?"""
