"""They don't want migrants to cross"	"""Awataka wanasiasa wasifanye makosa kulinganisha marais"
The Egg Harbor Township resident has been linked to a number of incidents, according...	Mbunge wa Jimbo la Kilolo Venance Mwamoto amegawa vifaa mbalimbali vya michezo kama alivyowahidi ...
"""The European Union and the United States share an important and unique relationship."	"""EU na UN wana ushirikiano wa muda mrefu na wa kipekee."
Wasiu returned to the car.	Slaa tukarudi kwenye gari.
The Geologists' Association organizes a number of overseas field meetings.	Timu ya TSCSA imeshashiriki ziara kadhaa za nje ya nchi.
Today, risk management has become even more critical and challenging.	Hivi sasa, taratibu za ufuatiliaji wa injini zimekuwa ngumu zaidi na zenye akili.
this can not be undone	Hii hawezi kuletewa
On that day the voters of the town	Iko siku wananchi wataamka
I have been married for 14 years, we have 3 kids (all boys) but none of them belongs to me.	"""Nimekuwa katika ndoa kwa miaka14 na 'tuna' watoto 3 (wanaume) lakini si wangu."
Only the tinniest of ripples give away the surface of the water.	Mipako tu ya unyevu juu ya kuta itazuia kuonekana kwa mold.
Same as MALE.	bad alike.
baghdadhope: The U.S. and U.N. Have Abandoned Christian Refugees	Hizbullah: Marekani na EU zinazuia wakimbizi wa Syria kurejea nchini kwao
the movies make it out to be.	Hayo mambo ya kwenye movie yaache kama yalivyo.
challenge to an on-foot soldier such as yourself.	Utaimiliki fleti yenye huduma kama yako wewe mwenyewe.
It's free if the AOP form is completed before leaving the hospital.	Ni bure ikiwa fomu AOP ni kukamilika kabla ya kuondoka hospitali.
"Kambwili says, ""Don't worry country men & women, its global"""	"Lowassa amuambia Rais Magufuli ""inatisha lakini usitishike, umma na dunia inajua"" _ MUUNGWANA BLOG"
John 14:2-3 ÒÉ.I go to prepare a place for you.	Yohana 14.3 - mimi kwenda kuandaa mahali.
What do I say to the Sheriff's Office?	Sasa nitaambia watu nini kwa ofisi?
I hate ND but I'm also a realist.	I hate them, pamoja na kuwa mimi ni subscriber pia!
He has decided that his life is forfeit because he does not know what he faces.	Hivyo yeye ndiye anayelipotezea taswira nzuri bunge kwani hajui anachokifanya.
the income of the wicked is for sin.	wapate kula mali kwa dhulma.
implemented in 2003 by the Bush	Jopo iliyoteuliwa na Rais mwaka wa 2003
clarissa explains it all box set	Clarissa Explains It All Klabu Zilizohusiana
All other national destinations, including Durban, East London, and Port Elizabeth, will cease to be operated by SAA on February 29, 2020.	Kwa mujibu wa tangazo lililotolewa hivi karibuni, safari zote za ndani ikiwemo za Durban, East London na Port Elizabeth, sitasimamishwa kuanzia Februari 29 mwaka huu.
South branch single women over 50.	Kusini Unguja Women Over 50
I'm only doing my own favorites.	Mimi peke yangu hufanya misaada yangu.
//update the rest of the message if necessary	Subiri ujumbe kutoka benki kama unastahili
On the other hand, the financial situation is tough	Maana hali ya uchumi ni ngumu
He talks to his parents.	Anazungumza na wazazi wetu.
controversies in public health	Wadau wakiwa kwenye kongamano la afya
Supercavitating propeller - See: Fully	Supernal Sounds (Live) - Bheka Mthethwa
I'd play fair game.	Nilizingatia sana fair play.
Here's your upcoming film line-up;	Hapa chini ni Thesis yake ya Shahada ya Uzamivu;
your life, and how you will	maisha yake vile atakavyo halafu nyinyi muwe
Nell was not in heaven.	Slaa hakuwepo Jangwani.
I are actually practicing legislation in Arizona considering the fact that 2005.	Mimi nakumbuka kwenye maadili ya uchaguzi mwaka 2010 ilikuwepo.
I am going to get the things I need.	Huwa ninaenda kuchukua vifaa ninavyohitaji,
Can I qualify for life insurance if I've been diagnosed with Celiac Disease or Sprue?	Naweza kumeza tembe ya kutoa mimba ikiwa nimegunduliwa kuwa na STD au ambukizi katika mkondo wa uzazi?
Capacity: 64 cars and 600 passengers	Gari uwezo: 65 200 malori au magari ya abiria
Additional content on the website	Profile on the website zaidi
"He closed his eyes and muttered to himself: ""Good God!"	"Alikumbuka enzi zake za ujana na kujisemeza, ""Lo!"
He is omnipotent...all-powerful.	Wenye nguvu (potential) ya kuwa chochote.
a song in a month.	Mpina mwenyewe ndani ya mwezi mmoja sasa.
Sowore is the Publisher of Sahara Reporters, an online media organisation.	Sowore ni muanzilishi na mchapishaji wa Wanahabari wa Sahara (SR), ambalo ni gazeti la habari za uchunguzi la mtandaoni.
Summer nights have passed two young men but they did not return.	Juzi juzi wamepita vijana wawili lakini hawakurudi.
Tell me how often you get sick.	Unakasirika mara nyingi kadiri gani?
"Like the ""apple of my eye."""	"^ Ao ""uchungu wa nafsi yangu."""
Down, like five times.	Katika nyekundu kama ilivyo mara tano chini.
I received an email letting me know we had to pay them $18 to extend the preapproval...	Baada ya kutumia yangu rahisi No-Nonsense Fat Kiwango System , nimepata wanafunzi kuniambia wangeweza kuwa na kulipwa zaidi ya $ 1,997 tu kupata taarifa hizi mafanikio ...
"""Do you go to Breightmet?"""	'Kwani unaenda maternity?'
John Lovett III Carter (1) was born.	Jonathan Harshman Winters III (amezaliwa tar.
When the class is going to start?	darasa litaanza muda gani?
"""The new institutions of the open economy have been steadily improved."	"""Taasisi mpya ya uchumi wa wazi imekuwa ikiboreshwa kwa kasi."
The police said they are still looking for the driver.	Alisema polisi wanaendelea kumtafuta dereva huyo.
It was made for Americans, not for	Amerika ilifanya hivyo si kwa sababu ya huruma, bali ni sababu
It still hasn't hit us over here in Europe.	Bado haitusaidii kwa chochote katika nchi hii.
Many were enslaved along with the Africans.	Utumwa umefanywa na wote pamoja na waafrika wenyewe.
But it is fair to compare them.	Je ni haki kuwalinganisha.
And WE wrote for him upon the Tablets about everything an admonition and an explanation of all things.	Na tukamuandikia katika mbao kila kitu, mawaidha na maelezo ya mambo yote.
Do you wish to communicate with the world, without any linguistic barriers?	Unataka mazungumzo tu bila chaguzi za ujumbe wa kibinafsi?
The abridged audio of this title is absolutely awful, but for years it was inexplicably the only audio version available.	Wasifu wa L'O inakataa kabisa taarifa hii, Anya ndiye penzi lake pekee kwa miaka mingi.
Go back to your body and stop your expectations.	hebu nenda kwenye mgomo wenu na utuondolee ujinga wako hapa.
"It's their way of saying ""watch the the @#*% you say!"""	inanisumbua sana#) ama nilivyosema awali% ninyi ndiyo wau wa kwanza
He forgives those who truly repent.	Atawasamehe wote watakaotubu.
until the outbreak of the war.&quot;	"""Kabla ya Mkutano&hellip;"
"Presented a paper entitled: ""Engaging with Globalisation: Lessons from South Asia"""	"Chapisho jipya - ""Kusababisha Mabadiliko ya Hali ya Hewa: Masomo kutoka Asia Kusini"""
Turkish and Azerbaijani armed forces launched joint military exercises on	Iraq na Uturuki wafanya mazoezi ya pamoja kijeshi
Hint: it's not you or I.	Hint: It's not wewe au me.
I am not a doctor, nor do I play one on TV; so this is not qualified	Mimi sio daktari, wala sijacheza moja kwenye TV kwa hivyo hapa ni chini ya matibabu ya kila mmoja:
And we serve them with truth and honesty,...	Vile tumempa sheria na uwezo---
Especially for the fans of the ge...	Kwa Wajasiriamali hasa wa sekta ya Kilimo...
Search for The Town	Utafutaji wa jiji la jiji
If you like what I do, tell people via Facebook, Twitter, Google+, reddit, or however you get down.	Kama wewe kama wewe Nifuate Mtandao wa Twitter, Facebook, Google + au kushiriki na vitufe chini ya chapisho hili.
Hooray for fire and explosives!	Gumzo la video la moja kwa moja na warembo moto!
All of you are distinguished members of this steel frame.	Wewe kaokote vichwa vya kuku kwa lema sikuu hii
A lot of difficult work, but if you do it, it is manageable.	Ana kazi kubwa, lakini kama yuko makini anaweza kuifanya.
Uncivilized people make.	Na watu bila hiyana wanana nunua.
Miguel Cotto, of Puerto Rico, knocks down Sergio Martinez, of Argentina, during the first round of a WBC World Middleweight Title boxing match Saturday, June 7, 2014, in New York.	Bondia Sergio Martinez, kutoka Argentina, kulia akimpiga ngumi Miguel Cotto, wa Puerto Rico, katika mpambano wao wa ubingwa wa WBC World Middleweight Title boxing match Saturday, June 7, 2014, in New York
Their talk about school hadn't gone well at all.	Mahojiano yako kuhusu elimu yake hayakunirisha kabisa.
This happened in a Champions League last 16 game against Diego Simeone's Atletico Madrid.	Hii ilitokea katika Ligi ya Mabingwa ya mwisho mchezo wa 16 dhidi Diego SimeoneAtletico Madrid.
Moreover, the threat posed by cybercriminals is growing in	sasa hali ya usalama mtandao kwa mujibu wa twakwimu imekua ikiongezeka huku
Make your life more worth by adding value to your life.	Ongeza thamani ya maisha yako kwa kujenga maisha yako.
"""Why did the Emperor summon us?"	Huyu mukulu mbona anatuchanganya?
Tomorrow, I will give you the link.	Kesho nitaweka link yake.
One day you take me up and the next day you bring me down	And the inayofuata siku wewe bring me down
Since I'm clumsy, I need a case on my smartphone.	aisee huu ni msaada kwa wakati muafaka, mimi nahitaji ushauri kwenye website yangu.
For a start we shall understand what it entails with the Swedish massage in this case.	Kwa hiyo hapa tutaangalia yale mambo yaliyosababisha Kiswahili kitumike katika eneo kubwa.
He was born about 1952.	Alizaliwa Kivum mwaka 1952.
We do not lobby, vote for political parties or candidates, run for government office, or participate in any action to change governments.	Hatuwashawishi viongozi wa kisiasa wafanye mambo tunayotaka, hatupigii kura vyama au wagombea wa viti vya kisiasa, hatugombei vyeo katika serikali wala kushiriki katika harakati zozote za kutaka serikali ibadili mambo fulani au kubadili serikali.
Therefore, our political system	Mfumo wetu wa kisiasa Endelea
No good work should go unpunished.	Hakuna huduma bora unayoweza kuipata bila kugharamikia.
Anabolic steroids are illegal in the United States, كندا, المملكة المتحدة, وأستراليا, but when it comes to liability when you're caught doping, things can get complicated.	Anabolic steroids ni haramu nchini Marekani, Kanada, Uingereza, na Australia, Lakini wakati unakuja kwa dhima wakati ni hawakupata doping, vitu kupata ngumu.
It was much easier to get lost back in 19th-century America than it is today.	Ilikuwa rahisi kuiunganisha Afrika katika miaka ya 1960 kuliko ilivyo sasa.
Even in adults, orthodontic treatment has good chances of success.	Hata katika visa hivi, matibabu ya uzazi yanaweza kufanikiwa kwa kushangaza.
Living with bipolar illness.	Jinsi Ya Kuishi Na Ugonjwa Wa Kisukari.
"""I don't know if it will be successful, but we have to try."""	"""Sielewi mtakapomtoa lakini ni lazima tufanye majaribio!"""
Damitty, this is another one I need to buy...	Mheshimiwa Naibu Spika, jambo lingine ambalo nataka nizungumzie ni...
while others simply evaluate the materials that have been submitted.	Wengine ni waandishi wa kutoa habari tu walizokutana nazo.
Asap started the sh*t...	Moto wa Magufuli umeanza... aluuu! -
Now is not the time to focus on Growth !	Huu siyo wakati wa kuzungumzia sukari tena!
Aim for about 20 minutes a day - it doesn't need to be for long as long as it's daily.	Sio mbaya kwa sababu dakika 23 si nyingi kama ingekuwa siku nzima.
Is why I wound up at cpf, to get help.	Kwa mwenye sababu yake pls naomba nisaidiwe.
"She added, ""What else would you expect me to say?"""	"Aliongeza, ""Nikikuuliza yapi mengine utajibu nini ? ."
A Short Tour of the British Museum	Shorts Bikini Uk
I'm also trying to save up some money so I can get back into real estate and be more flexible.	Mimi pia, ninahitaji pesa za ziada kusaidia mfuko wa ndoto yangu na kuishi vizuri zaidi.
An estimated 6 million jews died in the holocaust during the 1933-45 nazi rule.	Mauaji hayo yaliangamiza maisha ya Wayahudi milioni sita wakati wa utawala wa Kinazi 1933-1945.
ability to govern and even causing them to question the sincerity	na uwezo wa kulishughulikia na hata kulifikisha katika vyombo vya kinidhamu vya
Lust is an evil spirit.	Uchawi ni roho mbaya .
And they are not worthy of it nor can they be able to do so.	(211) na hilo halifai kutoka kwao na wala hawaliwezi,
We have won a greats victory.	Tumepata ushindi mkubwa.
tees returned to their homes.	Masimba na Teddy wakarudi mpaka nyumbani kwao.
We need borders in order to be a country.	Tunahitaji mabadiliko katika dira ya uongozi ili tuwe nchi yenye uhuru kamili.
A human chain it symbolizes an act of human expression, performing a combined act among numerous children to make publicly visible in the street a position, in this case: ask for Peace and Nonviolence on the planet.	Minyororo ya Binadamu inaonyesha kitendo cha usemi wa kibinadamu, kutekeleza kitendo cha pamoja kati ya watoto wengi kuibua hadharani msimamo mitaani, kwa hali hii: omba Amani na Usijali kwenye sayari.
The purification is carried out 1 time a week.	Kusafisha hufanyika mara moja kwa wiki.
[Greek names] 6These seven were presented to the apostles, who prayed for them as they laid their hands on them.	"(trg) =""98""> 6 ambao wakawaweka mbele ya mitume , na walipokwisha kuomba wakaweka mikono yao juu yao ."
was as if he hated his father.	Akawa ni kama anamchukia mumewake.
Adam, though, was floored.	ijapokuwa Adamu alikuwa ameanguka.
Not only do we ensure...	Sio tu kuhakikisha kwamba...
We have a great group of kids who want to Obey right away.	Kuna kundi kubwa la watumishi wa serikali wanaostahili kufukuzwa kazi mara moja.
He saw my face and said he would be careful.	Akaniangalia na kuniambia nina macho makali.
we have to thank God on everything.. bad and good stuff..	Ahsante Mungu maana imeandikwa tushukuru kwa kila jambo......mbivu na mbichi zitajulikana tu
It truly is the one thing I can't live without because it does everything that I enjoy.	Yaani siwezi fanya kitu chochote akiwa karibu kwa maana atafikisha ripoti chochote kile nimefanya
TGP: How much do you interact with the players on a day to day basis?	BC: Kwa siku huwa unatumia muda kiasi gani kufanya masuala yanayohusiana na blogs kwa njia moja au nyingine?
Amazon was twice the price.	Mshahara wa ajira ile ulikuwa maradufu wangu.
The Annunciation by the Angel Gabriel to Mary.	Ujumbe wa Malaika Gabrieli kwa Mariamu.
China's launches in 2016:	Mambo yaliyotafutwa sana Tanzania 2016:
"The complaint filed Monday with Nils Melzer asks for an immediate investigation to make sure Rusesabagina, long an outspoken critic of Rwanda's government, ""is still alive"" after being accused of terrorism."	"Malalamishi hayo yaliyowasilishwa siku ya Jumatatu na Nils Melzer yanataka kufanyika kwa uchunguzi wa mara moja kuhakikisha kuwa Rusesabagina ambaye ni mkosoaji wa wazi wa muda mrefu wa serikali ya Rwanda ""bado yuko hai. """
"""They do what they said they did!"	Na wakatokea hao wanaosema wanaweza wakafanya
+4 more St Leonards (9)	wa + li4 (untruths)
He saw on TV that the authorities are recruiting volunteers to help, and he immediately decided to go.	Alisema ameona kwenye televisheni watu wakitoa maoni yao juu ya kampuni hiyo ya ndege kuwa ni nzuri kwa sasa na yeye akaamua kusafiri na ndege hiyo.
the city of Ma'alot,	Ms all del Chamizal,
You be damned, the murderer even listen to me,... but sad, private whom I told you.	Bibi karudi chini, lakini bwana, hasira zikampanda...utapata talaka, kwanza nani kakupatia haya maradhi, na mimi mgonjwa, hata unyumba wenyewe wanishinda!.
The aims of The London Community Flower Show are:	Makusudi ya Chama cha Usambara Citizen Union ni:-
This church has helped me love Jesus more today than yesterday.	joel lwaga yesu nipende leo kuliko jana
Those who choose to live close to Eindhoven Airport will have to take account of the possible nuisance of overflying aircrafts.	Wale ambao wanachagua kuishi karibu na Uwanja wa Ndege wa Eindhoven watalazimika kuzingatia akaunti ya uwezekano wa usanifu wa kupita kiasi.
They do, however, often use the blunt instrument of funding	Lakini mara nyingi wanaonufaika na punguzo la kodi
God provided yet again.	Mungu ampe nini tena.
I know that he can speake well.	Najua ya kuwa yeye aweza kusema vizuri.
The Afghans are still trickling into Pakistan.	Mafuriko yaendelea kutishia Pakistan.
The next step is to engage in action.	Hatua inayofuata ni kushiriki hatua za utambuzi.
"He also said this year's exam was ""very easy,"""	Alisema kauli mbiu ya maadhimisho hayo mwaka huu ni 'Mikono safi kwa
Sorry i can't explain more.	Sorry, siwezi kufafanua zaidi.
"invite you."""	Tu akupenawai.'
What are you participate.	unashiriki vipi?
Yes, it takes effort to get your work into the product, but when it's out there, it's rewarding.	Ni hakika kukusaidia kupona baada ya workouts yako, lakini kwa bei, kuna bidhaa bora huko nje.
"""A particularly pleasing aspect for me is that the building is carbon neutral, which I think sends a real message about our commitment to being an organisation that not only cares about its people and its communities, but also about the environment around us."	Mabadiliko ya hali ya hewa yanatufanya tushindwe kuwa na uhakika wa mustakabali wetu, hata hivyo jambo moja ni dhahiri kuwa jamii yetu inalo jukumu la kugeuza hali hii, si kwa ajili yetu pekee bali kwa vizazi vijavyo pia.
Today the members of the media aren't even embarrassed that they have allowed themselves to become an arm of the Democratic Party.	Na hata watu wenye heshima zao naona sasa hivi wanaona hata aibu kuwa associated na serikali ya sasa.
Everyone's afraid of something, but only the brave conquer their fear.	All in all, they sometimes gain something ila cha kuhofia ni kuexpose kila kitu kwa hawa majangili.
Most importantly, she proved that you could be a woman and do all that.	Lakini la muhimu zaidi mkeo aridhike, akisharidhika mnaweza kufanya hivyo.
Cooke and the other two by H. Moses.	Kwa Mfano wa Bwana Yesu na WanafunziB Y W f i Wawili wa Emmaus.
When he wakes up tomorrow, let him forget everything that happened today.	Ukiamka kesho hautakumbuka uliyoyaandika leo.
That is where this government has left us.	Hivi serikali yetu inatupeleka wapi.
Cheers at the end of the road	mwisho wa mwaka tuwe makini barabarani
For the first time in the racing and driving genre,...	Kwa mara ya kwanza katika spishi ya saizi hii na rangi [Zaidi ...]
Hope lost had now been renewed over the last 40 days.	Inayoahidi leo ingekuwa imeyatekeleza katika miaka 40 iliyopita.
This space is hosted by Nanci Monthly.	Ni hapa kila mwezi hoteli ikigaiwa Sh.
Shaunti: All at the same time - and all the time.	- Mtodos: OnKey; OnTime.
The implication is: what are you doing to add value?	mwandishi: Kitu gani kinakuongezea kipato?
This is particularly bad trade.	Hii biashara mbaya sana.
Be careful - it's catchy!	Karisha - So Cute!
The family divulged that since December 2020, the deceased had been on a life support machine.	- Familia ilifichua kuwa tangu Desemba 2020, marehemu alikuwa kwenye mashine ya kumsaidia kupumia
Fact #1: WWII would not have taken place if the USSR had not signed the Molotov-Ribbentrop pact with Nazi Germany.	Ukweli # 1: WWII isingefanyika ikiwa USSR haikutia saini mkataba wa Molotov-Ribbentrop na Ujerumani ya Nazi.
Research done at the University of Kansas shows that being able...	Utafiti uliofanywa na Chuo Kikuu cha North Carolina umehitimisha kuwa wanawake vijana wanaweza...
it could make a decision.	iweze kutoa uamuzi.
Dani is right of course that having doubts about the current multilateral arrangements does not make you a protectionist.	Mheshimiwa Naibu Spika, kwa hiyo, siyo kweli kwamba marekebisho haya sasa yanataka kutambua mifumo ya Kimataifa, siyo kweli hata kidogo.
Chad: I'm really not interested in discussing my relationship with my brother.	Rugangazi: Nisingependa kuzungumzia mahusiano binafsi ya viongozi wangu.
20 min from Copenhagen airport.	Dakika 20 kutoka pwani ya Copacabana.
The eyes of the demon light up.	nuru video wake up fuck
B) Not being able to see	(b) Yeye Hawezi kuonekana
Thank God there were people of all races that agreed with the civil rights movement.	Baba, asante kwa umati wa Wakristo ambao walitoka katika mataifa yote kupata kadi zao za wapigakura.
M1012: Building a Website from the Ground Up	Mbinu #1: Kujenga tovuti kutoka mwanzoni
Keep your photos and information up-to-date and respond to questions and reviews quickly.	Hakikisha namba yako ya simu na barua pepe zipo kwenye tangazo, na pia toa majibu ya maswali yao haraka.
Christians are being persecuted in Muslim countries.	Wakristo wanashambuliwa nchini Msiri.
19 In the eighteenth year of the reign of Josiah this passover was kept.	19 Katika mwaka wa kumi na nane wa kutawala kwake Yosia ikafanyika pasaka hiyo.
I was the first one to be arrested.	Nilikuwa wa kwanza kuchukuliwa.
BCAAs are essential amino acids such as L-isoleucine, L-leucine, and L-valine that cannot be made in the human body and therefore must be consumed in the diet (15).	BCAA ni muhimu amino asidi kama vile L-isoleucine, L-leucine, na valine ya L ambayo haiwezi kufanywa katika mwili wa binadamu na kwa hiyo lazima itumiwe katika mlo (15).
C'mon, wine, take me	Kalita, Jitumani M
Hence, research in this field can be related to both the organizational and technological aspects.	Hivyo, maelezo yake katika makala hii YANAWEZA kua na upungufu wa kitaalamu hapa na pale.
Take me out fwh the ballgame.	Jameni wana jf.hubu nitoeni taka za machooooh!.
The fruits of Vatican II have been bitter for the Catholic Church.	Marekebisho ya Liturujia yaliyoamuliwa na Mtaguso wa Vatikano II yalijitahidi kuwaandalia Wakatoliki chakula cha Biblia kwa wingi zaidi.
It's another MSI MB.	Hizi study tour nyingine mmhh.
"The social and environmental debt owed to the poor of cities can be paid by respecting their sacred right to the three Ls: Land, Lodging, Labour."""	"""Deni la kijamii na kimazingira ambalo maskini mijini wanadai linaweza kulipwa kwa kuheshimu haki zao tatu kuu ""za L tatu (Kwa Kiingereza) "": Land, Lodging, Labour."
The little schemer	The Kidogo Method
I try to not bring it up the first time we meet people.	Ntamuaminije mtu wakati Ndiyo kwa mara ya kwanza tu tunaonana.
Anabolic steroids were created in the late 1930s mainly to deal with hypogonadism, a problem where the testes do not produce enough testosterone for regular development, development, and sexual performance.	Steroids za anabolic zilianzishwa mwishoni mwa miaka ya 1930 kimsingi kutibu hypogonadism, hali ambayo majaribio hayatengenezi testosterone ya kutosha kwa ukuaji wa kawaida, ukuaji, na utendaji wa uhusiano wa kingono.
out the above-mentioned work	kufanyia kazi hayo yaliyotajwa hapo juu
Also, maybe they're just trying to avoid obesity.	Pengine wanajikinga na vumbi tu.
Are you optimizing ROI and...	Unathubutuje kumsihi mfalme kwa tabia ya kiburi na kwa ...
"significance in the performance ""smile."""	"inayopendelewa performance in ""Michael""?"
You sure we aren't married to the same woman!?!	Huoni wivu kuwa the other woman???
The question is whether somebody has written such a thing.	Swali,je kuna mwenye aliyepata tetesi kuhusiana na habari hii?
8When the lepers arrived at the edge of the camp, they went into one tent after another, eating and drinking wine; and they carried off silver and gold and clothing and hid it.	8Wakati wale watu wenye ukoma walipokuja sehemu ya mwisho wa kambi, wakaenda kwenye hema moja na kula na kunywa, na kubeba fedha na dhahabu na nguo, na kwenda na kuzificha.
The message-thing is just a waste of time.	Huyo hana cha message anapoteza wakati tu.
It does not exclude any class of	Haubadilishi aina ya mazoezi
He said He ate.	Alisema Nya.
And then there are always your parents.	Halafu wazazi hao wote wanakuwa wazazi wenu.
"""We've been working some long days."	"""Tumefanyia kazi sana kwa siku nyingi."
And listening to the album with fresh ears, I can see why.	Yaani nikiusikia huu mwimbo,nafreeze ghafla,cjui kwa nini.
The Chicago Teachers Union supports this education champion.	Muasisi wa Jumuiya ya Bunju Community Support Profesa.
You have got to clean your own house first before you tell other people that they aren't doing it right.	Weye bwanamkubwa hebu kuwa unafanya homework kabla haujawambia wengine hawafanyi yao.
"""By faith in the name of JESUS, this man whom you see & know was made strong."	16 Kwa imani katika jina la Yesu, huyu mtu mnayemwona na kumfahamu ametiwa nguvu.
The area needs to be a location that can easily be found by the attendees.	Ofisi inapaswa kuwa mahali rahisi kwa wateja wenye uwezo.
Don't plan on that has a hectic agenda, and adjust the work plan when needed.	Hakuna chochote kinachohitaji kutafutwa kwa kina sana - ingiza programu-jalizi na uweke wijeti mahali unapoihitaji.
He got speaking to another man.	akizungumza na mwanaume mwingine.
They are hopeless and look to someone to love them.	Hawana tumaini, kwa hiyo wanapenda mutu fulani awasaidie.
I could have at least got a soap box.	Least I Could Do karatasi za kupamba ukuta
"""I hate you so much,"" Shawn said into the phone."	"""Nimekukumbuka sana Dickson,"" alisema Linda kwenye simu."
This applies again to the hero's journey.	HAYA MENGINE TENA Usafiri wa Mchungaji.
I am spending a LOT of time learning to change my relationship of money.	Natumia muda mwingi kujifunza kwa namna tofauti maisha ya ndoa yalivyo.
Or was it the luck of the Irish?	Kumbe hiyo ilikuwa raha ya wanafunzi?
I have children 29 years old.	Nikaona ana miaka 29.
"send them to jail."""	"wajiandae kufungwa."""
