I'm still waiting for my gold and silver to move.	እኔም እንዳቅሜ ስምና ወርቄን እነሆ.
But I am attracted to her admiration.	ሆኖም አስተሳሰቧ ይደንቀኛል::
Conflict will always exist whenever people get together in groups.	ሰዎች በተሰበሰቡበት ሁሉ የሃሳብ ትግል አለ።
Bustle the bride's dress for the reception.	የሰርጉን ቀሚሱን ለሙሽኑ ያመጣል.
This space takes me back to my first years as a faculty member at IUPUI.	በሌላ አገር ከሚኖሩት ትውልደ ኢትየጵያውያን መካከል እኔ አምባሳደር ሆኜ መመለሴ የመጀመሪያው ያደርገኛል።
Windows Media Player 11 clients must finish this progression, however it's discretionary for Windows Media Player 12 clients.	የ Windows Media Player 11 ደንበኞች ይሁን እንጂ ይህ የ Windows Media Player 12 ደንበኞች ሆኖ ሲያገኘው ብቻ ነው, ይህን ሂደት መጨረስ አለባቸው.
This is especially the case when drumming with both hands, or with two drumsticks.	ባለሁለት ስርዓተ ክወና ወይም ባለብዙ-ክወና በመጫን ጊዜ ይህ በተለይ ይከሰታል.
"""Like the animals?"""	"""እንደ ወንዶቹ?"
what's the most important commandment?	በጣም አስፈላጊው ትእዛዝ ምንድነው?
If you find yourself battling insect bites and stings each summer, why not try some of these home remedies?	ኤክስፖርት ለምን እንዳሽቆለቆለ በየአመቱ አሰልቺ ሰበብ ከመደርደር፣ ለምን መፍትሄ አትሰጡም?
MrD wrote: Still, the original question wasn't answered.	ዘርዐይ ደረስ wrote: አሁንም ጥያቄው አልተመለስም።
the One whose body is consciousness,	ማንነቱ የተደፈረበት፣
God will provide coverage from disease.	አሁንም እግዚአብሔር በበሽታ እንደሚቀጣት ይናገራል።
For a spectacular presentation, not only good content but also a great way of showing it is a must.	አስቂኝ ግጥሞች, ግን ደግሞ ታላቅ መንገድ ብቻ ሳይሆን በትክክል መናገር ለማወቅ.
Who gave you the courage to say this?	እንዲህ ልትናገር ማን አደፋፈረህ ?
It's not to eliminate every infection.	አልተገኘም ሁሉንም በሽታዎች አስወግድ.
I honestly do put others needs before my own, but I don't think it makes me weak.	በእርግጥ ሌሎች ሰዎች ለእኔ ትኩረት መስጠታቸውን ቢያረጋጉም ጉልበት ግን አልፈልግም.
They just want to have a discussion.	አንተ ብቻ ውይይት ይፈልጋሉ.
The essence of his existence is fighting evil.	የታጋይ ሚና ተሰቃይቶም ቢሆን ለትግሉ ጠብ ማድረግ ነው።
Let's find out more with us.	ከእኛ የበለጠ ለማወቅ እንመልከት.
We are all decedents of Adam and Eve.	ሁላችንም የአዳምና የሔዋን ልጆች ስለሆንን እንሞታለን።
This makes it the perfect travelling companion.	ያ ፍጹም የመጓጓዣ ሀገር ያደርጋታል።
"The witness added, ""He seemed to be having the time of his life."""	ባሕታዊውም ሲመልሱ ‹‹ዘመኑ አንተን ይመስላል›› አሉት።
It simply will not have any effect, except for the insult and bitterness of the animal.	እንዲያውም መቃቃርንና የከረረ ጥላቻን ከመፍጠር በስተቀር ምንም ዓይነት ርባና የለውም።
Mother of Diane Ladd.	የቪን ዲሴል እናት ዴሎራ ።
We have a civic and a moral duty.	የዜግነትና የሰብአዊነት ግዴታ አለብን።
So the journey is simple.	ጉዞው ቀላል ነው.
The Conservative Wahoo: The Truth Hurts, Especially When It Comes From A Foreigner	መረዋ MEREWA: ውሸት መጥፎ ነው፡ በተለይ ምንጩ ከቤተክርስቲያን ሲሆን ያስፈራል።
Joseph never retaliated against his brothers.	ኢየሱስ በአባቱ ላይ በማመፁ ቃላቱን ውድቅ ያደረገበት አንድም ጊዜ አልነበረም.
Cotati or some of the areas where you have a chance of	ነገር ግን በሌላ ችሎታ ስብስቦችን አንድ ወይም ችሎታ የተወሰኑ አካባቢዎች
Sertraline can be taken with food or on an empty stomach.	አድቪል በምግብ ወይም በባዶ ሆድ ሊወሰድ ይችላል ።
Capable of being borne;	* ዝገት መቋቋም የሚችል;
What did the Germans?	በዚህ ጊዜ እረኞቹ ምን አደረጉ?
And yet nothing could prepare him for having one of his own.	ነገር ግን መያያዝ የሚችልበት ምንም ነገርም የእራሱ አንድ አካል ሊሆን አይችልም ።
frontier, five thousand escaped to Egypt, and there are a few thousand	በሞያሌ የተገደሉ ሰዎች ቁጥር 10 ደረሰ፤ ሺህዎች ወደ ኬንያ ተሰደዋል
Functions of the main sex hormones.	ስድስት የስነ-ልዕለ-ምድቦች ምድቦች.
Live Baccarat: For when you're only in the mood to play against the dealer, without the distraction of other players in the room.	የቀጥታ Baccarat: አንተ ብቻ በስሜት ላይ በምትሆንበት ጊዜ ለማግኘት አከፋፋይ ላይ ለማጫወት, በክፍሉ ውስጥ ሌሎች ተጫዋቾች ሳይከፋፈል.
"""If I'm ""sleepwalking..."" does that mean that you actually came here?"""	"""ይህ እውነት መሆኑን እኔም አረጋግጣለሁ"" ስትል በቦታው ተገኝተህ ነበር ማለት ነው?"
The House should firmly reject the notion that we are considering a final decision today.	ለዛሬ የአስበዱኝ ጥያቄ አንቀበልም
Watch the shape and its interaction with the light	ከብርሃኑ ነጋ ጋር ያለውን ጥያቄ እና መልስ አሳዩን
Muslims do not realize that it is their own bigotry and injustice that will be the cause of their final loss.	ጁንታዎቹ የሰሩት ግፍና የግፍ ግፍ ገና ለትውልዳቸው የሚያልፍ እርግማን የተሸከመ መሆኑን ያወቁት አይመስልም።
RiCheng people firmly believe that the value of the brand, not only from the excellent product quality and excellent solutions, but also must have perfect pre-sales, after-sales technical support.	የ RiCheng ሰዎች የምርት ስሙ እሴት ፣ ከምርቱ የምርት ጥራት እና እጅግ በጣም ጥሩ መፍትሄዎች ብቻ ሳይሆን ፍጹም ቅድመ-ሽያጮች ፣ ከሽያጭ በኋላ ቴክኒካዊ ድጋፍ አላቸው።
Love me all day long	ለሁልቀን እንዲወደኝ፣
The scenario of economic crisis and decline in investment is [...]	ለመሆኑ አለ የሚባለው የኢኮኖሚ ዕድገትና ተጨባጭ ዕውነታውን የተመለከቱ [...]
If not possible, the overflow can be hidden.	ይህ የማይቻል ከሆነ አየሩን መተካት ይችላሉ።
4 So Peter gave them a complete account of what had happened from the very beginning:	4 ጴጥሮስ ግን ከመጀመሪያው ጀምሮ በተራ ገለጠላቸው
However, visible changes occur in the second week.	ሆኖም ግን, በሁለተኛው ሳምንት ውስጥ የሚታዩ ለውጦች ይከሰታሉ.
We are pleased to invite you to visit our Headquarters.	የእኛን ድር ጣቢያ እንዲጎበኙ በደስታ እንቀበላለን።
Also providing opportunities to Explore Japan.	እና ደግሞ እንዴት ለማሟላት ግምገማ ቅድሚያ የሚሰጡዋቸውን ጃፓን.
No strangers to pushing the envelope... remember Ferragamo's caged heel?	የአትክልት ቦታን በኩሳ ማፍላት ይቻላልን?
It only lasted for a short time over the summer.	""" በሚል ትንሽ ወርፈውን ነበር።"
Here are some of The best cities in Europe for vegetarians and how to get there by train.	እዚህ ላይ ናቸው በአውሮፓ ውስጥ ምርጥ አንጋፋ መደብሮች እና በባቡር ወደዚያ እንዴት እንደሚደርሱ.
However, they doesn't mean all demons.	ይሁን እንጂ ሁሉም ድመቶች ሣር ይወዳሉ ማለት አይደለም.
The National Diet Building at night, October 2018	ብሄራዊ ሃርብ ምግብ ቤት ሳምንታዊ 2018
The second round gets progressively harder and is more demanding than the first round.	ከመጀመሪያው ይልቅ ሁለተኛው እድሳት ከበድ እያለና መስፈርቱ እየጨመረ ይሄዳል።
He is hated because of the time he spoke out against the Vietnam Conflict.	የተጠላበት ምክንያት ኢትዮጵያ የሚለውን ስም ስለያዘ ነው።
I hope it is easier to bear next time.	በሚቀጥለው ጊዜ ይህንን ትንታኔ ለማድረግ በጣም ቀላል እንዲሆን እፈልጋለሁ።
The Weimaraner's human must look out for their well-being on every level.	ሁሉም የአማራ ህዝብ በየ አካባቢው ጥንቃቄ ሊያደርግ ይገባል ።
To find out who your parish or town As a councillor you can become a voice	ከንቲባ አሁን የእርስዎ ከተማ / ከተማ ማን እንደሆነ ያውቃሉ ፣ ከንቲባ መሆን እንዴት እንደሚቻል እዚህ ተብራርቷል
Particular emphasis will be put on migration and security issues, the Single Market, social inclusion, Europe's neighbourhood, the Mediterranean and the maritime sector.	በተለይ ትኩረት ስደት እና ደህንነት, ወደ ነጠላ ገበያ, ማህበራዊ መካተት ላይ ይቀመጣል, በአውሮፓ አካባቢ, በሜድትራንያን እና የባሕር ዘርፍ.
I've called the vet.	ኤስ) ብለው ጠርቼዋለሁ ።
My boobs are a personality.	ተብዬዎች ስብዕና ነው።
Anyway, the point is you have the power to shape your life through your ability to envision your life.	አመለካከት ማለት ህይወትን የምትገጥምበት በሂደት ባህሪህን የመወሰን አቅም ያለው የአንተነትህ ማሳያ ነው።
That's why it is always important to dress appropriately for a job interview.	ለስራ ቃለመጠይቅ በቃለ መጠይቅ ተገቢ አለባበስ ሁል ጊዜ አስፈላጊ የሆነው ለዚህ ነው።
I'm in the beginning stages of a new relationship, after a divorce from a 25 year marriage.	ፍቺን መለያ የሆናቸው የቅርብ ጊዜ ጥያቄዎች
It's creating heat.	ሙቀት እየሰራ.
"The complaints are going to come to the BOS."""	ወደ ዲልቪስ የሚገቡ
Let the efficiency life of their performance.	የግብይትዎን ውጤታማነት ይተነትኑ።
stolen from C.P's facebook.	ኦ ለካ ፌስቡክ ብሎክ ተደርገናል።
"""I'm so happy about the whole experience, thank you Marc!"""	እናም ለዚህ ሙሉ ጨረቃ በጣም ተደስቻለሁ ❤ ፓም አመሰግናለሁ!
[edit] I want my phone call	★ የእኔ የጠፋ ስልክ ማግኘት
The Church is holy, although there are sinners within her.	ቤተክርስቲያን ቅዱስ ብትሆንም በውስጧ ኃጢአተኞችን ይዛ ትገኛለች።
Proposal for a Council Regulation (EC) on jurisdiction and the recognition and enforcement of judgments in civil and commercial matters /*	በሲቪል ወይም በወንጀለኛ ጉዳዮች ላይ በፍርድ ቤት የታዘዙ ክፍያዎች*
It accelerates in a straight line as good as a Busa.	ም እንደ ምሰሦ ቀጥ ያለ መስመር ይሆናል።
Every piece of jewelry is one-of-a-kind, just like you!	ምን አለ እያናዳንዱ የተዋሕዶ ልጅ እንደ እናንተ መሆን ቢችል!
I was detained by my own self.	ለብቻዬ ኑሮን ተያያዝኩት።
For I had revealed nothing, even to that point in time, на Евреите, or to the priests, or to the nobles, or to the magistrates, or to the others who were doing the work.	እኔ ምንም ተገለጠ ነበር, እንኳን ጊዜ ውስጥ ይህን ነጥብ, አይሁዳውያን ወደ, ወይም ለካህናቱ, ወይም ወደ መኳንንቱ, ወይም ገዢዎችም, ወይም ለሌሎች ሰዎች ሥራ እያደረጉ ነበር.
Instead, I took my time searching for a spot.	እኔም ታክሲ ፍለጋ ጊዜ ማባከን አልፈለኩም።
Why does this remind me of A Wrinkle in Time?	ለምን ትዝ አለኝ ይሄ ዘፈን
He apologizes to Diana, but it's too late.	ለንደን ይቅርታ ጠየቀች ፣ ግን ዘግይቷል ።
What if he's my lover?	ፍቅረኛዬ ብትሆን ኖሮስ?
Our Library has a number of volumes related to this topic.	የእኛ ድር ጣቢያ በዚህ ጉዳይ ላይ የተለያዩ ጽሑፎች አሉት ።
I have long since given up on the third one.	ጀምሮ ረጅም ጊዜ ሆኖታል ሦስተኛውን ልቦለድ ልጽፍ ጀመርኩ።
"It ""blows...""especially when all the games are made on a ""PC"" in the first place!!"	Games በሁለቱም ቅድሚያ አሁን ቅድሚያ የሚሰጡዋቸውን!
Have you read Hawking's work?	የሬዶንዶን ሥራ አንብበዋል?
Focus on the small box.	ትኩረት-በትንሽ ቁጥሩ ላይ.
And they don't hit the mark because of the fact that there isn't one host nation.	አገራዊ ዕራይም ስለማይኖረው መንደርተኛ እንደሆነ ይቀራል።
Your friends are looking forward to playing with you, help you advance in the game and of course YOU FACE!	የእርስዎ ጓደኞች, ከእናንተ ጋር ለመጫወት, እርግጥ ነው, እናንተ በክርክሩ አንተ ጨዋታ ውስጥ ለማራመድ ለመርዳት እፈልጋለሁ!
Like any good soldier, he might have been inclined to embellish the tale.	ጎበዝ ዋናተኛ እንደመሆኑ መጠን ይህን በደመ ነፍስ ሊያደርገው ይችል ነበር።
Grant yourself opportunities for self-care.	የራስህን ጥቅም መሥዋዕት ለማድረግ የሚያስችሉ አጋጣሚዎችን ፈልግ።
I don't know that it will return.	ተመልሶ የሚመጣ እንደሆነ አላውቅም።
I would have been out with AxKx.	avx ጋር እገለጽ ነበር
"that clear: ""You're right - I am God."""	"ከዚያ ይልቅ ""እኔ ትክክል ነኝ፣ አንተ ሟች ነህ"" (I am right, you are dead!"
Is this something that you've taken up with the Pakistani Government?	ከሶማሊያ መንግሥት ጋር የምታደርጉትን ንግግር ተዋችሁት ማለት ነው?
The 8th Creating	< 8 የፍጥር ዘካት
The cast of the Really Youthful Group is made up of young people.	የቡድኑ ጠንካራ ጎን በወጣቶች የተገነባ መሆኑ ነው።
Both are expected however to be in contention for the semifinals.	ሁለቱም በይፋ ይመረቃሉ ተብሎ ይጠበቃል::
Bailout for the U.S. Automakers?	ለአሜሪካ ተሽከርካሪዎች የግዢ አገልግሎት ይሰጣሉ?
In order to generate patriotic fervor, however, there must be a threat and an enemy.	የፓለቲካ ኮንትራት ውል ለማደስ ደግሞ ውድድርና አማራጭ መኖር አለበት።
The Portuguese along with the Spanish took 800 years to drive away the Arab rulers.	እስፔይን እና ፖርቱጋል ወራሪ አረቦችን ከ 800 አመት በኋላ፣ አባረዋል ።
Developing the public authorities' use of design to improve the quality of life;	ምን ያህል የመልካም አስተዳደር አቅራቢ ንድፍ አማካኝነት ህይወት ለማሻሻል ነው ማወቅ•
"They want to have more meaning in their lives."""	በሕይወትዎ ውስጥ የበለጠ ይሳተፉ።
Having said that, the one husband that is a member of my bookclub has so far managed to not cause any problems for the rest of us.	ይህ በእንዲህ እያለ በችግሩ ሰለባ የሆኑት ዜጎቻችን ደግሞ እኛ እስካሁን የወሰድነው ካሳ የለንም በአበቱታ ላይ ነው ያለነው።
I am sure the angels came when he called them.	መልአኩ መጥቶ እንደሁላችሁም ነው አላቸው።
Many people, including students, were caught in the jam.	መምህራንን ጨምሮ ብዙ ተማሪዎች ታሰሩ።
Everyone's not ready.	No ሁሉ ዝግጁ.
(25 lbs. in one year) despite extensive exercise and diet.	(በአንድ ጠቅታ) አንድ ዓመት ይህን ቢል ለማራዘም እና ብዛት መጠቀም
Perhaps, they should be trained to look for these signs.	እነዚህን ንዝረት ለመመዝገብ ዐይን የሰለጠነ መሆን አለበት ።
"The HUAWEI MateView GT 27"" features an impressive 165Hz refresh rate and a golden curvature of 1500R."	"HUAWEI MateView GT 27"" አስደናቂ የ165Hz የማደስ ፍጥነት እና የ1500R ወርቃማ ኩርባ ያሳያል።"
2000 will be printed and delivered to all over Turkey and to certain centers in Europe.	2000 ለሁሉም ቱርክ እና በአውሮፓ ውስጥ ላሉ የተወሰኑ ማዕከላት ይታተማል እና ይሰጣል።
he scatters his lightning around him and covers the roots of the sea.	እነሆ፥ በዙሪያው ብርሃኑን ይዘረጋል፤ የባሕሩንም ጥልቀት ይከድናል።
Maybe he's on the plane.	ምናልባት አይሮፕላን ውስጥ።
That the Falklands wasn't a war?	አጼ ኃይለሥላሴ መጡ፣ ውጊያ አልነበረም?
After the bet is made, the wheels begins to turn.	ማሽኑ ከተነሳ በኋላ ሮለሮቹ መሽከርከር ይጀምራሉ ።
"When Someone at Your Church Says, ""I'm Gay!"""	"ማንም የቤተ ክርስቲያን አባል ""እኔ የጳውሎስ ነኝ!"
The Movement for Women's Rights in this country didn't come about solely through the efforts of just one solitary Aquarian.	ይሄንን ተግባር የፈፀሙ የተወነሱ ስብስቦች ፣ በአንድ የፀጥታ መዋቅር ብቻ የሰራ አይደለም።
"""In addition to focusing on members' well-being, the council takes great joy in celebrating the successes of our members through awards and events."""	"የጨዋታው አሸናፊነታችንን በተመለከተ ከግጥሚያው በኋላ በሁሉም የክለቡ አባላት እና ደጋፊዎቻችን ላይም ነው ከፍተኛ ደስታን ሊፈጥርብን የቻለው""።"
Hosea 7:2 They do not consider in their hearts that I remember all their wickedness; now their own deeds have surrounded them; they are before My face.	2፤ እኔም ክፋታቸውን ሁሉ እንዳሰብሁ በልባቸው አያስቡም አሁንም ሥራቸው ከብባቸዋለች፥ በፊቴም አለች።
The Southern forces will be a Muslim alliance led by Egypt (Dan.	ግብፅ በዓመፁ ሰው ሠራዊት ድል ትሆናለች (ዳን.
That is a great life story.	ትልቅ የሕይወት ታሪክ ነው።
Every professor I had was no different from a four-year institution's professors.	እያንዳንዳቸው ለማሠልጠን የሚቀበሉት በዓመት ከአርባ ተማሪ የሚበልጥም አልነበረም።
In past years we had stayed at a timeshare.	ዝቅተኛ ወጪ ዋጋ አሰጣጥን
We have been looking for you for the past three years!	በየቦታው ለሶስት ቀናት ያህል ስንፈልግህ ነበር!
Today that word is not tossed around as much as it once was in the past.	ይህ ቃሉ እንዳለፉት ጊዜያት ሁሉ በአሁኑ ወቅትም የሚታጠፍ አይደለም።
How to Make Love to a Woman, full movie - Full movie 2010.	ፍቅር ያሸንፋል ሙሉ ፊልም- FIKIR .
However a few simple tricks can be used to lessen the effect.	ይሁን እንጂ, አንዳንድ ቀላል የመላ ዘዴዎችን በመጠቀም ይህንን ችግር ለመፍታት አስያዥ ላይ ሊመጣ ይችላል.
It is not machine.	ማሽኑ አይደለም።
- Health Department of Western Australia.	የምእራብ አውስትራሊያ የጤና ክፍል ማጠቃለያ ዘገባ ።
And there is NO world building.	የተገነባ አለም የለንም.
This is essentially a must-have tool for those involved in the world of IoT or those who spend their time researching NFC tags and technologies.	የማሳያ ጊዜ መሳሪያቸውን እና የመተግበሪያን አጠቃቀም ለመቀነስ የሚፈልጓቸውን የ iOS ተጠቃሚዎች ጠቃሚ መሣሪያ ነው.
"The Light Spirit crossed off ""Compassion and Understanding,"" from his legal papers, he flew over and engulfed the judge."	"ወያኔ ግን በ""ከፋፍልህ ግዛው"" ዘዴው እየትጠቀመ ሲያከሽፈውና ሲያፈነው ኖሯል።"
And now, you've got three options.	አሁን እናንተ በመሠረቱ ሦስት አማራጮች አሉን .
It was adapted from MAN's truck engines.	ተገኝቷል በ የፍለጋ ሞተር ሰዎች.
The law and the prophets were proclaimed until John.	"""ሕጉም ሆነ የነቢያት ቃል እስከ ዮሐንስ ድረስ ሲነገሩ ቆይተዋል።"
to fear each other because of their differences.	በማጋራታቸው ምክንያት ፍርሃትን እንጥላለን።
Save them from the corruption of this world.	ሰዎች ፡ አምልጠው ፡ ከጥፋት ፡ ዓለም
He also called for preventive measures for the safety of crops in view of the possible cyclone rain.	በዝናብና ጎርፍ ምክንያት ሊፈጠሩ የሚችሉ አደጋዎችን ለመከላከል በቂ ዝግጅት መደረጉንም ገልጿል።
able to see them again!	እንደገና ሊያዩዎት ይችላሉ !
"""As the Father has sent me, so I send you.'"	"""አባቴ እኔን እንደ ላከኝ እኔም እናንተን እልካችኋለሁ"" በማለት ይናገራል።"
And the Lord saved David in all things, to which he went.	እግዚአብሔርም ዳዊት በሄደበት ሁሉ ድል ይሰጠው ነበር።
Isaiah accommodated them.	ኢሳያስ አፈወርቂ አስረክበዋቸዋል።
"However, that said, it is interesting that she is not portrayed here as ""Electra."""	"ይሁንና እኛ እዚህ ሆነን ""ተያዘ"" ስንባል የሆነውን ያህል አለመሆኑ ገራሚ ነው።"
Sign of the death of Ezekiel's wife, 24:15-27	የሕዝቅኤል ሚስት መሞት ምልክት (ሕዝቅኤል 24፡15-27)
It is the sign of wisdom.	ይህም የጥበቡ መገለጫ ነው።
Other Moravian attempts to gain a foothold in this region also failed.	ሌላ የአካባቢው ነዋሪ እንዲሁ በዚሁ መፀዳጃ ቤት ውስጥ እራሱን ለማጥፋት ያደረገው ሙከራ አልተሳካለትም።
At first, I did not want to enter it.	እንደውም መጀመሪያ ላይ ማካተት አልፈለግሁም ነበር።
That is for you and your family.	"""ይህማ ላንተና ለቤተሰብህ ነው።"
For half a year nothing was done.	ለአንድ ዓመት ምንም ነገር አልተደረገም ።
Would it be a good idea for me to take the plunge?	ለኋላ ላሉት ቧንቧዎች የእኔ ሀሳብ ጥሩ ይመስለኛል?
A few days of daily driving and the rotor face should be nice and clean again.	ነገር ግን ቀለበት ለቀሪው ህይወት በየቀኑ የምትለብሰው እና ፍጹም መሆንም አለበት.
that before the coming of the Lord's great and glorious day,	20ታላቅና ክቡር የሆነው የጌታ ቀን ከመምጣቱ በፊት፣
And goodness, what would we have done if we picked up a copy of The Telegraph to learn that the virus had reached epidemic proportions right here in Nashua?	ቁጥሮቹ ምን ማለት እንደሆነ ማንም ሊናገር ይችላል?
And we'll need grace.	ጸጋ ያስፈልገናል ።
The profits is to not force on your own to exercise when your body isn't for it.	ይልቅ ባይጠቅምሽም አይሆንሽ ብርታት
What would Jesus do to the Pharisees?	ሀ) ኢየሱስ ፈሪሳውያንን ምን ያደርጋሉ ብሎ ተቃወማቸው?
Today is (Australian) World Teachers' Day.	ም (አብመድ) ዛሬ የዓለም የራዲዮ ቀን ነው።
It is used by the Ven. amoli in Path of Purification.	እንዴት ጥቅም ላይ ይውላል ነው።
It can be a difficult job to do by yourself.	በራስዎ ለማድረግ በጣም ፈታኝ ሊሆን ይችላል።
How to help your child deal with set backs: Make your child understand that disappointments are a part of life and should be treated as such.	ልጅዎን በቤት ውስጥ ከሚደርስባቸው አደጋዎች እንዴት መጠበቅ እንደሚችሉ
Will Stribling is one of the remaining residents and is now a member of the crisis committee.	ሜልባ ማለት ከአምስቱ የገዳ አባላት አንዱ ሲሆን፤ አሁን ያለው የገዳ አባልም የሜልባ ነው።
The ones that do participate are the ones that will need it, whether it's for a will or trusts.	በተናጠልም ይሁን በጋራ የሚፈልጉትን ድጋፍ ያገኛሉ።
He also brought gifts for his mother.	በተመሳሳይ, እሱ ከእሷ ወንድሞች እናቷ ስጦታ አቀረበ.
As the weapon entered the airstream,	ከገደል ባንድ መግቢያ ስለሆነ
The idea that human beings are made in the image of God (Latin imago Dei).	ሰው በእግዚአብሔር አምሳል የተፈጠረ ነው (ኤል-ኤሎሂም).
