"""And considering what's happened, that is a realistic, but difficult, goal."""	‹‹የሹመቱ ፖለቲካዊ ግብ እንደገመትኩት ከሆነ የዘገየ ነገር ግን ተገቢ ዕርምጃ ነው።
The eternal flame can be viewed in our Memorial Chapel at all times we are open.	ራስ-ሰር አስቀምጥ ማለትም እኛ በምንጽፍበት ጊዜ ሁሉ በማስታወሻ መተግበሪያው ውስጥ እንዲቀመጥ መውጣት ሳያስፈልግ ይቀመጣል ።
And this is the era when the dead hand of Stalinism reasserted itself.	የቀድሞ የትዳር አጋርዎ አዲስ ግንኙነት እንደገና ሲቋረጥ ይህ ነው ።
adherence to God's laws and commandments.	& ለሕግ እና ለእግዚያብሔር ትእዛዛት እና ትእዛዛት.
Sub-problems have been modelled,	ችግሮች ሁነው እየቀጠሉ መሆናቸው ተገልጿል፣
Even though there are one-click solutions.	ምንም እንኳን የአንድ-ማቆሚያ መፍትሔ .
A lot of younger people soon became old-fashioned.	አብዛኛው ወጣት ተጠቃሚ መሆን የጀመረው በቅርቡ ነው።
Thanks for the guide, it helped me a lot	ስለ ጥቆማ እናመሰግናለን, ይህ ብዙ ረድቶኛል
Assuming you have just one email account, the first step is to make sure you have a note of the username and password.	አንተ ብቻ አንድ የኢሜይል መለያ አላቸው ብለን ካሰብን, የመጀመሪያው እርምጃ እርስዎ የተጠቃሚ ስም እና የይለፍ ቃል አንድ ማስታወሻ እንዲኖረው ለማረጋገጥ ነው.
I am Doubting Thomas, but I am still doubting....	አህመድ እንዲህ ሲል ጽፏል- ... አሁንም ጥርጣሬ አለኝ...
It was his participation in the football events that steered him away from the poor choices he could have made as a child.	በልጅነቱ ሊያደርጋቸው ከሚችሏቸው መጥፎ ምርጫዎች እንዲርቀው ያደረገው በትምህርት ቤቱ የውድድር እግር ኳስ ውስጥ መሳተፉ ነበር ።
It had taken him the meaning.	ማለቱን ተያይዘውታል።
Consciousness is a fundamental feature of creation.	ማህደረ ትውስታ ለፈጠራ ቁልፍ አካል ነው።
That's a lot less than Davidson Sanchez...	ይበልጣል ከኖርዌይ _ DCESON
The battle is true.	ትግሉ ሀቅ ነው።
It is transferring a large part of the wealth previously created to the fraternity of bankers and associated businesses.	ከዚህ ውስጥ ደግሞ አብዛኛውን ገንዘብ ልማት ባንክ ለአምራች ኢንዱስትሪና ሌሎች ቅድሚያ ለሚሰጣቸው ዘርፎች እንዲያበድር ይሰጠዋል።
God's loving kindness leads us to repentance.	ንስሐ ጸጋ እግዚአብሔር በእኛ ላይ እንዲትረፈረፍ ያደርጋል።
Tales from the Arabi...	አመልካቾች ከአረብኛ...
The dragon was believed to control the rain and the wind.	ደመናውን እና ዝናቡን እንደሚቆጣጠር ይታመን ነበር.
Who gets to choose the winner of the Nobel Peace Prize?	← የኖቤል የሰላም ሽልማትን ማን ሊያሸንፍ ይችላል?
We have seen your power with our own eyes.	ልፋታችንን በአይናችን አይተነዋል።
Our scientists are also leading pioneering work to understand how the genetic landscape of tumours evolves over time.	ስለ ነፍሳት የሚያጠኑ ሊቃውንት፣ የእነዚህ ነፍሳት ልዩ የሕይወት ዑደት በዝግመተ ለውጥ አማካይነት እንዴት እንደመጣ ለመረዳት አሁንም እየጣሩ ነው።
est son was named John.	ይህው ልጅሽ የተባለውም ዮሓንስ ነው።
away to be spared from evil.	ከክፉም ይከለክላሉ።
One out of every five people develops at least one type of anxiety or another throughout their life.	በግምት ከአምስት ሰዎች አንዱ ቢያንስ አንድ ጊዜ በእሷ ወይም በሕይወቱ ውስጥ እንደዚህ ያለ ትዕይንት አለው ።
It is also good to have the ability to inspire someone else to reduce weight.	በመስጠት ውስጥ ሌላ መሰጠት እንዳለ እያሰቡ ማድረግ ይገባልበሰው ሁሉ ማግኘት መደሰትም ያስፈልጋል።
What do you think this means for David?	ለዳዊት ፍሬው ይህ ምን ትርጉም ይሰጠዋል?
decision-making arena, we believe that the state government should establish a critical area	ሙስናን በክልሎች ለመከላከል መንግሥት የፖለቲካ ውሳኔ መስጠት አለበት ተባለ
Both of them were women too.	ከእነርሱም ሁለቱም ሚስቶች ነበሩ.
It should be noted that the story opens with violence against teens.	ም አደባባይ በወጡት ወጣቶች ላይ ጭፍጨፋ መካሄዱ ይታወሳል።
All I want to do is open people's minds about issues that	ብቻ እኔ ስለዚህ ሰዎች ዝርዝር ነጥብ ለማድረግ
How To Get Rid Of Mice In - Mice: How to Identity and Get Rid of Mice in the Garden and Home The Old Farmer's Almanac	ፊት ላይ አክኔ ጠባሳ እንዴት ማስወገድ እንደሚቻል: ቤት እና የውበት ሳሎን
Guide us in the straight path...	ወደ ቀጥተኛው መንገድ ይምራን!
Some of them speak out.	አንዳንዶች ተናግረው ይወጣላቸዋል።
8 And he built the city round about, even from Millo round about, and Joab restored the rest of the city.	8 ፤ ከሚሎም ጀምሮ በዙሪያው ከተማ ሠራ፤ ኢዮአብም የቀረውን ከተማ አበጀ።
Make yourself available to be used by God.	ስለዚህ እግዜር እንዲጠቀምብህ ዝግጁ ሁን።
England, on the occasion of the prince1s twenty-first birthday.	እንግሊዝ በዚህ ዓርብ የ 112 ኛ ልደቱን ቀን ያከብራል ።
"""To be attorney general, you have to be a practicing lawyer for eight years before the election."	ኢንተርናሽናል ዳኛ ለመሆን ቢበዛ ስምንት ዓመት በሙሉ ዳኝነት ማገልገል አለብህ።
the Minister of trade of the USA is impressed by progress of Russia	ጠ/ሚኒስትር አብይ እያካሄዱ ያለውን ለውጥ ዩናይትድ ስቴትስ አደነቀች
If the complaint is not resolved in this way, stage 2 will be implemented.	ይህ መመሪያ እንዳልተዋቀረ ከተተወ 2 ስራ ላይ ይውላል።
In this time of stress right before the holidays this may be a good thing to remember.	በአደገኛ የአየር ሁኔታ ሁኔታዎች ውስጥ ይህ ቦታዎን ለመደሰት ይህ ጥሩ ሊሆን ይችላል ።
Pelicans in the city of Lima, Peru.	ሲኒማዎች በሊማ, ፔሩ
I read it as a young girl and when I think back about it I can remember how I felt while reading it!	ገና ግጥምህን ሳየው የትና እንዴት እንዳነበብኩት አስታወስኩ::
"""Next time,"" and he laughed."	"66""> እና ሳቀ ።"
Top of the divider is the PoO (Point of Origin).	ዋናው ንጥረ ነገር ዶሮ (የበግ አተር) ነው ።
This shows you are now £500 in the hole.	አሁን ጉርሻ ውስጥ £ 500 ጋር ይጫወታሉ!
Clain was hospitalized seven days.	ቤተል በሆስፒታሉ 70 ቀናትን አስቆጥራለች።
"Kelly said: ""When my mum and dad started to foster I was excited, as well as apprehensive."	"ዴኒ እንዲህ በማለት ያስታውሳል፦ ""ወላጆቼ ከተፋቱ በኋላ ደስታ የራቀኝ ከመሆኑም ሌላ በጭንቀት ተውጬ ነበር።"
"""We have higher stock thickness."	እኛ እጅግ የላቀ የትራክ መዝገብ አለን ።
And then it is necessary to establish political relations.	የፖለቲካ ዝምድናም ያስፈልጋቸዋል።
My manager will be back tomorrow at this time.	ተራኪያችን ነገ በዚሁ ሰዓት ያስነብበናል ።
God helps one to do this.	አላህ ይህን አድርገው አንድ ከሚያደርጋቸው ያድርገን።
We hope that you have a much better idea on the things that you could do in order to build muscles as efficient and as quickly as possible .	እኛ በተቻለ ፍጥነት እንደ እናንተ ቀልጣፋ እና ጡንቻዎች ለመገንባት እንዲችሉ ማድረግ የሚችሉ ነገሮች ላይ በጣም የተሻለ ሀሳብ እንዳላቸው ተስፋ.
look closely into my heart and mind.	ልቤንና ውስጤን መርምር፤
He made himself into a better man, and the world took notice.	አሁን ከቀድሞው ትንሽ ይሻላል፤ መንግስትም ትኩረት ሰጥቶታል።
This is the self-giving love of God.	እንደዚህ ከሆነ በርቱ እሺ እግዚአብሔር የሚወደው እንደዚህ አይነቱን ነው።
How I can be free of this difficult situation?	ታዲያ ከዚህ አስቸጋሪ ሁኔታ ነፃ መውጣት የሚቻልበት መንገድ ይኖር ይሆን?
15 They went after them to the Jordan: and, behold, all the way was full of garments and vessels, which the Syrians had cast away in their haste.	15፤ በኋላቸው እስከ ዮርዳኖስ ድረስ ሄዱ፤ እነሆም፥ ሶርያውያን ሲሸሹ የጣሉት ልብስና ዕቃ መንገዱን ሁሉ ሞልቶ ነበር።
There are many opportunities for service in this ministry area.	በዚህ አገልግሎት ውስጥ በማገልገል ረዘም ያሉ ጊዜያት.
After Jesus was crucified, his followers were crushed.	ክርስቶስም ሲሰቀል የእርሱ ተከታዮች እጅግ ደነገጡ።
Consequently, an intermediary, who is only acting as a conduit and has neither control over the content nor vouches for its quality, is exposed to a great deal of liability.	መንግሥት እኛን የሚገመግምበትና የሚቆጣጠርበት፣ እኛም ከመንግሥት
After the boards have been air dried, they must be kiln dried for 4 weeks.	ይህ ከተነቀለ በኋላ ሳሩ ለአራት ሳምንታት በተከደነ የባልዲ ውሃ ውስጥ በመንከር ማስወገድ ያስፈልጋል።
How can exercising a legal power be a violation of the law?	አንድ ተቋም ላይ ህግ አውጥተህ ሕግ አርቀቅህ ሕግ አስፈፅመህ እንዴት ሆኖ መስራት ይቻላል?
As to the weight of the airplane, for airplanes of a certain	ለአውሮፕላን ማረፊያ የተሰጠ...
It is a symbol of the country's values and traditions.	ልዩ ምልክት ለአገሬው ሰዎች እሴቶች እና ወግ ነው።
That happened after Bush secured the nomination and after the election was achieved.	ይኸ የሆነው አሊ ቦንጎ ምርጫውን ማሸነፋቸው ከተረጋገጠ በኋላ ጭምር ነበር።
The Chilean football association ANFP said in a statement it struck a deal to hire Pizzi until the 2018 World Cup in Russia.	ዋልያዎቹን እስከ 2018 የሩሲያው የዓለም ዋንጫ ድረስ ስፖንሰር በማድረግ አብሮ ለመስራት ከፌዴሬሽኑ ጋር ስምምነት ላይ የደረሰው በሄኒከን ኢንተርናሽናል ስር ምርቱን ለገበያ እያቀረበ ያለው ዋልያ ቢራ ነው።
These are the hosts.	እነዚያ ወራሾቹ እነርሱ ናቸው።
I think she likes it when people touch her hands, because when I did touched her hands, she was clinging to it.	እጆቿን መጫወት እንደምትወድ ትናገራለች, ግን በሚጨርስበት ጊዜ እያቃጨች ነው.
Luke 18:23 But when he heard that, he was very sad, for he was surpassingly rich.	Luke 18:23 እርሱ ግን ይህን ሰምቶ እጅግ ባለ ጠጋ ነበርና ብዙ አዘነ።
Mech Battle: The year is 2203.	በዝንቱ ቃለ ማኅሌት 22.
Additionally, while the Caribbean abounds with consumable fish, salmon isn't one of them.	ምንም እንኳን ዓሦቹ በአልኮል መጠጥ በጨጓራ ተሞልተው ቢሞሉም, የሚገድላቸው መጠጥ አይደለም.
(1) The important point to discuss here is that nobody (not even the house members themselves) has access to the whole house.	ከቤተሰቦቹ አባላት መካከል በመጀመሪያ ማንም ወደ እግር ኳስ ያልገባ (እዚህ እናቱ እንኳን) አለመኖሩን እዚህ ጋር መግለፅ ተገቢ ነው ።
The life you want is going to come from YOU.	የምትፈልጉት ሕይወት የእናንተ ለመሆን እናንተን እየጠበቀ ነው።
That's when even the extension has been hijacked.	እና እዚያም እንኳን መስፋፋት የተከለከለ ነው ።
Divorce is a legal process wherein a couple gets divorced from each other for a variety of reasons.	በከተሞች እንደሚታየው ሰዎች ፍቺ እየፈጸሙ ለሁለተኛ አንዳንዴም ለሦስተኛ ጊዜ ሌላ ትዳር የሚመሠርቱት በተለያየ ምክንያት ነው።
PS -- I don't blame (all) the locals for this.	ኢዮብ (ዶ/ር) ፡- ለየትኛውም አስመጪ ይህንን አልፈቀድንም።
You will not be talking to a person.	ከአንድ ግለሰብ ጋር እያወራህ አይደለህም.
Psalms 119:114 - You are my refuge and my shield; I have put my hope in your word.	መዝ ዳዊት 119:114 - Correct Me አንተ ረዳቴና መጠጊያዬ ነህ፥ በቃልህም ተማመንሁ።
If you do not have a readership, the article series can get you lots of readers and can help you promote your brand.	አንባቢዎች ከሌለዎት, ይህ የዜና ዘገባዎች ብዙ አንባቢዎችን ሊያገኙብዎ እና ስምዎን ለማስተዋወቅ ይረዳዎታል.
Why there are so many castes and human beings of different colors and physical shapes?	ነገር ግን ይህን ያህል ብዙ ቀለማትን, ምርጫዎች እና ከቆዳ የተለያዩ ባሕርያት ጋር እንዴት ነው የሚመርጡት ለምንድን ነው?
Google penalty means that a site is no longer listed on the SERP or the ranking of a targeted set of keywords has dropped dramatically.	ቅጣት ማለት ጣቢያዎ ከእንግዲህ በፍለጋ ውጤቶች ውስጥ ሙሉ በሙሉ አልተዘረዘረም ወይም ገጾችዎ በተወሰኑ ቁልፍ ቃላት ላይ ደረጃ አሰጣጥ በከፍተኛ ሁኔታ ቀንሰዋል ማለት ነው ።
3 separating the two sides.	3 - ሁለቱን መዳፎችን ማበስ።
I don't read too much about the Elves, but have	ብዙውን ጊዜ በብሎጎች ላይ ልጥፍ አላነብም ፣ ግን እመኛለሁ
Prime Minister Dr Abiy on his part shared his gratitude to the Swedish Government for the continued support provided for education, health, water supply, rural roads and integrated rural development.	ጠቅላይ ሚኒስትር ዐቢይ የስዊድን መንግሥት በትምህርት፣ በጤና፣ በውኃ አቅርቦት፣ በገጠር መንገድ ግንባታ እና በተቀናጀ የገጠር ልማት በኩል ለሚያደርገው ድጋፍ ምስጋና አቅርበዋል።
But when he is finished, you have a great hug.	ነገር ግን ስታደዩሙ ሲጠናቀቅ ጥሩ አቅም አለው።
I have discussed the issue with the Irish Taoiseach.	በነገራችን ላይ በዚህ ጉዳይ ላይ ከኤርትራ መንግስት ጋር ተነጋግሪያለሁ።
These time limitations are set forth in the rules and statutes governing lawsuits.	የእነዚህ አተገባበር ደንቦች ለህጋዊነት ስሌት ከተቀመጠው መስፈርቶች እና ድንጋጌ ውስጥም ውስጥ ይገኛሉ.
And I guess there is one more.	ሌላው ተጨማሪ ይመስለኛል።
The second adaptation of Ian Fleming's James Bond adventures is coming soon	የቶማስ ጄን አስቂኝ መጽሐፍ ‹ሊካን› በቅርቡ ይመጣል
But Indian consumers are not yet fully aware of the green technology products.	ሆኖም የቻይና ሊቲየም ኢንዱስትሪ የሊቲየም ምርትን ገና ሙሉ በሙሉ ለማሳደግ ገና አልተወሰነም ።
John (Portland) What's going on with Johnny Miller and Tiger Woods?	ዐፄ ዮሐንስ እና የትግራይ ብሔርተኞች ምንና ምን ናቸው?
The two brothers were examined regarding their mo	ሁለቱ ወንድሞቹ በህክምና ተመር
Differential pressure flow meters are commonly used for this purpose.	በአብዛኛው, የተለያዩ የመሸጫ ቁሳቁሶች ለዚህ አላማ ጥቅም ላይ ይውላሉ.
"I mean church members, family, friends, and people at work are constantly telling me, ""You look good."""	ቤተሰቤ ፣ ጓደኞቼ እና በአካባቢዬ ያሉ ሰዎች 'ተጫወት ፣ አቅሙ አለህ' እያሉኝ ነው።
25 in the new portion.	በአዲሶቹ የ 25.
"""We chose an area for the berries where we hope they will flourish."	ከዚያ ይመጣሉ ብለን ተስፋ የምናደርጋቸውን ባህሪዎች እንመርጣለን ።
As mentioned only received what I asked for.	ብቻ ላዬው የፈቀድኩት ትልም ነበራቸው።
One of many lines takes away the condensate along with the other one produces the energy.	ልዩነታቸው አንዱ ሳንባን፣ ሌላው ነርቭን ከጥቅም ውጭ ያደርጋሉ።
What is counted loss in the eyes of the world is, for us, salvation.	በሰው ፊት ኪሳራ የሆነው ነገር ለእኛ መዳን ነው።
In this respect, it is similar to Aeroxchange.	እዚህ ላይ ከኤርፖርት ጋር የሚመሳሰል ፍተሻ አለ።
There is a way to manipulate the blessing in such a way that the anarchy guy will always ends with witch's blessing.	ለማሻሻያ የሚሆን ሐሳብ አለዎት?
It looks like the ball is still in play.	ገና ጨዋታ በእግር ኳስ የተተካ ይመስላል።
Subdivision D - Matters relating to the making of each set of rules	ጉዳዮች _ 1 ዲ ራስ-ሰር ክፍሎች
We are expecting a great harvest in the future.	ለወደፊቱ ብዙ ፍሬዎችን እንጠብቃለን።
the Japanese were entrenched.	ጃፓናዊያን ተጨነቁ።
04 and Ubuntu.	04 እና Ubuntu ተዋረድዎች።
today to move it up, and drink them to death...	ዛሬ እንዲያው እንጠጣው እንጂ...ቱፍ ቱፍ.
Key issues facing businesses today in terms of con...	በዛሬው ጊዜ ለሚዲያ ኩባንያዎች ዋናው ጉዳይ በግዳጅ...
Experts say they can be affected by what they see and hear.	አንዳንዶች የሚያዩትን እና የሚሰሙትን ነገር ምትሐት ነው ይላሉ።
To ensure the safety and well-being of members of the University community or preservation of university property;	የኮሌጁን የትምህርት መሳሪያዎችን እና ሌሎችንም ንብረቶች በጥንቃቄ የመያዝ እና በአግባቡ የመጠቀም፣ የክፍሎችን ንጽህና የመቀመጫዎችን ደህንነት የመጠበቅ፤
Bruce is fearful of humans, but not aggressive in any way.	ጆን እንደ ፍርሃት ሆኖ ይመጣል ፣ ግን እብሪተኛ አይደለም ።
and 25 (c) of the Bill of Rights Act13, and the inconsistencies could not be justified under	93 (4) (ሐ) መሰረት ሊታገዱ የማይችሉ የሕገ መንግስት ድንጋጌዎችን እና
Although the movie throws light on what you will do and fulfil before you die, I wanted	በድንጋጤ የምትለውና የምታደርገው ቢጠፋትም ወዲያውኑ
A Google Hangouts chat can have up to 150 individuals, but only 25 people can be at a video conference at the same time.	ቻት ውስጥ እስከ 150 ሰዎች ይፈቀዳል፣ የቪዲዮ ጥሪዎች ግን በአንድ ጥሪ 25 ሰው ብቻ ይፈቀዳል።
A local family is dropping its case against the makers of a controversial guardrail, which they say caused their son's death.	የብዙ ቤተሰብ አስተዳዳሪ መሆናቸውን የገለፁት እናቷ፤ በልጃቸው ላይ ተፈፀመ በተባለው ወንጀል እጅግ መጐዳታቸውን ይናገራሉ።
(For instance, is it mailed to you?	(ለምሳሌ ያህል፣ አሳቢ ነህ?
Let the peoples praise You, O God;...	ሕዝቦች ሆይ፣ ያህን አወድሱ!
Chris provided an overview of recent news with the potential to be of concern to trustees;	ሊከሰት እንደሚችል ስለተገመተው አደጋ ዝርዝር መረጃ አድማጮችን ያዘጋጃል፤
Don't worry, there's only one question.	አልደናገጥኩም ጥያቄ ብቻ ነው ።
Beschreibung: Aquinas on passions and diminished responsibility	መዓት ልቀቂበት፥ጭንቀት ከራስምታት
The Smoothies was very good, I love it.	አሻንጉሊቱ በጣም ጥሩ ነው ፣ ወደድኩት ።
In 2018 he transitioned to Travelers Europe to develop the company's standalone cyber proposition.	የተሰኘውን ድርጅት በተሻለ ሁኔታ ለመወዳደር በማሰብ የአውሮፓውን አነስተኛ የንግድ ሥራ መድረክ iZettle ን በ 2018 ገዝቷል።
Isaiah 8:6 Forasmuch as this people hath ...	ኢሳ 8:6 - ይህ ሕዝብ በቀ .
AppGallery has concentrated its efforts on working with developers on both a local and global scale to bring the most relevant apps to users, boosting the number of developers working with the platform and delivering more choices to consumers worldwide.	AppGallery በጣም ተገቢ የሆኑ መተግበሪያዎችን ለተጠቃሚዎች ለማምጣት በአካባቢያዊም ሆነ በዓለም አቀፍ ደረጃ ከገንቢዎች ጋር በመስራት ጥረቱን አተኩሯል ፣ ከመድረክ ጋር የሚሰሩ የገንቢዎች ቁጥርን ከፍ በማድረግ እና በዓለም ዙሪያ ተጨማሪ ምርጫዎችን ለተጠቃሚዎች በማድረስ ላይ አተኩሯል ።
To Obed-edom fell the south side, and to his sons the storehouse.	ለዖቤድኤዶም በደቡብ በኩል፥ ለልጆቹም ለዕቃ ቤቱ ዕጣ ወጣ።
"""and then he said, 'no one has more respect for women than I do'"""	‹ምክንያቱም ከዚሀ በፊት ማንኛውም ሰው ስለሴቶች ከሚያስበው ያለፈ በድርጊት የፈጸምኩት ነገር ስለሌለ ነው› አለኝ።
How long since it was cleaned/replaced?	አገልግሎቱ የተቋረጠው ለምን ያህል ጊዜ ነው/ነበር?
A very happy birthday to Eliot.	መልካም ልደት ማቲዮስ.
Performed by Allure, featuring NAS.	በከበረው ፡ መንፈስ ፡ ጐብኛት ፡ አገራችንን
It's something holy.	ቅዱስ ነገር ነው።
Be in control of our emotions.	ስሜታችን እንቆጣጠር.
Being invited to speak at Boston University.	በቶሮንቶ ዩኒቨርሲቲ ለመወያየት ይቀላቀሉ.
How did Queen Anne's lace get its name and Where does the term Queen Anne's lace come from?	ስምዖን የአያት ስም የመጣው ከየት ነው?
No Confrontation what, our format believes the Christian, to not look of you one-of-a-kind.	የእርስዎ ግኝቶች, የእርስዎ አስተያየት, ክርስቲያን እንደ ወደርስዎ እርስዎን ለመጠበቅ አይችልም.
Now is running like a new one.	አሁን ግን እንደ አዲስ እየቀጠለ ነው።
8 So he arose and ate and drank, and went in the strength of that food forty days and forty nights to Horeb, the mountain of God.	8፤ ተነሥቶም በላ ጠጣም፤ በዚያም ምግብ ኃይል እስከ እግዚአብሔር ተራራ እስከ ኮሬብ ድረስ አርባ ቀንና አርባ ሌሊት ሄደ።
I worked with Azeem in the past on his charity in Bosnia.	ምሕረት አስቻለው
Why is this animal non-releasable?	ይህን አውሬ ለምንድን ነው የማይደፉት?
The reading of all good books is sort of a conversation with the finest minds of past centuries.	ሁሉንም ጥሩ መጻሕፍት ማንበብ ባለፉት ምዕተ ዓመታት ውስጥ ካሉ ምርጥ አእምሮዎች ጋር እንደ ውይይት ነው ።
And finally, in addition to all this there is also a poster inviting you to be an Estonian citizen.	እና በመጨረሻም ፣ ከዚህ ሁሉ በተጨማሪ የኢስቶኒያ ዜጋ እንድትሆን የሚጋብዝ ፖስተር አለ።
For that to happen, though, the following hopes will have to be fulfilled.	ይህ እውን ሊሆን እንዲቻለው ግን የሚከተሉት ቁምነገሮች መሟላት አለባቸው።
where they are in plenty.	ብዛታቸው የትና የት ነው።
You can see it at night.	ማታ ታየዋለህ።
We may vary this agreement by 1 month's notice to you.	ይህን አድራሻም ውድድሩ አንድ ወር ሲቀረው የምናሳውቅ ይሆናል።
What he said to us will always be remembered.	በማለት የተናገሩኝ ቃል ዘወትር ይታወሰኛል።
Homosexuality has an ancient history in India.	በጥንታዊት ሕንድ አንድ የሚነገር ታሪክ አለ።
Pretty much all the same new features of iOS 14	ሁሉም አዲስ ባህሪያት በ iOS 14
It's all just a couple bucks each!	ይሄ ሁሉ በሁለት ቢራ ብቻ ነው!
