"""Today is the day when Britain steps back from the brink, when we confront the bills from..."	እቺ ቀን እንግሊዞች የአበሻ እጅ ሊይዙ መቅደላ ጫፍ ላይ ወጥተዉ አፍረዉ የተመለሱባት ቀን ናት...
Your dream is still alive.	ሕልምህ ሕያው ነው።
'The creative energy that called the worlds into existence is in the word of God.	"""አለማትን ካለመኖር ወደ መኖር የጠራቸው በእግዚአብሔር ቃል ውስጥ ያለው የመፍጠር ሀይል ነው።"
Which leads me onto the next step...	ወደ ቀጣዩ ነጥቤ የሚያደርሰኝ...
While they seem to shy away from direct engagement, I admire their staying power.	የባህል አስተዋጽኦዎን ለማንቋሸሽ ሳልፈልግ ብቸኛውን ምልከታ አጥብቄ እቆያለሁ ።
them to read and write	ያንብቡ እና ይጻፉ
We have a constitution which clearly stipulates a parliamentary term of 6 years.	ስለዚህም ሕገመንግሥቱ በአምስት ዓመት ይደረጋል በሚል ያስቀመጠው ግልጽ ድንጋጌ ነው።
If you do not currently hold a license in ID, CompHealth's licensing team can help you with the processing and application.	በአሁኑ ወቅት የአካል ብቃት እንቅስቃሴ ካላደረጉ በቴላ የሚገኙ ባለሙያዎች የአካል ብቃትዎን ይገመግማሉ እና ብጁ እንዲያደርጉ ያግዙዎታል.
"""We are in the process of concluding our third viticulture certification series and can soon begin accepting applications for the next one."""	‹‹ሆኖም አሁን ሁለት አይነት ክትባቶችን እየሰጠን ነው፤ ሦስተኛውንም የክትባት አይነት በቅርቡ መስጠት እንጀምራለን›› ብለዋል።
Ulysses as an old man, in his bed,	ኡጁሉ ፈራ, ሚስተር ጌታቸው, አልጋነሽ አልቴ,
Vienna, engaged in a conversation	← ቅድሚያ የሚሰጡዋቸውን ይገናኛሉ _ የሚሰጡዋቸውን ውይይት
Handmade of 100% New Zealand Wool pile.	ቁሳቁስ100% ኒው ቀናኒላንድ Wool ፣ ወይም ብጁ
using the latest technology, there will be no smell to annoy the inhabitants of	በቅርብ ጊዜ ያልተነበበ መልእክት አሳይ የሰው ልጅ ሙቀት መታጠብ ካለበት ምንም ለውጥ የለውም
He'd been arrested several times in the past and released.	ቀደም ሲል ብዙ ጊዜ ታስሮ ተፈታ።
This is the Kingdom which will surpass all kingdoms, and which will remain forever.	ይህ መንግሥት ሁሉንም መንግሥታት ያጠፋና ለዘላለም ጸንቶ ይኖራል።
What's your message to Lola Luscious	ለሉላ ሎፔዝ መልስ ይስጡ
It's essential that you use what you were taught.	የተማራችሁትንም መከለስ ተገቢ ነው።
Barata, former owner of the jewelry store	ከ፡ ቀድሞው የሳጥንህ ባለቤት
Although I didn't purchase everything on her list, I did end up ordering many of her suggestions.	ይድረሰው አይድረሰው ባላውቅም በርካታ ደብዳቤዎችን ፅፌለት ሁሉ ነበር።
The Bengal Sultanate was one of the major Islamic states established after the Muslim conquest of the Indian subcontinent.	ሳኡዲ አረቢያ የቀንደኛ የዋሀቢ እስላማዊ አክራሪ እምነት ተከታዮች ዋነኛ ሀገር ናት።
And then it hits you - it's the 'snap-snap' of someone's flip-flops chipping away at your sanity.	እሷ፡- እንሳደብ ካልክስ- ስድብ ባንተ ይብሳል
most of all, your people.	ከምንም በላይ ሕዝቧ እንጂ.
fellows have never even heard his name.	ተከታዮቹም ስሙን እንኳ ሲጠሩ አይሰሙም ።
Kenya and Ethiopia are not really known for their large water reserves.	ኬኒያና ኢትየጵያ ግዙፍ የትስስር ፕሮጀክቶቻቸውን እውን ማድረግ አልቻሉም
acts as translator, not only of language but also of culture.	የተፃፈበት ቋንቋ ቋንቋ ብቻ ሳይሆን ባህልም ሆኗል።
"""That is not the way it was."""	"""ፈልጌ አይደለም እንደዚህ የሆንኩት ."""
Click here for more details. - Dues: $70/year.	እዚህ ላይ, ተጨማሪ መረጃ / በወር $ 2.
Now that we are at the end of our first two 'short' weeks of school, the students and staff are beginning to get used to our new building, and it feels as though the academic year has started in earnest!	ወደ አዲሱ የትምህርት ዓመት ወደ ሁለት ሳምንት የምንገባ ሲሆን ተማሪዎቻችን እና ሰራተኞቻችን ወደ ትምህርት አሰጣጥ ልምዶች እየሰፈሩ ናቸው ።
"""Why 'withering' of local news landscape is dangerous for democracy."""	"""የእኔ እዚሀ አገር 'እስካሁን' መኖር ሰበር ዜና የሆነበት ምክንያት ለምንድነው?"
According to The Shelton Group, 90 percent of millennials say they're willing to purchase from a brand when they trust that company's social and environmental habits.	እንደ ሸማቾቹ ገለፃ ፣ 90% የሚሆኑት ሸማቹ የምርት ስሙ ጥቅሞችን የሚያስገኝ ከሆነ የባህሪይ መረጃዎቻቸውን ለማጋራት ፈቃደኛ ናቸው ።
I know he is learning.	ማስተማር መማር መሆኑን አውቃለሁ።
There was NO light today.	ዛሬም መብራት የለም።
The performance was an important step toward the recovery of an ailing man whom Arturo...	አቶ ጌታቸው ረዳ የሸገር ካፌ ቆይታ ....
The Hidden Truth on Physic Theory The trouble with this [...]	The Theory of Moral Sentiments በተባለ ስራው ውስጥ የተሰጠው ሰፊ ማብራሪያ ለዚህ ዓይነቱ የአረዳድ ስህተት [...]
What did I have to lose!	ምን ላድርግ ጠፋችብኝ እኮ!
but I did not spend more than a week here.	እዚህ ግን ከሳምንት በላይ አልቆዩም።
I wanted to get more done on my Southern Cross next.	ከዛ በኋላ ደቡብ ፖሊስ ላይ የተሻለ ነገር ሰርቻለሁ።
Preparation: My bosom friend, Rana was born in a village.	ቄስ በሪሁን እባላለሁ ተወልጄ ያደኩት ወሎ ክፍለ ሀገር ነው ።
Of course, a nosy neighbor took it upon themselves to inform the police.	ከንቲባው አንድ ጎብ visitor ፖሊሶቹን ይዘውት እንዲወስዱት ዛተው ።
I lay in my bed I don't sleep a wink	አርፌ እንዳልተኛ አይመች አልጋዬ
has given other directions.	ቀጣይ አቅጣጫዎችንም አስቀምጧል።
Another important aspect of content is its length, some people believe that the future of content marketing depends on more concise content.	በውስጡ ሌሎች ገጽታዎች መካከል, ብዙዎች ግን ጨምሯል የፋይል መጠን ድጋፍ የሚሰጥ መሆኑን እውነታ ጋር ደስ ናቸው.
So do we believe in a God who cannot or will not prevent our suffering?	21|43|ለእነሱ ከእኛ ሌላ የምትከላከልላቸው አማልክት አለቻቸውን ነፍሶቻቸውን መርዳትን አይችሉም።
"""It makes me a whore!"""	"""ጦጣ ነው እኮ ያስመሰልከኝ!"
This shows that they were losing public support.	ድጋፍ ማጣታቸውን በግልፅ ያሳያል።
The first option would be to use your bank's Billpay or other bill payment options.	ዲ ባንክ ወይ የባንክ ፍላጎቶቻችሁን አማራጭ እናቀርባለን ።
We're establishing authority.	አንድ ሥልጣኔ እናሳድጋለን.
You fashioned us from the depths of the earth and bid us to follow your gospel call in the company of the Church.	በእርስዎ ፀልት ዎቹ ውስጥ አስታውሰኝ
"For the Jew the daily prayer is: ""Hear, O Israel: The Lord our God is one Lord: And thou shalt love the Lord thy God with all thine heart, and with all thy soul, and with all thy might."""	ኢየሱስም መልሶ እንዲህ አለው፦ ከትእዛዛቱ ሁሉ ፊተኛይቱ፦ እስራኤል ሆይ፣ስማ፤ጌታ አምላካችን አንድ ጌታ ነው፣አንተም በፍጹም ልብህ በፍጹምም ነፍስህ በፍጹምም አሳብህ በፍጹምም ኃይልህ ጌታ አምላክህን ውደድ የምትል ናት።
The Kid likes walking the dog.	ውሻዎ መራመድ ይወዳል.
"After that, I just let it go and do what I was supposed to."""	እኔ ይህንን ለሠራው ወዳጄ ብቻ አስተላልፌያለሁ
"and not appeasement."""	"ግን አብዮተኛ"" አይደለም።"
The brain, spinal cord and nerves, as well as muscles, ligaments, and tendons are seen much more clearly with MRI than with regular x-rays and CT.	አንጎል ፣ የአከርካሪ ገመድ እና ነርቮች ፣ እንዲሁም ጡንቻዎች ፣ ጅማቶች እና ጅማቶች ከመደበኛ ኤክስሬይ እና ከሲቲ ይልቅ ከኤምአርአይ ጋር በግልጽ ይታያሉ።
Height 172 is not too short.	3272 ነገር ስብስብ አይደለም።
We would like to thank everyone for voting us the #1 Family Attraction and the Best Place to Host a Birthday Party!	PrankDial በመምረጥ እና በዓለም ዙሪያ እኛን # 1 በጎብኝዎች ጥሪ መተግበሪያ በማድረጉ እናመሰግናለን!
Testing on Tuesday revealed no trace of fuel in the water.	አደጋው የተከሰተው ባለፈው ማክሰኞ ላይ በሀምስኪይፍ መንገድ ላይ ምልክት ባለመደረጉ ነው.
Dating and connecting with other singles isn't just about making a match and then walking away, dangerous it's a journey.	ከሌሎች ነጠላ ሰዎች ጋር መገናኘት እና መገናኘት isn 't ግጥሚያ ስለማድረግ እና ከዚያ መሄድ ብቻ ፣ ጉዞ ነው።
German courts are divided.	ጀርመኖች በተከፋፈለ ሁኔታ ሰለ ጀርመንነት.
I do feel that I got sick because of him.	በእኔ ምክንያት ታመምሽ አሉኝ።
Tor was developed by US Army, but current Tor is developed by the Tor project.	_ ቶር የተገነባው በአሜሪካ ጦር ኃይል ሲሆን አሁን ያለው ቶርም በቶር ፕሮጄክት ተገንብቷል።
I must have impressed cause I was drafted round 15 by the tigers.	በቁሳቁሶች ውስጥ ፣ እኔ አስራ አምስት ዩሮ ነበረኝ መሆን አለበት .
That just happened to be on her parents' property.	ይህ እንግዲህ የሚሆነዉ በወላጆቻቸዉ ንብረት ላይ ነዉ።
New investigators have been hired.	አዳዲስ ተሿሚዎችን መመደባቸው ታወቀ።
A group of strangers can have a thousand contradictory realities.	በሁለት ወንድማማቾች መካከል አንድ ሺ ልዩነት ሊኖር ይችላል።
It's likely your question has already been answered in there.	ምናልባት ጥያቄዎ ቀድሞውኑ እዚያ ተመልሷል ።
I can almost promise you that none of us are smart enough to ask a question that hasn't already been asked and clearly answered over the past 2000 years.	ታድያ አሁን ላይ ሆኜ ከ 2 አሥርት አመታት በፊት የሆነን እና በአግባቡ ያልተገለጠን ነገር እንድህ ነው ማለት አልችልም።
past in which his grandfather killed his own mother and brother, his father	ሚስቱን፣እናቷንና አክስቷን የገደለው ራሱን አጠፋ
I noticed a member of staff following us.	ባለቤቴ አንድ ወጣት ወንድ ልጅ ይከተለን እንደ ነበር አስተዋለች።
Does that then [mean] that issues are to be left open for anyone to do whatever he or she wants to do?	""" እና ""የሚፈለገውን ለውጥ ያመጣል ወይስ አያመጣም?"
Do business with the supply chain Get in front of savvy prosumers and the press	ሲ ፕሮስፔክ እና ፕሮ ተጋዳላይ ቪታ ቮን ስታር ጋር
Second only to Rapture's Delight.	አዲስ ደንበኞች ብቻ
Seems to me to be needing a similar solution.	ተመሳሳይ መፍትሔ ለመርካቶ ያስፈልጋል።
In accordance with Class 1	ለክፍል 1 ይመዝገቡ
"""What you took was freely given."	'በነጻ የተቀበላችሁትን በነጻ ስጡ።
Really enjoyed it (if that is the right word for it) the book, it opened my eyes.	መጽሐፉ የተቀረፀው እና ለእኔ እና ለአዘጋጁ የኔ ማስረጃዎች ተዘጋጅቶ ነበር.
The cybersecurity consulting firm was created by former members of Israel's 8200 unit.	9 ኣክራሪዎች የሁቱ ጀነራሎች ስልጣን ተቆጣጠሩት800 000ህዝብ ተፈጁ።
"and yelled again, ""Up!"""	"በድጋሚ አንኳኳሁ ""ይግቡ!"
effects of the influenza virus.	የዕፅ ቫይረስ ተፅዕኖዎች.
It's time to get excited about the 2017-18 basketball season!	ወቅቱ 2016/2017 ውስጥ እውነተኛ የእግር ኳስ ጀግና ሁን!
"""I'm ready for to fade into my own parade."""	ከፍዬ ልሂድ መርካቶ››
MOQ: One piece can be acceptable, no plate-making, lower cost, suitable for the small quantity.	MOQ: ምንም MOQ አይገደብም ፣ የበለጠ ብዛት ፣ የተሻለ ዋጋ
I'll put it on our list of destinations!	ወደ የእኛ የአድራሻ ዝርዝር ይመዝገቡ!
he/she/it does recreation	休 /ሥዩ/ እረፍት
But once he becomes part of the in crowd, he seems to forget all about his old friends.	ጥቂት ቆይቶ ወደስራው ሲመለስ ግን ሁሉን ረስቶ ከብዙዎች ሲጫወት ይውላል።
We are to serve God and HIM alone.	እግዚአብሔርን እናገለግላለን እና እርሱን ብቻ እናከብረዋለን ።
and don't forget not 100% accurate.	እናም 100% አትበሳጩ።
There are very bad things and people you meet could have dire consequences for you.	በጣም መጥፎ ነገሮች አሉ እና በአካባቢያቸው ውስጥ ያሉ ሰዎች ለእርስዎ ከባድ ውጤት ሊያስከትሉ ይችላሉ.
in bed with the widow of	መኝታ ከአልጋ ጋር
Reba was red in the face to match her hair color as the waitress arrived with a smile and began to set their food in front of them...	ጂጂ ሴሮጥ ቆይቶ ቁጭ እንዳለ ህጻን እያለከለከችና እንደመሳቅ እያለች የገጠማትን ትተርክላት ጀመር...
But they are now independent states.	አሁን ግን የማንክደው ሉዕላዊ አገር ናቸው።
We've got to:	እኛ አለባቸው:
I do not believe that anyone should be prevented or prohibited from making his or her own choices about reproduction.	በነገራችን ላይ ማንም ሰው ቢሆን የራስን እድል በራስ የመወሰን መብትን መጋፋት ወይም መቃወም አለበት ብዬ አላምንም።
Tracking them down by their drumming is the usual approach.	መጋረጃ ኋላ ሆኖ መዘወር ነው ዘዴአቸው።
Places to visit in Loire-Atlantique (44)	አካባቢ ሎየር-አትላንቲክ (44)
Stone is well known for his contribution to music sector, particularly for the choice rock and grunge genres.	ስቶን ለሙዚቃ ኢንዱስትሪ ባበረከተው አስተዋፅዖ የሚታወቅ ነው ፣ በተለይም በአማራጭ የሮክ እና ግራንጅ ዘውጎች ።
If you are a daughter in-law, please share your experience with us.	ነባር የ MidPhase ደንበኛ ከሆኑ እባክዎ ተሞክሮዎን ለእኛ ያካፍሉን.
We have appointed a law and a practice for every one of you.	ከእናንተ ለሁሉም ሕግንና መንገድን አደረግን።
evening, and the time has come at length when the shadow must fall.	ቀኑ መሽቶአልና፥ የማታውም ጥላ ረዝሞአልና ወዮልን።
I'm someone who wants change.	ለውጥ ያስፈልጋል ከሚሉ ሰዎች አንዱ ነኝ።
lightenment of the mind.	የአእምሮ ብርሃን።
In the city I saw people with different skin color than mine for the first time.	የክልሉን ነዋሪዎች ለመጀመሪያ ጊዜ ሣገኛቸው ከሚነገረኝ በላይ ፍቅራቸው ትኩረቴን ሣበው።
Satan did not try to make our Lord sin in the wilderness.	ሰይጣን በስስት ጌታችን ፈትኖ ድል ቢደረግም ተስፋ ሳይቆርጥ እንዲህ እያለ በትዕቢት ይፈትነው ጀመር።
Originally it was sold under the Depo-Testosterone name and is still popular with the same name.	ከመጀመሪያው በ Depo-Testosterone ስም ስር የተሸጠ ሲሆን አሁንም በተመሳሳይ ስም ይታወቃል.
Talk to other business owners or financial advisors about their experiences.	ከእራስዎ ሁኔታ ጋር ለሚዛመዱ ጥያቄዎች እባክዎ የገንዘብ አማካሪዎን ወይም የገቢዎችን መምሪያ ያነጋግሩ።
In many questions, two or three choices might be correct.	ምክንያቱም ሁለት ወይም ሶስት መልሶችም ትክክለኛ ሊሆኑ ይችላሉና።
Org. of Prog.	"^ ወይም ""ጥቅም።"
Get a thorough examination.	ጉዳዩን በጥንቃቄ መመርመር።
Our various home loan products are tailored to fulfill all your needs in the best possible way.	የእኛ የተለያዩ የእርሻ ሰንሰለቶች በተቻለ መጠን ሁሉንም ዓይነት ፍላጎቶች ለማስማማት ይገኛሉ ።
E When the application is lodged, the opposing party is summoned to file its opposition within 15 days.	ም ጥያቄ አቅርበው ተቃውሞ ያላቸው አካላት በ15 ቀናት ውስጥ እንዲያሳውቁ ይጠየቃል።
What kind of feature film are you trying to make in Hong Kong?	በኢትዮጵያ ትኩረት አድርገህ ልትሰራበት ያሰብከው የትኛውን የሙዚቃ ዘርፍ ነው?
And given that the reward is a happy life with her, I'm guessing you'll be happy being her best friend.	እና ሽልማቱ ከእሷ ጋር ደስተኛ ሕይወት እንደሆነ ከተሰጠኝ ፣ የቅርብ ጓደኛዋ በመሆኗ ደስተኛ እንደምትሆን እገምታለሁ።
The sailors were afraid.	መርከበኞቹም ፈሩ።
Ever since, it has developed to one of the world's leading companies for machine tools, lasers and electronics for industrial applications.	ከዚያን ጊዜ ጀምሮ በዓለም ላይ ከፍተኛ ጥራት ያላቸውን የኢንዱስትሪ መብራቶችን ፣ የሱቅ መብራቶችን እና ማጉያዎችን ለማምረት መሪ-ቴክኖሎጂን ይጠቀማል ።
Hoping that you'll do the same	አንተም ተመሳሳይ ነገር ታደርጋለህ ብዬ ተስፋ አደርጋለሁ
One of my favorite passages is Joshua 5:13-14.	ለዚህ የጠቀሰው ኢያሱ 5:13-14 ን ነው፤
We have about one thousand political prisoners inside the country.	በሀገሪቱ ውስጥ በሺዎች የሚቆጠሩ የፖለቲካ እስረኞች አሉ።
Secondly, since stories are live for only twenty-four hours, one gets to view fresh content every day.	አንዳንድ ብቻ ነው ውጭ ለ 24 ሰዓታት ስላልሆኑ, አዲስ ቅናሾች በየቀኑ ይመልከቱ የተሻለ ነው.
on whomsoever I lay hands, he may receive the Holy Ghost.	19 እጄን የምጭንበት ሁሉ መንፈስ ቅዱስን ይቀበል ዘንድ ለእኔ
His parents were unable to teach him.	ወላጆቹ እሱን ለማስተማር አቅሙ ነበራቸው።
Y = Multiple languages are supported.	★ በርካታ ቋንቋዎች የሚደገፉ
In High School, one of the popular boys asked me out on a date one night.	ፈለቀ ማሩ (ክፍል አንድ) አንድ ወዳጄ ያለ ወትሮው ከአዘቦት ቀናቶች ውስጥ በአንዱ ደወለልኝ።
"A five-minute ""pitch"""	"""አምስት ደቂቃዎች"" ፖም"
Once you've received the complaint, don't apologize.	ፎቶግራፉ ብታነሳውም፤ ይቅርታ ግን አልጠየቀቺም።
That is why they are so friendly to foreigners.	ለእነሱ የውጭ ዜጎች ናቸው በጣም ርካሽ ስለሆነ.
It is a structured and organized subject.	በተቀናጀና በተደራጀ መልኩ የሚመራ ነው።
What it feels like: Amazing.	አይነት: አስገራሚ
it was written long ago in the laws, after the first king.	ከዛ በፊት በንጉሱ ግዜ ቀደም ብሎ እንደተባለው ብዙ ነገር የተጀመረበት ነበር።
She says she saw a man who lived in home pull a burning mattress out of the house.	ቢባል፤ ልብስ አጥታ እቤት የቀረችውን ባየህ አለ
It seats six people, including the pilot.	ተመራማሪውን ጨምሮ የስድስት ባለሙያዎችን ተሳትፎ ይጠይቃል።
17 If her father utterly refuses to give her to him, he shall PAY MONEY according to the bride-price of virgins.	+ 17 የልጅቷ አባት ልጁን ለእሱ ለመስጠት ፈጽሞ ፈቃደኛ ሳይሆን ቢቀር ይህ ሰው ለደናግል የሚከፈለውን የማጫ ዋጋ መክፈል አለበት።
It is known as the Peacock Island.	ይህ የአበባው ደሴት በመባል ይታወቃል.
He's got decades more political experience than her, and a much better track record.	ሆኖም ፣ ከእርሷ የበለጠ ከእርሷ መስክ በ 10 ዓመታት ውስጥ የበለጠ ልምድ ይኖርዎታል እናም የላቀ ድግሪም አለዎት ።
You may not have discovered these advantages.	በእርግጥ እነዚህን ፈቃዶች አጋጥመውዎት ይሆናል ።
The team committed only one error in the game.	በጨዋታው አንድ ስህተት ብቻ ነው የፈጸመው።
Gold is among the substances in the world.	ስንዴ ከዓለም ዋነኞቹ ሰብሎች ውስጥ አንዱ ነው.
As a result, you are getting to get yourself a paper.	እንዲያውም እናንተ እ/ር ይስጣችሁ ወረቀት ነው ያመጣችሁት።
"""He Himself bore our sins in His body on the cross, so that we might die to sin and live to righteousness."""	"""ለኃጢአት ሞተን ለጽድቅ እንድንኖር እርሱ ራሱ በሥጋው ኃጢአታችንን በእንጨት መስቀል ላይ ተሸከመ።"
There are many reasons why the snake may truly be called a symbol of wisdom.	እባቡ በእውነቱ የጥበብ ምልክት ተብሎ የሚጠራባቸው ብዙ ምክንያቶች አሉ።
Our children are gifts from God, we are responsible for their care and we need to nurture them.	ልጆች የእግዚአብሔር ርስት ናቸው ፣ በልጆቻችን ልንኮራ ፣ ልንደግፋቸው እንዲሁም ለእነሱም መጸለይ አለብን ።
Perhaps it's time we started thinking hard about the relationship of our species to the rest of the planet.	የሕይወታችንን ዝርዝር ትንተና ለማካሄድና ከዚህ ፕላኔት ሌሎች ባለድርሻ አካላት ጋር የሚስማሙ ሚዛን ለመፍጠር ጊዜው አሁን መሆኑን አይተናል።
I don't even know those judges.	እኔ ደግሞ በጊዜው እነዚህን ዳኞች አላቃቸውም።
Their journal tells us that they came to live closely with the Aquanauts.	አንዳርጋቸው ለመለስ ዜናዊ የቅርብ ሰው እንደነበር ይሰማ ነበር።
But the Father was always with Him.	አባቱ ሁልጊዜ ከእሱ ጋር ነበር.
Political or campaign-related letters are limited to 150 words.	ነገር ግን, የፅሁፍ ትርጉምን ወይም የድረ-ገጹን ቃላት ወደ የ 150 ቃላት ይገድባል.
To those who did accept him he gave power to become children of God...	ደግሞም ልጁን ስለእነሱ የሰጠው እግዚአብሔር ፣ እግዚአብሔርን የሚመርጡትን የዲያብሎስ ልጆች ሆነው ለመቆየት ያላቸውን አስከፊ ውሳኔ በቀላሉ ይቀበላል ።
"""Its user interface (UI) can be improved."	fone - ማስተላለፊያ (iOS) የተሻለ ሆኖ ሊታይ ይችላል.
Those who don't should be allowed options according to their light.	ልክ እናንተ እይታዎች ውስጥ ማስገባት አማራጮች የማያወጣው ማን.
"Adam replied, ""This is the bone of my bones and the flesh of my flesh."	አዳምም እንዲህ አለ፤ 'እነሆ፤ ይህች ዐጥንት ከዐጥንቴ፤ ሥጋም ከሥጋዬ ናት።
I'll always remember you for how badly you treated me - Letter To My Ex	ባጣሁት ስቸገር - ባለኝ ሰው አ'ረግሽኝ
avaricious ward worker.	የጥበቃ ሠራተኛ አ.
respond to national issues.	ለሀገራዊ ችግሮች መፍትሄ ያስቀምጣል።
But, if it is too heavy, it will become a problem.	ከመጠን ያለፈ ከሆነ ግን ወንጀል ይሆናል።
An velvet is a good to an output from a financial system.	ምግቡን ለመግዛት ከሚገኘው ገቢ በጀት ይመደባል.
I was always one other person.	ብዙውን ጊዜ እኔ ሌላ ሰው ነበርኩ ።
The slang term has become so popular among black Americans that it became fodder for a comedy	አላርፍ ያለች ታት ምናረገች ነው የሚባለው ወያነ ብሎ ብሎ የአሜሪካንን ሰዎች ማሰር ጀመረ
And both are set for public hearings this week.	መንግስት ሁለቱንም ጉዳዮች ለሕዝብ ይፋ ያደረገው በዚህ ሳምንት ነው።
