If one falls into sin, all that is required is sincere repentance seeking God's forgiveness.	በዚህ ኃጢአት ያለ ሰው ንስሀ ሊገባ ከፈቀደ የአግዚአብሔር ምህረት ታገኘዋለች።
It is your responsibility to obtain this information.	ይህንን ለማግኘት ይህንን መረጃ የመምረጥ ኃላፊነት የእርስዎ ነው.
Oh I know about predictions.	አውቃለሁ በፊት ተ በቀዳሚ ግምገማዎች.
When assured that it is a fight to the death, then she will unsheath them.	"""ወደ ሰላም ቢያዘነብሉ ወደ እርሷ አዘንብል።"
If you want to know how to make it and what products to use, continue reading this article.	ይህ መንገድ ምን እንደ ሆነ እና በየትኞቹ ጉዳዮች ላይ እንደሚተገበሩ ለማወቅ ከፈለጉ ይህንን ጽሑፍ ማንበብዎን ይቀጥሉ።
It's like she's hiding the world from me.	ዓለም ከእኔ እንደሚደበቅ.
Unity's Mission Team allocates funds to support ongoing programs.	አገር ቤት በቅራኔ የሚገኙ ቡድኖች ግጭቶቻቸውን እንዲቀጥሉበት ገንዘብ በመላክም ይተባበራሉ።
For people who have doubted me and my ability; watch me.	ጠላቴም ፡ ወዳጄም ፡ ስታስበኝ ፡ አዩ
"This is what Jesus meant in the prayer that He taught us when He said, ""Our Father in heaven, hallowed be Your name."	"ጌታችን አምላካችን መድኃኒታችን ኢየሱስ ክርስቶስ ፥ ጸሎትን ለደቀመዛሙርቱ ባስተማራቸው ጊዜ ፥""አባታችን ሆይ፥ በሰማይ የምትኖር፥ስምህ ይቀደስ፥ መንግሥትህ ትምጣ፤ ፈቃድህ በሰማይ እንደሆነ ሁሉ እንዲሁም በምድር ይሁን፤በሉ።"
There will be time to prepare.	ማዘጋጀት የሚወስደው ጊዜ አለ።
these guerrillas pass this knowledge on to others	ይህንን ድረገፅ ለሌሎች ይላኩ
Well worth a visit and good value at €2.50.	የእርስዎ ጓደኞች Refer እና € 250 እስከ ያግኙ ግምገማ ጉብኝት
Paul was a rare name even among Gentiles.	ጳውሎስ ሌላው ቀርቶ ስም እየጠራ የሚቃወማቸው ሰዎች ነበሩ።
37 And he led out them with silver and gold; and none was sick in the lineages of them.	37 ከወርቅና ከብርም ጋር አወጣቸው፥ በወገናቸውም ውስጥ ደዌ አልነበረም።
"(Col. 1:26) versus ""For there is no respect"	"002""> ያልታሰበበት ማንኛውም ምክንያት >"
I'll fix the language in the post.	ኢስላ ኤል ትግሬ
"""I mean, I'm not going to leave my children,"" Soth assures."	"""ለልጆቼ የማይሆን ተስፋ አልነግራቸውም"" የነፃነቱ ታጋይ አንዳርጋቸው ፅጌ Ja."
Hellebores are more of a gardener's garden flower.	የ የአትክልት ጓደኛ አንድ አትክልት መተግበሪያ በላይ ነው.
Lucy works in a clothes shop.	ሉዊስ በአንድ ምግብ ቤት ውስጥ ይሠራል ።
compassion for all sentient beings	ለሁሉ ምታዝን ርኅርኅት እናት
It has to be relevant to the challenge that is at play.	አሁን እየተደረገ ባለው ሽግግር ውስጥ መሳተፍ መቻል አለበት።
Jesus died to save us.	ኢየሱስ እኛን ለማዳን ሞቶልናል።
It has nothing to do with women and children being below a man.	ይሄ ወንድና ሴት የለውም::ካልንስ በወንድ ይብሳል!
The next morning my mother was gone.	በነጋታው እናቴ ከቤት ጠፍታ ዋለች።
In short term, we can expect the ads to be the driving factor.	ለወደፊት ግን ሪፖርቱ መነሻ ይሆናል ብለን እንጠብቃለን።
We're trying to make them feel safe.	ደህንነት እንዲሰማቸው ለማድረግ እንጥራለን።
is based on facts and truths.	እሱ በተወሰኑ እውነታዎች እና ሁኔታዎች ላይ የተመሠረተ ነው ።
In eight European countries, including Finland, children have to	ኢትዮጵያን ጨምሮ ስምንት አገሮች ዕጩ ተደርገዋል
Both the Pfizer and Moderna vaccines are what's known as messenger RNA (mRNA) vaccines.	የሞደርና ፒፊዘር ክትባቶች መልእክተኛ አር ኤን ኤ (ኤም አር ኤን ኤ) የሚጠቀሙ አዲስ ዓይነት ክትባት ናቸው ።
Do I have ground.	መሬት አለኝ ።
We now turn to the second question: what to do if we cannot fix the current regime.	ሁለተኛው ጥያቄያችን ደግሞ 'ፕሮጀክቱ ባይስማማን እንዴት አድርገን ነው መውጣት የምንችለው?
No one will go with me, they are all whimps.	እንዲሁም ከእኔ ጋር ሁሉ መሰብሰብ አይደለም, የማያከማች ይበትናል.
People report that they're getting all sorts of unexpected effects that are changing their lives.	ሰዎች ህይወታቸውን የሚቀይሩ ያልተጠበቁ ውጤቶች እንዳገኙ ሪፖርት ያደርጋሉ.
боюнча 1947 a public meeting in Lancaster endorsed a proposal that there might be a university college established in the city .	ውስጥ 1947 ላንካስተር ውስጥ ሕዝባዊ ስብሰባ በዩኒቨርሲቲ ኮሌጅ በከተማዋ ውስጥ በዚያ ይጸናል ዘንድ አንድ ሀሳብ ደግፎታል.
So I am going to make certain this year that at least once a week I focus on something	ቢያንስ በሳምንት አንድ ቀን ይሄን ቪዲዮ የሰራሁት በአንድ ነገር ተደስቼ ነው።
"""But you can't kill Their spirits."	ነፍሳችሁን ግን መግደል አይቻላቸውም።
and its strongholds will be seized.	ቀስታቸውም ይሰበራል፤
The overall European average is 18%.	ዓለም አቀፍ የስፔንክስ ይዘት 18% ያህል ነው።
The transceiver transmits or receives during dwell time.	ቆይቶ ከግዜ በኋላ የገባበት ወይ የተቀበለው ግዴታ ነው።
Take note of the most important tasks and do those first.	ከዚያም በጣም ወሳኝ የሆኑ ተግባሮችን ኮከብ ያድርጉ, እና በመጀመሪያ እነዚህን ያከናውኑ.
Do not pay taxes?	ግብር መክፈል የለ?
A STAR is BORN!	ኮከብ ተወለደች!
"""We're lagging by ten years."	) መነሻ አድርገን ወደ ኋላ አስር አመት እንቆጥራለን።
Amy was born into show jumping.	አቅልጠው-2 ክፍተቶች
Iran has recently provided the European Commission with reports on the latest measures taken to tackle the problem.	ሪፖርቶች ኢራን በኢኮኖሚዋ ላይ የተጣለውን ማዕቀብ ለመጣስ እየተጠቀመች መሆኗን በቅርብ ጊዜ ይፋ አደረጉ ።
However, in a cyclic process of life-death-rebirth, there are four main types of Bardo, i.e transitional states of consciousness according to some schools in Tibet.	የሰው-የአካባቢ ጥናቶች-ምረቃ ትምህርት ቤት
Some people will resort to anti-inflammatory drugs to solve the problem but in fact, this actually makes the problem worse!	የእንፋሎት ማድረቂያ ማድረቂያ መጠቀም በእርግጥ ችግሩን ያባብሰዋል!
The baby has two type of personalities.	ህፃኑ 2 የልብስ ዓይነቶች አሉት።
Step 7: Let dry for five minutes.	ደረጃ 7 ዱቄቱን ለአምስት ደቂቃዎች ያቁሙ.
Of course, there is no segmentation on the sheets.	በእርግጥ በአባባሎቹ ዘንድ ምንም ጉርብትና የለም።
He'd never be free of his past, and his daughter would never be safe unless he killed every last monster on earth.	ያለ ሚስቱ ሰብለ ፓስተር ከጎኑ ሆና ካልሆነ በባሕር ዳር ሕይወት በፍጹም አይጠናቀቅም።
Always cared for the poor.	ድሆች ሁልጊዜ ችላ ።
She was on the slip for 5 weeks.	በተከታታይ ለ5 ሳምንት ያህል ይደውልላት ነበር።
If the user is registered on Facebook, Facebook may link the user's visit to his account.	ተጠቃሚው በፌስቡክ ገብተው ከሆነ, Facebook የእርሱ Facebook መለያ ለመጎብኘት መመደብ ይችላሉ.
Thank you to the community for support of this work!	ለዚህ ሥራው ለምክር ቤቱ ልዩ ምስጋና አቀርባለሁ!
turned to his home, and Jacob continued his journey.	ከዚህ በኋላ ኤሳው ወደ ቤቱ ተመለሰ፤ ያዕቆብ ደግሞ መንገዱን ቀጠለ።
"Many offenders sent to prison are ""replaced"" on the streets."	ተጠርጥረው›› እየተባለ ወደ እስር ቤት የሚወረወሩት በርካታ ናቸው።
Had we listened to some of these guys we could have planned our community in such a way that pockets of poverty, crime and deterioration would not exist today.	መሪዎቻችንን እንደጋሽ መስፍን ያሉ መጭውን ማስተዋል የሚችሉ ሰዎችን ምክር ቢሰሙ ኖሮ ዛሬ በእንዲህ ዓይነት እጅና እግሩን ባጣ ውድቀት ላይ አንገኝም ነበር።
Of course this doesn't apply in the motorcycle world.	እርግጥ ይህ በዓለም ላይ ለሚገኙ ሁሉም መኪናዎች አይተገበርም.
Previous Previous post: Fall in Love with the All-New 2019 Chevrolet Silverado	Previous: 2019 አዲስ ተወዳጅ ዲዛይን ቢራ የካርቶን ቢን ማሳያ መቆሚያ በመስማማት
There are also specific brands:	በተጨማሪም, የሚከተሉትን መአቀፋዊ ምልክቶችም አሉ-
Model-checking attempts to use fully automatic techniques to prove that a	የምርት አስተማማኝነትን ለማረጋገጥ የሙሉ ማሽን መፈለጊያ መሳሪያ
If you want to make Fried Dumplings, don't add eggs to the batter.	በሾርባ ለመብላት ካቀዱ በፓስታዎ ላይ ዘይት አይጨምሩ።
Guests will then take turns choosing a card and each person has to write a verse of a poem.	ካርድ ጀርባ የተለያዩ ዕቅዶች ይምረጡ እና እያንዳንዱ ካርድ አንድ ግለሰብ ይንኩ መስጠት ♡.
Step 5 - Remain in bed carefully inspecting the blackspots of the night before.	ደረጃ 5 - ምሽት ላይ ነው በፊት Bigfoot ያግኙ.
I believe that if the team name and mascot are sensitive to those who would be offended that it would be OK.	ጐን ለጐን የሚባለውንና የማይባለውን ቢለዩ ጥሩ ይመስለኛል።
The ills of society are being removed,â   he said.	የህብረተሰቡን መጉላላትም ይቀርፋል ብለዋል።
Hebrews 1:1 On many past occasions and in many different ways, God spoke to our fathers through the prophets.	1:1 በብዙ ቦታዎች ላይ እንዲሁም በብዙ መንገዶች, ባለፉት ጊዜያት ውስጥ, እግዚአብሔር በነቢያት አማካይነት ለአባቶቻችን ተናገረ;
The event gave us Pride as we know it today.	ልክ እንደ ዛሬው እንደሰማን በጣም ተነካሁ ።
The outbreak originated in the North district and then spread to the West-Central and South districts.	ስርጭቱ በአገሪቱ ምዕራባዊ ክልል ተወስኖ የነበረ ሲሆን፣ በአሁኑ ወቅት ወደ ሰሜናዊ እና ደቡባዊ የአገሪቱ ክፍሎችም እየተስፋፋ ነው።
A Glimpse into the Power of Forgiveness - Brandi C	መሀሪ ኃይሉ - ትግሬ
In the 1880s, a couple of young boys discovered this fascinating natural wonder.	የተመራማሪዎቹ ቡድን በ 1880 ዎቹ ውስጥ በዚህ ከተማ አካባቢ አንድ እንግዳ ግኝት አደረጉ።
She's previously posted about going out with the express intention of getting gang raped.	መለያ እንዴት እንደሚከፈት
For he had commanded the unclean spirit to come out of the man.	ርኵሱን መንፈስ ከሰውዬው እንዲወጣ ያዘው ነበርና.
best off using local radio stations.	ተወዳጅ የአካባቢው የሬዲዮ ጣቢያ ይልቀቁ.
There are units in the walls, but no remotes.	በይነመረቡ እንዲሁ ድንበሮችን ያጠፋል ፣ ግን ርቀቶች አይደሉም ።
Its students and teachers played a central role in the rise of Bengali nationalism and the independence of Bangladesh.	የቤንጋሊ ቋንቋ እና ሥነ ጽሑፍ በቤንጋል ህዳሴ ግንባታ እና በቤንጋሊ ብሔራዊ ስሜታዊነት እና በባንግላዴሽ ምስረታ ውስጥ በጣም አስፈላጊ ሚና ተጫውተዋል ።
My goodness, it is still as good as ever!	እንደ ሁልጊዜው ጥሩ!
In this case you pay 2.	2 ለዚ አሁን ትከፈላላችሁ?
Do you have a trade fair or other event you would like us to promote and help sell tickets for?	ቲኬቶችን እንድናስተዋውቅ እና እንድንሸጥ እንዲያግዙን የሚፈልጉ የንግድ ትርዒት   ወይም ሌላ ዝግጅት አለዎት?
He had only to bring it to reality.	እሱን ወደ ሕልውና ማምጣት ብቻ አለብዎ.
There is an inscription of the painter on it:	በዚህ ኮርሱ ላይ አንድ ተፎካካሪ:
he was responsible for its entry	መግቢያውን ዘግቶ የጠበቀ
Because love isn't knowledge.	ፍቅር ስሜትም እውቀትም አይደለም።
I'm in the Wash/Balt area.	የቤ/ክ አጸድ ውስጥ እገባለሁ።
The options button is used for a variety of many different tasks on the MetaTrader 4.	በ MetaTrader 4 ብዙ የተለያዩ ደላላዎችን መጠቀም ይቻላል.
20And if he will not redeem the field, or if he have sold the field to another man, it shall not be redeemed any more.	20ዕርሻውን ባይዋጅ ወይም ለሌላ ሰው አሳልፎ ቢሸጥ፣ ከዚያ በኋላ ሊዋጀው አይችልም።
It's incredible having 2 children that have completely separate personalities.	የሚገርመው ነገር ጎሳዎቻቸው ሙሉ በሙሉ የሚለያዩ ሁለት አባቶች አሏት ።
All the big mammals on Earth will soon be extinct.	ሁሉም የቤት ቆሻሻዎችዎ በጣም በቅርብ ጊዜ በክብደት ይሰላሉ።
And thank Thee for all things this day,	ያመስግኑህ ፡ ዛሬ ፡ ያንግሱህ ፡ በዕልልታ
Confessing to God (Psalm 51)	ራስን ለአምላክ መወሰን (መዝሙር 52)
(I know Chelsea is).	(ክሊሼ እኮ ነው!
We were shocked but pleased, and tipped the heck out of him (also, the service was good).	እኛ ምሰሶዎቹ አሉን እና በእሱ ላይ እንበሳጫለን (እንኳን ደስታን እንኳን ፣ እርስዎም አዝነዋል .
It's time that our laws are changed so that these miscreants no longer enjoy unconscionable immunity from prosecution.	እነዚህ መተግበሪያዎች አዘውትረው እርግጠኛ የሆነ ከመጭበርበር ነጻ የጨዋታ ሁኔታ እንዲኖር ለማድረግ ሲሉ መዘመን አለን.
"Derived from a cross between .."""	የመጡት ከአንድ አምራች ነው ፣ .
"""You... have you taken me to the Malleus?"""	እና አንተ ፣ ለፒልኪን ወስደኸኝ ነበር?
While I would be happy for you to include any of the attached information,	በጣም ደስ ብሎኛል ተባረኩ አዳዲስ መረጃዎችን አሁንም ብታቀርቡ በጣም ነዉ ደስ የሚለኝ ፣
Everyone needs to communicate one way or another.	እንዲሁም ፣ እያንዳንዱ ሰው በአንድ ወይም በሌላ መንገድ እንደሚናገር ያስጠነቅቃል።
Yet the devil is still present in the lives of religious Americans.	አቶ ነብዩ በአሜሪካን አገር ኑሯቸውን ቀጥለዋል።
The one who does not honor the Son does not honor the Father who sent him.	ወልድን የማያከብር የላከውን አብን አያከብርም።
What a shame, you hate to see it!	ያንን ሲያዩ ሰው መሆን ይጸየፋል!
helping others to complete their GED.	የእነሱ ተቀጣሪ እንዲሆኑ ለመርዳት እርስዎን መርዳት።
After all, this is a MasterCard.	ለማንኛውም ይህ የአድራሻ ካርዴ ነው።
... 48 I am the bread of life.	48 የሕይወት እንጀራ እኔ ነኝ።
The foam will absorb the water.	ሻማው ውሃውን ይሞቃል.
Following the Civil War, many rural churches sprung up across the South.	ከዚህም ውስጥ በጎጃም ክፍለ ሀገር እየተዘዋወሩ ብዙ አብያተ ክርስቲያናትን ተክለዋል።
China is exhibiting Colonized unity on a global scale. . . .	ክልላዊ አንድነቱን...
Don't listen to the propaganda and lies spewed forth from fanatical cult members.	የፓለቲካ ክስህማ ያው እንደናንተ ግብዞች ከሆኑት ከፈሪሳዊያን የተማራችሁት ስለሆነ አይፈረድብህም።
The surviving family has suffered damages due to their loved one's death.	በህይወት የተረፉት ደግሞ በውድ ልጆቻቸው መሞት የተነሳ በሀዘን እንዲሰቃዩ ሆነዋል።
Tom and Tyler stayed friends for three days.	ዳንኤልና ጓደኞቹ ለ 21 ቀናት ጾመዋል።
Voice of America (VOA) is an international multimedia broadcaster, now in service in more than 40 languages.	com የአሜሪካ ድምፅ (ቪኦኤ) ከአርባ በላይ በሆኑ ቋንቋዎች ከዩናይትድ ስቴትስ በመላው ዓለም የሚያሠራጭ አገልግሎት ነው።
How long will students be able to participate in the test?	ወጣቶች ለምን ያህል ጊዜ ወደ ስፖርት ይሄዳሉ?
Servo Feeders with Straightener is in the short space design were especially developed to meet the needs of customers with not enough space.	ቀጥ ENER SER VO የዝውውር Straightener Servo የመገበ አጭር ቦታ ንድፍ ውስጥ ነው በተለይ በቂ አይደለም ቦታ ጋር ደንበኞችን ፍላጎት ለማሟላት የተገነባ ነበር.
The 2018 session is being hosted by the Indiana Blood Center.	2018 የአትክልት ቢሮ የሥነ ጥበብ ማዕከል ስብሰባ አዳራሽ ተካሄዷል.
Our Team Of Registered Dietitians	የእኛ ዲዛይን ቡድን
"There is the song ""Eliseo,"" who is he?"	"""ዚሊዮን"" ምንድን ነው፣ ""ዚሊየነር""ስ ማነው?"
Remember, we are talking in constant dollars.	በ ውስጥ የአሜሪካ ዶላር ያለማቋረጥ ይዘምናል።
music in Brazil and worldwide.	ሁሉም ጨዋታው በብራዚል ውስጥ እና በዓለም አቀፍ ደረጃ.
She put her hand on the black pearl	እጃችሁን መዳፍ ላይ የመስመር ላይ Blackjack
Co-founder of AfH.	ኤም-ባንድ ከኤፍ.
This suggests that Angel was brought back for good.	የመልአኩ አማላጅነት ተቀባይነት አግኝቷ ማለት ነው።
A killowatt is equal to 1,000 watts.	ኪሎዋት ደግሞ ከ 1000 ዋት ጋር እኩል ነው።
Shingon teachings.	ZOUSAN ትምህርት ትምህርት
33 Never dress down for the poor.	22 ድሀን በግድ አትበለው ድሀ ነውና ችግረኛውንም በበር አትግፋው
One concerned the spelling of proper names, and the other had to do with numbers.	አንዱ የግል ስሞችን ፊደላት መሳት ሲሆን ሌላው ደግሞ የቁጥር ስህተቶችን ማድረጎች ነበሩ።
Jesus told his followers he wanted them to be in the world and not of it.	ኢየሱስ ለተከታዮቹ ሲጸልይ ከዓለም እንድታወጣቸው ሳይሆን እንድትጠብቃቸው ብሎ የለመነው ምን ለማለት ፈልጎ ነው?
The negative manifestations of the number 3 is perfunctoriness.	ተመራጩ ዝንባሌ 3 እርክነ ዝርግነት ነው።
In addition, it is a fantastic method to give rise to the growing cloud of knowledge more info.	በይነመረቡ ከተመረተ ብዙ ዕውቀትን ሊያስገኝ የሚችል አስገራሚ የመረጃ ምንጭ ነው ።
Do you think i could have lost my virginity in the ninth century?	ተስፋዬ በ1990ዎቹ በካድሬነት የመለመለኝ እኔን አምሳሉን ነው?
And to exonerate them for actions taken while administering their law or in defence of Tsilhqot'in territory prior to the Crown making any official contact with their community.	ግርማይ ገብሩ ወይዘሮ ብርቱካን ለBBC የሰጡትን ቃለመጠይቅ ውሸት መሆኑን ለማረጋገጥ በፌደራል ህግ መሰረት ትግራይ ክልልን ተሻግሮ ኣማራ ክልል ድረስ ዘልቆ ወይዘሮ ብርቱካን ኣነጋግረዋል።
Check the Links: See all the links are working in good condition.	መፍትሄ 2: ሁሉ ገመዶች ተገቢ የስራ ሁኔታ ውስጥ እንደሆኑ ይመልከቱ.
My nightmare life in an orphanage run by the Sisters of Mercy	ቅኔን አሰምቼ ብዕሬን አንግቼ
I dont think i am doing something wrong.	አንድ የተሳሳተ ነገር እያደረግሁ መስሎኛል .
the first building	የመጀመሪያው ግንባታ
I think that I have heard part of this song somewhere, maybe a TV show.	ስለእነዚህ ተከታታይ ፕሮግራሞች አንድ ቦታ አነባለሁ ፣ ምናልባትም በይነመረብ ላይ።
He would begin studying the Bible, especially the four gospels.	መጽሐፍ ቅዱስን፣ በተለይም አራቱን ወንጌሎች ማንበብ ያስደስተኝ ነበር።
Not only the 1500, but also the 5 thousand meter, and the 10 thousand meter.	ይህም ብቻ ሳይሆን የ 1ሺ500 እና 5ሺ ሜትር
Spending money can make a roster look good on paper, but it does not always guarantee success.	ጉግል እያለ ይችላል ፈሰሰ ጽሑፍ መጻፍ ፣ ያደርገዋል አይደለም ሁልጊዜ ስኬታማ ይሆናል ማለት ነው።
It's that power of choice that women need to take full responsibility for.	እንዲህ አድርጎ ቀርጾ የማውጣት ሰፊውን ሓላፊነት የተቀበሉት ሴቶች ናቸው።
Being carried in and out of restaurants is not my favorite.	ሆቴል መሄድና መጋበዝ ደግሞ አዲሳችን አይደለም።
His production has gone down every year.	ምርቱ በየአመቱ ወደቀ ።
She shows scant understanding of how the real world works, and we shouldn't be surprised given her history.	ምትሃት እንዴት እንደሚሰራ ማወቅ ማለት ደግሞ ምንም አይነት ነገር ብንመለከት አለመገረም ማለት እንደሆነ ያስረዳል።
We have this plan.	እኛ ይህንንም እቅድ አለን ።
He made his players believe they belonged to a family.	የአንድ ቤተሰብ አባላት መሆናቸውን ለአንባቢዎቹ ለማሳሰብ ወንድሞች ብሎ ጠራቸው።
Food cravings can increase.	የምግብ ጥሬ ግብዓቶች ብዛት ሊጨምር ሊቀንስ ይችላል።
"The way I describe it to people is that FreeAgent is made for our generation."""	"አጠፋነው ይህም በነጻ መሬታችን የሚገኝ ህዝብ በማስተባበር ነው"" ሲል ይገልጻል ᎐᎐"
The community where does it .	ድርጅቱ ይህን በማድረግ ነው .
You make me feel so good whenever I'm around you.	እናንተ በሸሸግኸኝ ሁሉ ጊዜ ጥሩ ስሜት .
The delay is due to the fact that we found an opportunity for increased functionality and therefore wanted to update the products' software before we launched the blinds in our stores.	መዘግየቱ ተግባራዊነትን ለማሳደግ እድል በማግኘታችን ምክንያት ነው እናም በመደብሮቻችን ውስጥ ዓይነ ስውራን ከመጀመራቸው በፊት የምርቶቹን ሶፍትዌር ማዘመን ፈለግን ።
One day there were a dozen birds.	--ከዕለታት አንድ ቀን ሁለት ራስ ያለው ወፍ ይኖር ነበር።
But you're making the point as if there's a point that Rupert's made this thing what do you think, it's different.	ሀመርህ ላይ እንዲህ ብትጽፍም በተግባር እያደረክ ያለው ግን ሌላ ነው።
It's not a stretch to say that open source has effectively transformed the entire IT landscape!	እንዲሁም ብዙዎቹ ይህ ጽንሰ-ሐሳብ መሆኑን ያመለክታሉ ለትክክለኛው ንግድ የሚቀየሩበት መንገድ ሙሉ በሙሉ ለውጧል!
Guests are greeted by the casino.	እንኩአን ደህና መጡ Casino.
If you're feeling overwhelmed, don't worry - we can help.	እርስዎ ዘንግተውት ከሆነ, ልንረዳቸው የምንችለው አይጨነቁ
After marriage, a woman moved to the residence of her husband's family.	ከጋብቻ በኋላ አንድ ሰው በሚስቱ ቤት ለመኖር መጣ ።
Of his own literary pursuits we hear nothing.	ኃይለስላሴ ላይም አምርሮ ሲናገር አልሰማንም።
God does not MAKE bad things happen to us.	አምላክ መጥፎ ነገሮች እንዲደርሱ አያደርግም።
I pray for those who want to pass on the blessings they've received from You to their families.	መልካም ያደረጉልኝ ሰዎችን ፈጣሪ ከነቤተሰባቸው እንዲባርክ እጸልያለሁ።
"""You have to do what's right by society."""	"""አንተ ሁልጊዜ ኅብረተሰብ ትክክል የሆነውን ማድረግ."
